Regiao - Sigla,Estado - Sigla,Municipio,Revenda,CNPJ da Revenda,Nome da Rua,Numero Rua,Complemento,Bairro,Cep,Produto,Data da Coleta,Valor de Venda,Valor de Compra,Unidade de Medida,Bandeira,Data da Carga ETL
NE,AL,ARAPIRACA,IBN PINTO E SILVA & CIA LTDA,01.242.690/0001-58,RODOVIA AL-110,678,KM    70,CANAFISTULA,57302-802,GNV,02/01/2023,4.89,,R$ / m³,IPIRANGA,2023-11-21
NE,BA,SALVADOR,AUTO POSTO CAMURUPIM LTDA,06.895.357/0001-61,AVENIDA OCTAVIO MANGABEIRA,429,,PITUBA,41830-050,GNV,05/01/2023,4.18,,R$ / m³,RAIZEN,2023-11-21
NE,BA,SALVADOR,POSTO KALILANDIA LTDA,15.151.046/0012-31,AVENIDA LUIS VIANA,2489,,PERNAMBUES,41130-530,GNV,05/01/2023,4.19,,R$ / m³,RAIZEN,2023-11-21
NE,BA,SALVADOR,FERREIRA COMBUSTIVES LTDA,96.841.580/0001-19,RUA MARQUES DE MONTE SANTO,50,,RIO VERMELHO,41940-330,GNV,05/01/2023,4.18,,R$ / m³,RAIZEN,2023-11-21
NE,CE,FORTALEZA,DIAS COMERCIO DE DERIVADOS DE PETROLEO LTDA,08.509.458/0001-82,RODOVIA DOUTOR MENDEL STEINBRUCH,6750,,ARACAPE,60765-005,GNV,05/01/2023,4.99,,R$ / m³,RAIZEN,2023-11-21
NE,CE,MARACANAU,DIAS E ROMA LTDA,12.255.543/0002-10,RODOVIA DOUTOR MENDEL STEINBRUCH,9810,KM    04,DISTRITO INDUSTRIAL I,61939-210,GNV,05/01/2023,4.99,,R$ / m³,VIBRA ENERGIA,2023-11-21
NE,CE,MARACANAU,L & S COMERCIO DE COMBUSTIVEIS LTDA,02.858.003/0003-58,RODOVIA DOUTOR MENDEL STEINBRUCH,9953,0,PAJUÇARA,61910-000,GNV,05/01/2023,4.99,,R$ / m³,VIBRA ENERGIA,2023-11-21
SE,ES,LINHARES,POSTO OURO NEGRO LTDA,02.468.894/0001-74,AVENIDA SAMUEL BATISTA CRUZ,2319,,COLINA,29901-401,GNV,04/01/2023,4.99,,R$ / m³,VIBRA ENERGIA,2023-11-21
SE,ES,VILA VELHA,POSTO MEDITERRÂNEO LTDA.,05.904.268/0001-71,AVENIDA CARLOS LINDENBERG,1380,,COBILANDIA,29111-165,GNV,03/01/2023,4.89,,R$ / m³,VIBRA ENERGIA,2023-11-21
SE,ES,VILA VELHA,POSTO ARIBIRI DO GAS LTDA,04.850.382/0001-01,AVENIDA CARLOS LINDEMBERG,1944,,SANTA INEZ,29108-075,GNV,03/01/2023,4.89,,R$ / m³,VIBRA ENERGIA,2023-11-21
SE,ES,VILA VELHA,POSTO TIBERIO LTDA,01.166.046/0001-48,RODOVIA CARLOS LINDEMBERG,386,,JABURUNA,29123-600,GNV,02/01/2023,4.89,,R$ / m³,VIBRA ENERGIA,2023-11-21
SE,ES,VITORIA,J. S. PETROLEO E COMERCIO LTDA.,08.788.618/0001-70,AVENIDA DANTE MICHELINI,2461,,MATA DA PRAIA,29066-430,GNV,04/01/2023,4.79,,R$ / m³,RAIZEN,2023-11-21
SE,ES,VITORIA,ARARA AZUL REDE DE POSTOS LTDA,04.145.589/0006-81,RUA DONA MARIA ROSA,265,,ANDORINHAS,29045-221,GNV,04/01/2023,4.79,,R$ / m³,RAIZEN,2023-11-21
SE,MG,BETIM,MILLENNIUM DERIVADOS DE PETROLEO LTDA,03.848.560/0001-99,AVENIDA EDMEIA MATTOS LAZAROTTI,1441,,ANGOLA,32604-228,GNV,03/01/2023,5.24,,R$ / m³,ALESAT,2023-11-21
SE,MG,CONTAGEM,POSTO QUATRO RODAS LTDA,16.696.445/0001-98,AVENIDA TITO FULGENCIO,950,,JARDIM INDUSTRIAL,32215-000,GNV,02/01/2023,4.99,,R$ / m³,IPIRANGA,2023-11-21
SE,MG,CONTAGEM,POSTO TROVAO LTDA,01.333.257/0001-28,AVENIDA TITO FULGENCIO,1189,,JARDIM INDUSTRIAL,32215-000,GNV,02/01/2023,4.99,,R$ / m³,VIBRA ENERGIA,2023-11-21
SE,MG,SETE LAGOAS,REDE SANTANA COMBUSTIVEIS E GNV SETE LAGOAS LTDA,04.305.250/0001-90,AVENIDA DR. RENATO AZEREDO,2299,,CHACARA DO PAIVA,35700-312,GNV,03/01/2023,4.85,,R$ / m³,BRANCA,2023-11-21
CO,MS,CAMPO GRANDE,SOUZA & MIRANDA LTDA,03.623.191/0001-36,AVENIDA MARECHAL DEODORO,5712,,COOPHAVILA II,79097-000,GNV,03/01/2023,4.99,,R$ / m³,VIBRA ENERGIA,2023-11-21
CO,MT,CUIABA,JGJ COMERCIO DE PETROLEO LTDA,06.539.780/0001-29,AVENIDA MIGUEL SUTIL,4708,,ALVORADA,78060-000,GNV,02/01/2023,3.19,,R$ / m³,BRANCA,2023-11-21
CO,MT,CUIABA,EMBOAVA DIAS COMERCIO DE COMBUSTIVEIS LTDA,06.248.123/0001-22,AVENIDA GENERAL MELLO,1480,ESQ. C/ MIGUEL SUTIL,CAMPO VELHO,78065-290,GNV,02/01/2023,3.54,,R$ / m³,VIBRA ENERGIA,2023-11-21
NE,PB,BAYEUX,MOTOGAS INDUSTRIA DE COMPRESSAO E COMERCIO DE GAS NATURAL LTDA,01.420.327/0001-85,LOC  BR 230 KM 31,S/N,,ESTRADA,58309-602,GNV,02/01/2023,4.64,,R$ / m³,BRANCA,2023-11-21
NE,PB,CABEDELO,W A BARRETO E CIA LTDA,70.098.470/0004-68,BR-230 KILOMETRO 13,S/N,,KILOMETRO 13,58100-100,GNV,04/01/2023,4.64,,R$ / m³,VIBRA ENERGIA,2023-11-21
NE,PB,CAMPINA GRANDE,MOTOGAS INDUSTRIA DE COMPRESSAO E COMERCIO DE GAS NATURAL LTDA,01.420.327/0004-28,AVENIDA ASSIS CHATEAUBRIAND,2675,,LIBERDADE,58105-421,GNV,03/01/2023,4.89,,R$ / m³,BRANCA,2023-11-21
NE,PB,CAMPINA GRANDE,NOBREGA COMBUSTIVEIS LIMITADA,00.497.918/0001-98,RUA JOAQUIM CAROCA,517,,UNIVERSITARIO,58429-120,GNV,03/01/2023,4.89,,R$ / m³,BRANCA,2023-11-21
NE,PB,CAMPINA GRANDE,POSTO DE COMBUSTIVEIS SAO MARCOS LTDA,01.106.085/0001-50,AVENIDA ASSIS CHATEAUBRIAND,878,,LIBERDADE,58105-000,GNV,03/01/2023,4.89,,R$ / m³,IPIRANGA,2023-11-21
NE,PE,JABOATAO DOS GUARARAPES,SERVICAR S/A,09.798.307/0005-88,AVENIDA ARMINDO MOURA,461,,PIEDADE,54315-070,GNV,03/01/2023,3.99,,R$ / m³,VIBRA ENERGIA,2023-11-21
NE,PE,JABOATAO DOS GUARARAPES,CMA PETROLEO LTDA,05.263.779/0001-51,AVENIDA BERNARDO VIEIRA DE MELO,5160,,CANDEIAS,54450-020,GNV,03/01/2023,3.99,,R$ / m³,RAIZEN,2023-11-21
NE,PE,OLINDA,CEMOPEL CM PETROLEO LTDA,69.943.686/0003-12,AVENIDA JOAQUIM NABUCO,1600,,GUADALUPE,53240-650,GNV,04/01/2023,3.99,,R$ / m³,VIBRA ENERGIA,2023-11-21
NE,PE,PAULISTA,FM COMERCIO E DERIVADOS DE PETROLEO LTDA,04.637.954/0001-60,AVENIDA SENADOR SALGADO FILHO,18,,CENTRO,53400-000,GNV,02/01/2023,3.99,,R$ / m³,VIBRA ENERGIA,2023-11-21
NE,PE,PAULISTA,POSTO ATLANTIDA LTDA,03.771.831/0001-55,AVENIDA ANTONIO CABRAL DE SOUZA,530,QUADRA: 12; : NUCLEO HABITACIONAL ; : MARANGUAPE I;,MARANGUAPE I,53444-360,GNV,02/01/2023,3.99,,R$ / m³,BRANCA,2023-11-21
NE,PE,RECIFE,POSTO BIPIRANGA LTDA,07.090.825/0001-93,AVENIDA RECIFE,3532,,IPSEP,51350-670,GNV,03/01/2023,3.99,,R$ / m³,VIBRA ENERGIA,2023-11-21
NE,PE,RECIFE,M M PETROLEO LTDA,00.935.571/0001-18,AVENIDA GOVERNADOR AGAMENON MAGALHAES,1302,,CAMPO GRANDE,52031-330,GNV,02/01/2023,3.99,,R$ / m³,VIBRA ENERGIA,2023-11-21
NE,PE,RECIFE,PETRO ABDIAS LTDA,04.165.127/0001-11,AVENIDA ABDIAS DE CARVALHO,257,,PRADO,50751-000,GNV,03/01/2023,3.99,,R$ / m³,DISLUB,2023-11-21
NE,PE,RECIFE,CUNHA DERIVADOS DE PETROLEO LTDA,00.216.435/0001-78,AVENIDA MARECHAL MASCARENHAS DE MORAIS,3468,,IMBIRIBEIRA,51200-000,GNV,03/01/2023,3.99,,R$ / m³,VIBRA ENERGIA,2023-11-21
NE,PE,RECIFE,PETRO CAXANGA LTDA,03.737.645/0001-08,AVENIDA CAXANGA,4335,,IPUTINGA,50720-000,GNV,04/01/2023,3.99,,R$ / m³,DISLUB,2023-11-21
S,PR,PONTA GROSSA,POSTO BOA VISTA LTDA,77.488.005/0001-30,AVENIDA DOM PEDRO II,1383,,NOVA RUSSIA,84053-000,GNV,05/01/2023,5.39,,R$ / m³,RAIZEN,2023-11-21
SE,RJ,ARARUAMA,AUTO POSTO PISCA PISCA LTDA,28.529.501/0001-89,RODOVIA AMARAL PEIXOTO,S/N,KM 88,VILA CAPRI,28970-000,GNV,02/01/2023,5.99,,R$ / m³,IPIRANGA,2023-11-21
SE,RJ,CAMPOS DOS GOYTACAZES,ARARA FLUMINENSE COMERCIO DE COMBUSTIVEIS LTDA.,07.614.346/0004-71,AVENIDA ALBERTO TORRES,100,,CENTRO,28010-117,GNV,04/01/2023,5.19,,R$ / m³,RAIZEN,2023-11-21
SE,RJ,CAMPOS DOS GOYTACAZES,CORDEIRO BARROSO PETROLEO LTDA,05.064.564/0001-01,AVENIDA VINTE E OITO DE MARCO,458,,CENTRO,28020-740,GNV,04/01/2023,5.19,,R$ / m³,VIBRA ENERGIA,2023-11-21
SE,RJ,CAMPOS DOS GOYTACAZES,S. G. A. INTERLAGOS COMBUSTIVEIS LTDA,40.218.026/0001-25,AVENIDA VINTE E OITO DE MARCO,143,,PQUE TURFE CLUB,28020-740,GNV,04/01/2023,5.1,,R$ / m³,BRANCA,2023-11-21
SE,RJ,CAMPOS DOS GOYTACAZES,POSTO DE GASOLINA TURF-CLUB LTDA,39.695.887/0001-15,RUA RIACHUELO,652,652/658,TURF CLUB,28013-450,GNV,04/01/2023,5.19,,R$ / m³,IPIRANGA,2023-11-21
SE,RJ,MARICA,AUTO POSTO NOSSA SENHORA PENHA DE FRANCA LTDA,03.610.892/0001-30,RODOVIA ERNANI DO AMARAL PEIXOTO,22944,POSTO                     GLEBA C             LOTE  1A,SAO JOSE DO IMBASSAI,24931-000,GNV,03/01/2023,6.07,,R$ / m³,BRANCA,2023-11-21
SE,RJ,NITEROI,POSTO MONSENHOR ESCRIVA LTDA,04.857.524/0001-54,ALAMEDA SAO BOA VENTURA,246,,FONSECA,24120-196,GNV,02/01/2023,4.49,,R$ / m³,RAIZEN,2023-11-21
SE,RJ,NITEROI,POSTO CANTEIRO DAS BARCAS LTDA,00.941.693/0001-17,RUA VISCONDE DO RIO BRANCO,S/N,CANTEIRO CENTRAL,CENTRO,24020-000,GNV,04/01/2023,4.49,,R$ / m³,IPIRANGA,2023-11-21
SE,RJ,NITEROI,CENTRO AUTOMOTIVO PACO DE SOUZA LTDA.,01.487.893/0001-04,RUA JANSEN DE MELO,417,,CENTRO,24030-220,GNV,02/01/2023,4.99,,R$ / m³,IPIRANGA,2023-11-21
SE,RJ,NOVA IGUACU,POSTO DE COMBUSTIVEIS POINT DE NOVA IGUACU LTDA,08.728.050/0001-00,"ESTRADA ANTIGA RIO SAO PAULO, BR 465",149,KM    32,PARQUE SAO FRANCISCO,26262-020,GNV,03/01/2023,4.74,,R$ / m³,BRANCA,2023-11-21
SE,RJ,NOVA IGUACU,MEGA NOVA IGUACU POSTO DE ABASTECIMENTO LTDA,06.179.155/0001-13,AVENIDA ABILIO AUGUSTO TAVORA,3500,,JARDIM ALVORADA,26210-000,GNV,03/01/2023,4.74,,R$ / m³,BRANCA,2023-11-21
SE,RJ,NOVA IGUACU,POSTO DE GASOLINA VIA LIGHT D IGUACU LTDA,02.754.990/0001-89,RUA CORONEL FRANCISCO SOARES,554,,CENTRO,26220-520,GNV,03/01/2023,4.69,,R$ / m³,BRANCA,2023-11-21
SE,RJ,NOVA IGUACU,POSTO KM 13 DA DUTRA LTDA,00.118.442/0001-37,RODOVIA PRESIDENTE DUTRA,13006,,PRATA,26010-003,GNV,03/01/2023,4.89,,R$ / m³,IPIRANGA,2023-11-21
SE,RJ,NOVA IGUACU,AUTO POSTO LEAO DE IGUACU LTDA,00.488.282/0001-18,AVENIDA ABILIO AUGUSTO TAVORA,4124,,CABUCU,26262-020,GNV,03/01/2023,4.94,,R$ / m³,RAIZEN,2023-11-21
SE,RJ,NOVA IGUACU,POSTO DE GASOLINA VASCO GAMA SOARES LTDA,04.590.222/0001-62,ESTRADA ADRIANOPOLIS,2560,2600,BOTAFOGO,26210-000,GNV,03/01/2023,4.99,,R$ / m³,ALESAT,2023-11-21
SE,RJ,NOVA IGUACU,REDE CH4 DE COMBUSTIVEIS LTDA,04.131.401/0001-31,RUA OSCAR SOARES,1000,,CENTRO,26220-099,GNV,03/01/2023,4.89,,R$ / m³,VIBRA ENERGIA,2023-11-21
SE,RJ,NOVA IGUACU,POSTO LIGHT HIGHWAY LTDA,03.475.408/0001-08,RUA OSCAR SOARES (CONTINUACAO COMO EST DR PLINIO CASA,36,,CENTRO,26220-099,GNV,03/01/2023,4.89,,R$ / m³,BRANCA,2023-11-21
SE,RJ,RIO DE JANEIRO,POSTO E GARAGEM DOM HELDER CAMARA LTDA,04.802.584/0001-70,AVENIDA DOM HELDER CAMARA,4539,,DEL CASTILHO,20771-000,GNV,02/01/2023,4.59,,R$ / m³,RAIZEN,2023-11-21
SE,RJ,RIO DE JANEIRO,AUTO POSTO MAP RECREIO LTDA.,03.661.061/0001-98,AVENIDA DAS AMERICAS,"10,2",,BARRA DA TIJUCA,22793-082,GNV,03/01/2023,4.78,,R$ / m³,VIBRA ENERGIA,2023-11-21
SE,RJ,RIO DE JANEIRO,POSTO DE SERVICOS GRANDE ALIANCA LTDA,05.405.414/0001-14,ESTRADA DA CAROBA,705,,CAMPO GRANDE,23085-590,GNV,04/01/2023,4.49,,R$ / m³,RAIZEN,2023-11-21
SE,RJ,RIO DE JANEIRO,POSTO DE COMBUSTIVEL MEGA ENGENHO NOVO LTDA,07.343.420/0001-10,RUA SOUSA BARROS,636,,ENGENHO NOVO,20961-150,GNV,02/01/2023,4.37,,R$ / m³,IPIRANGA,2023-11-21
SE,RJ,RIO DE JANEIRO,AUTO POSTO DO TRABALHO S/A,03.139.910/0003-00,ESTRADA DOS BANDEIRANTES,7650,,CURICICA,22780-085,GNV,02/01/2023,4.45,,R$ / m³,BRANCA,2023-11-21
SE,RJ,RIO DE JANEIRO,AUTO POSTO DO TRABALHO S/A,03.139.910/0002-29,AVENIDA AYRTON SENNA,5600,,JACAREPAGUA,22775-005,GNV,02/01/2023,4.69,,R$ / m³,BRANCA,2023-11-21
SE,RJ,RIO DE JANEIRO,CENTRO AUTOMOTIVO COOPGAS LTDA,04.851.288/0001-69,RUA ITAPIRU,711,,CATUMBI,20251-031,GNV,03/01/2023,4.59,,R$ / m³,BRANCA,2023-11-21
SE,RJ,RIO DE JANEIRO,AUTO POSTO RECANTO DAS PALMEIRAS LTDA,06.031.327/0001-07,RUA PINTOR LEANDRO JOAQUIM,11,CIDADE DE DEUS,JACAREPAGUA,22770-650,GNV,02/01/2023,4.59,,R$ / m³,RAIZEN,2023-11-21
SE,RJ,RIO DE JANEIRO,AUTO POSTO KARAPITO DA BEIRA LTDA,06.954.238/0001-32,ESTRADA DO MENDANHA,1700,,CAMPO GRANDE,23087-285,GNV,04/01/2023,4.39,,R$ / m³,RAIZEN,2023-11-21
SE,RJ,RIO DE JANEIRO,NOVO HYPERION RIO POSTO DE GASOLINA LTDA,05.395.784/0001-18,AVENIDA ERICO VERISSIMO,971,,BARRA DA TIJUCA,22621-180,GNV,03/01/2023,4.99,,R$ / m³,BRANCA,2023-11-21
SE,RJ,RIO DE JANEIRO,POSTO TULIPA LTDA,05.117.875/0001-91,AVENIDA GEREMARIO DANTAS,1076,,JACAREPAGUA,22760-401,GNV,02/01/2023,4.69,,R$ / m³,VIBRA ENERGIA,2023-11-21
SE,RJ,RIO DE JANEIRO,POSTO DE SERVICOS GEREMARIO DANTAS DE JACAREPAGUA LTDA,05.407.997/0001-12,AVENIDA GEREMARIO DANTAS,585,,PECHINCHA,22740-011,GNV,02/01/2023,4.69,,R$ / m³,BRANCA,2023-11-21
SE,RJ,RIO DE JANEIRO,BRAGAL BENFICA AUTO POSTO DE ABASTECIMENTO E GARAGE LTD,05.022.562/0001-50,RUA SÃO LUIZ GONZAGA,1951,,SÃO CRISTÓVÃO,20910-063,GNV,02/01/2023,4.47,,R$ / m³,RAIZEN,2023-11-21
SE,RJ,RIO DE JANEIRO,CHAMPGAS DO BRASIL LIMITADA,05.311.112/0001-87,RUA SOUZA BARROS,404,,ENGENHO NOVO,20961-150,GNV,04/01/2023,4.59,,R$ / m³,VIBRA ENERGIA,2023-11-21
SE,RJ,RIO DE JANEIRO,AUTO POSTO M R DA TAQUARA LTDA,05.569.100/0001-57,ESTRADA MAL MIGUEL SALAZAR MENDES DE MORAES,600,,JACAREPAGUA,22770-330,GNV,02/01/2023,4.59,,R$ / m³,BRANCA,2023-11-21
SE,RJ,RIO DE JANEIRO,AUTO POSTO SAO FURTUOSO LTDA,05.374.614/0001-57,ESTRADA DOS BANDEIRANTES,130,,TAQUARA,22710-112,GNV,02/01/2023,4.58,,R$ / m³,BRANCA,2023-11-21
SE,RJ,RIO DE JANEIRO,POSTO DE ABASTECIMENTO ALEGAS DO CAJU LTDA,05.535.231/0001-13,RUA JOSE CLEMENTE,134/136,,SÃO CRISTÓVÃO,20930-420,GNV,02/01/2023,4.45,,R$ / m³,BRANCA,2023-11-21
SE,RJ,RIO DE JANEIRO,AUTO POSTO CAMPUSCAO LTDA,02.254.839/0001-81,RUA AUGUSTO DE VASCONCELOS,1290,,CAMPO GRANDE,23045-120,GNV,04/01/2023,4.59,,R$ / m³,RAIZEN,2023-11-21
SE,RJ,RIO DE JANEIRO,POSTO DE ABASTECIMENTO A GAS PERFEITO LTDA,05.116.904/0001-09,RUA PREFEITO OLIMPIO DE MELO,1083-A,,VASCO DA GAMA,20930-003,GNV,02/01/2023,4.59,,R$ / m³,VIBRA ENERGIA,2023-11-21
SE,RJ,RIO DE JANEIRO,WEST POINT CAR POSTO DE ABASTECIMENTO LTDA,04.515.980/0001-16,ESTRADA DO MENDANHA,1518,,CAMPO GRANDE,23087-280,GNV,04/01/2023,4.34,,R$ / m³,BRANCA,2023-11-21
SE,RJ,RIO DE JANEIRO,POSTO PALACIO GUANABARA LTDA,04.816.108/0001-08,RUA PINHEIRO MACHADO,83,83/FUNDOS,LARANJEIRAS,22231-090,GNV,03/01/2023,4.87,,R$ / m³,RAIZEN,2023-11-21
SE,RJ,RIO DE JANEIRO,POSTO DE ABASTECIMENTO A GAS SANTA AMELIA LTDA,04.198.018/0001-09,RUA SANTA AMELIA,45,,TIJUCA,20260-030,GNV,03/01/2023,4.79,,R$ / m³,VIBRA ENERGIA,2023-11-21
SE,RJ,RIO DE JANEIRO,POSTO DE ABASTECIMENTO C. A - 1 MERCEDES LTDA,04.157.872/0001-19,AVENIDA CESARIO DE MELO,4593,,CAMPO GRANDE,23055-002,GNV,04/01/2023,4.49,,R$ / m³,BRANCA,2023-11-21
SE,RJ,RIO DE JANEIRO,AUTO POSTO CEDRO DO LIBANO LTDA,03.797.684/0001-92,AVENIDA CESARIO DE MELO,1860,,CAMPO GRANDE,23055-002,GNV,04/01/2023,4.39,,R$ / m³,BRANCA,2023-11-21
SE,RJ,RIO DE JANEIRO,POSTO E SERVIOS DIMANCHES LTDA,03.536.543/0001-16,ESTRADA DOS BANDEIRANTES,3576,,JACAREPAGUA,22775-110,GNV,02/01/2023,4.67,,R$ / m³,RAIZEN,2023-11-21
SE,RJ,RIO DE JANEIRO,POSTO DE ABASTECIMENTO IMPERIAL 2000 LTDA,03.447.202/0001-74,RUA FRANCISCO EUGENIO,400,,SAO CRISTOVAO,20941-120,GNV,02/01/2023,4.57,,R$ / m³,VIBRA ENERGIA,2023-11-21
SE,RJ,RIO DE JANEIRO,POSTO DE SERVICOS DENGOSO LTDA,03.438.999/0001-43,ESTRADA DO MONTEIRO,50,,CAMPO GRANDE,23045-830,GNV,04/01/2023,4.59,,R$ / m³,IPIRANGA,2023-11-21
SE,RJ,RIO DE JANEIRO,AUTO POSTO E SERVICO BAM BAM LTDA,03.325.858/0001-14,AVENIDA BRASIL,8108,,RAMOS,21030-001,GNV,04/01/2023,4.54,,R$ / m³,BRANCA,2023-11-21
SE,RJ,RIO DE JANEIRO,ABASTECIMENTO DE COMBUSTIVEIS RIO DO A LTDA,02.850.122/0001-00,ESTRADA RIO DO A,1425,,CAMPO GRANDE,23080-300,GNV,04/01/2023,4.49,,R$ / m³,IPIRANGA,2023-11-21
SE,RJ,RIO DE JANEIRO,AUTO CENTER MAYARA LTDA,02.814.354/0001-03,ESTRADA MONTEIRO DO,298,,CAMPO GRANDE,23045-830,GNV,04/01/2023,4.49,,R$ / m³,VIBRA ENERGIA,2023-11-21
SE,RJ,RIO DE JANEIRO,AUTO POSTO DE ABASTECIMENTO DO PRE LTDA,02.802.238/0001-66,ESTRADA DO PRE,1465,,CAMPO GRANDE,23013-550,GNV,04/01/2023,4.39,,R$ / m³,VIBRA ENERGIA,2023-11-21
SE,RJ,RIO DE JANEIRO,FRENTANA POSTO DE SERVICO LTDA,02.776.121/0001-55,ESTRADA DOS BANDEIRANTES,7800,,CURICICA,22780-084,GNV,02/01/2023,4.38,,R$ / m³,BRANCA,2023-11-21
SE,RJ,RIO DE JANEIRO,NORDESTE PETROLEO LTDA,02.677.639/0001-31,AVENIDA EMBAIXADOR ABELARDO BUENO,2300,LOTE  93 LTM 22664,BARRA DA TIJUCA,22775-040,GNV,03/01/2023,4.59,,R$ / m³,VIBRA ENERGIA,2023-11-21
SE,RJ,RIO DE JANEIRO,AUTO POSTO GARDÊNIA AZUL LTDA,02.464.455/0001-93,AVENIDA TENENTE CORONEL MUNIZ DE ARAGÃO,S/N,LOTES 1 E 2,JACAREPAGUÁ,22765-002,GNV,02/01/2023,4.59,,R$ / m³,VIBRA ENERGIA,2023-11-21
SE,RJ,RIO DE JANEIRO,POSTO DE ABASTECIMENTO AIMEE LTDA,02.236.460/0001-49,ESTRADA DO MATO ALTO,503,,CAMPO GRANDE,23036-150,GNV,04/01/2023,4.49,,R$ / m³,VIBRA ENERGIA,2023-11-21
SE,RJ,RIO DE JANEIRO,CENTRO AUTOMOTIVO ANCORA LTDA,01.868.383/0001-87,RUA CORONEL TEDIN,40,,JACAREPAGUA,22740-011,GNV,02/01/2023,4.68,,R$ / m³,IPIRANGA,2023-11-21
SE,RJ,RIO DE JANEIRO,POSTO DE GASOLINA E GARAGEM ECHEVERRIA LTDA.,00.821.459/0001-56,RUA SENADOR BERNADO MONTEIRO,99-A,,BENFICA,20911-280,GNV,02/01/2023,4.59,,R$ / m³,RAIZEN,2023-11-21
SE,RJ,RIO DE JANEIRO,POSTO MIRANTE DA TAQUARA LTDA,00.792.114/0001-11,ESTRADA DOS BANDEIRANTES,1393,,JACAREPAGUA,22710-571,GNV,02/01/2023,4.59,,R$ / m³,VIBRA ENERGIA,2023-11-21
SE,RJ,SAO GONCALO,GETGAS DO BRASIL POSTO DE GAS NATURAL VEICULAR LTDA,08.084.070/0001-87,AVENIDA MARICA,"2,215",,COLUMBANDE,24451-045,GNV,03/01/2023,4.48,,R$ / m³,BRANCA,2023-11-21
SE,RJ,SAO GONCALO,POSTO DE GASOLINA STOP SHOP LTDA,07.611.541/0001-03,RUA MANOEL JOAO GONCALVES,674,,ALCANTARA,24711-080,GNV,03/01/2023,4.69,,R$ / m³,RAIZEN,2023-11-21
SE,RJ,SAO GONCALO,POSTO PLANETA SATURNO DE COMBUSTIVEIS LTDA,05.862.352/0001-70,AVENIDA BISPO DOM JOAO DA MATA,10,,VISTA ALEGRE,24725-282,GNV,03/01/2023,4.58,,R$ / m³,IPIRANGA,2023-11-21
SE,RJ,SAO GONCALO,POSTO LINDO PARQUE LTDA,05.507.103/0001-66,AVENIDA PRESIDENTE HUMBERTO DE ALENCAR CASTELO BRANCO,1910,,LINDO PARQUE,24420-006,GNV,03/01/2023,4.7,,R$ / m³,BRANCA,2023-11-21
SE,RJ,SAO GONCALO,AUTO POSTO PRIMEIRAO DO LARANJAL LTDA,04.584.261/0001-57,AVENIDA BISPO DOM JOAO DA MATA,SN,LOTE A,VISTA ALEGRE,24722-525,GNV,03/01/2023,4.58,,R$ / m³,VIBRA ENERGIA,2023-11-21
SE,RJ,SAO GONCALO,POSTO DE GASOLINA MARANATHA LTDA,03.333.153/0001-49,RUA CORONEL SERRADO,106,,ZE GAROTO,24440-000,GNV,03/01/2023,4.69,,R$ / m³,IPIRANGA,2023-11-21
SE,RJ,SAO JOAO DE MERITI,AUTO POSTO VILAR DOS TELES LTDA,05.863.434/0001-39,AVENIDA AUTOMOVEL CLUBE,S/N,"LOTES 7, 8 E 9 - QD B",VILAR DOS TELES,25515-126,GNV,02/01/2023,4.59,,R$ / m³,BRANCA,2023-11-21
SE,RJ,SAO JOAO DE MERITI,TURNPIKE 4321 AUTO POSTO BAR E LANCHONETE BAZAR E SERVICOS AUTOMOTIVOS LTDA.,01.575.701/0001-11,RODOVIA PRESIDENTE DUTRA,4321,KM 04,JARDIM JOSE BONIFACIO,25515-230,GNV,02/01/2023,4.99,,R$ / m³,BRANCA,2023-11-21
SE,RJ,VOLTA REDONDA,POSTO DE COMBUSTIVEL CONFORTACO LTDA,07.481.349/0001-31,RODOVIA DOS METALURGICOS,941,,JARDIM BELVEDERE,27253-005,GNV,02/01/2023,5.19,,R$ / m³,BRANCA,2023-11-21
SE,RJ,VOLTA REDONDA,POSTO JK 2000 LTDA,02.541.489/0001-34,AVENIDA ALM DE BARROS NUNES,1000,,VILA MURY,27273-010,GNV,02/01/2023,5.59,,R$ / m³,RAIZEN,2023-11-21
SE,RJ,VOLTA REDONDA,POSTO GRANDE PARADA LTDA,00.071.508/0001-80,RODOVIA DOS METALURGICOS,8300,,CASA DE PEDRA,27258-000,GNV,02/01/2023,4.99,,R$ / m³,RAIZEN,2023-11-21
NE,RN,NATAL,MENDES PETROLEO LTDA,09.142.543/0001-18,AVENIDA PRUDENTE DE MORAIS,5050,,LAGOA NOVA,59063-200,GNV,04/01/2023,4.19,,R$ / m³,BRANCA,2023-11-21
NE,RN,NATAL,SOCIEDADE DOIS IRMAOS LTDA,08.208.910/0001-76,RUA MARIO NEGOCIO,2298,,QUINTAS,59037-155,GNV,03/01/2023,4.17,,R$ / m³,BRANCA,2023-11-21
S,RS,CANOAS,COMERCIAL BUFFON COMBUSTIVEIS E TRANSPORTES LIMITADA,93.489.243/0026-74,AVENIDA GETULIO VARGAS,7291,,IGARA,92410-133,GNV,02/01/2023,5.59,,R$ / m³,VIBRA ENERGIA,2023-11-21
S,RS,CAXIAS DO SUL,POSTO RAMAR - COMERCIO DE COMBUSTIVEIS LTDA.,05.379.733/0001-00,AVENIDA SAO LEOPOLDO,940,,SAO LEOPOLDO,95097-350,GNV,02/01/2023,5.99,,R$ / m³,IPIRANGA,2023-11-21
S,RS,SAPIRANGA,POSTO FERRABRAZ LTDA,04.750.332/0001-44,RODOVIA RS-239,200,KM 30,VOO LIVRE,93822-200,GNV,04/01/2023,5.29,,R$ / m³,BRANCA,2023-11-21
S,SC,CRICIUMA,COMERCIO DE COMBUSTIVEIS PINHEIRAO EIRELI,06.935.003/0001-01,RUA CONEGO ANIBAL MARIA DI FRANCIA,1075,SALA  01,PINHEIRINHO,88804-360,GNV,03/01/2023,5.97,,R$ / m³,BRANCA,2023-11-21
S,SC,CRICIUMA,COMERCIAL DE COMBUSTIVEIS ROSSO LTDA,78.885.019/0001-50,AVENIDA CENTENARIO,1717,,SANTO ANTONIO,88809-000,GNV,03/01/2023,5.97,,R$ / m³,RAIZEN,2023-11-21
S,SC,JARAGUA DO SUL,POSTO AGRICOPEL LTDA.,83.488.882/0001-03,RUA WALTER MARQUARDT,467,,VILA NOVA,89259-700,GNV,05/01/2023,5.49,,R$ / m³,RAIZEN MIME,2023-11-21
S,SC,PALHOCA,MARQUINHO COMBUSTIVEIS E SERVICOS LTDA,05.991.479/0001-99,RUA NOSSA SENHORA APARECIDA,S/N,,JARDIM ELDORADO,88133-400,GNV,02/01/2023,5.59,,R$ / m³,ALESAT,2023-11-21
S,SC,TUBARAO,POSTO OFICINAS LTDA,78.867.769/0001-07,RUA ALTAMIRO GUIMARAES,1735,,OFICINAS,88702-100,GNV,04/01/2023,5.99,,R$ / m³,BRANCA,2023-11-21
S,SC,TUBARAO,AUTO POSTO DISNEY LTDA,00.100.521/0001-10,AVENIDA TANCREDO NEVES,100,,REVOREDO,88704-700,GNV,04/01/2023,5.99,,R$ / m³,IPIRANGA,2023-11-21
NE,SE,ARACAJU,KLEBER SANTOS BATISTA LTDA,13.042.882/0001-08,AVENIDA DESEMBARGADOR MAYNARD,770,,CIRURGIA,49055-210,GNV,05/01/2023,5.09,,R$ / m³,BRANCA,2023-11-21
SE,SP,ARARAQUARA,AUTO POSTO FONTE LUMINOSA LTDA,45.273.885/0001-30,RUA JAPÃO,38,0,JARDIM PRIMAVERA,14802-300,GNV,03/01/2023,5.55,,R$ / m³,IPIRANGA,2023-11-21
SE,SP,CATANDUVA,VENI COMERCIO DE COMBUSTIVEIS LTDA,02.268.482/0001-90,RUA OLIMPIA,680,,VL PAULISTA,15803-025,GNV,02/01/2023,5.79,,R$ / m³,VIBRA ENERGIA,2023-11-21
SE,SP,GUARATINGUETA,POSTO TRES GARCAS LTDA.,48.551.071/0001-09,RODOVIA PRESIDENTE DUTRA,224,KM    59,JARDIM MODELO,12524-800,GNV,03/01/2023,5.66,,R$ / m³,VIBRA ENERGIA,2023-11-21
SE,SP,GUARATINGUETA,POSTO CLUBE DOS 500 LTDA.,07.235.512/0001-86,RODOVIA PRESIDENTE DUTRA,S/N,KM    60,BELVEDERE CLUBE DOS 500,12522-640,GNV,03/01/2023,5.66,,R$ / m³,IPIRANGA,2023-11-21
SE,SP,GUARULHOS,CECAP GUARULHO AUTO POSTO LTDA.,08.189.579/0001-94,RUA ASEA,219,,SÃO ROQUE,07190-020,GNV,03/01/2023,4.89,,R$ / m³,RAIZEN,2023-11-21
SE,SP,HORTOLANDIA,CENTRO COMERCIAL DE COMBUSTIVEIS HORTOLANDIA LTDA,05.621.147/0001-12,AVENIDA ANHANGUERA,150,,VILA REAL,13187-000,GNV,04/01/2023,5.37,,R$ / m³,BRANCA,2023-11-21
SE,SP,JUNDIAI,GAS JUNDIAI POSTO AUTOMOTIVO LTDA,04.492.860/0001-40,AVENIDA QUATORZE DE DEZEMBRO,3200,,VILA MAFALDA,13206-105,GNV,05/01/2023,4.89,,R$ / m³,IPIRANGA,2023-11-21
SE,SP,JUNDIAI,WF JUNDIAI - COMERCIO E SERVICOS AUTOMOTIVOS LTDA,03.880.729/0001-98,RUA BRASIL,2272,,VILA RAMI,13212-390,GNV,05/01/2023,4.89,,R$ / m³,BRANCA,2023-11-21
SE,SP,MATAO,AUTO POSTO RESIDENCIAL BENASSI LTDA,03.419.315/0001-66,AVENIDA ALBERTO BENASSI,2169,,NOVA MATAO,15990-585,GNV,03/01/2023,5.89,,R$ / m³,IPIRANGA,2023-11-21
SE,SP,MAUA,K.L.L. POSTO DE ABASTECIMENTO E SERVICOS LTDA,03.275.498/0001-93,AVENIDA PAPA JOAO XXIII,2009,,SERTAOZINHO,09370-800,GNV,05/01/2023,5.29,,R$ / m³,IPIRANGA,2023-11-21
SE,SP,MAUA,OITENTA AUTO POSTO LTDA,45.563.079/0001-05,AVENIDA CAPITÃO JOÃO,614,,CENTRO,09360-120,GNV,05/01/2023,5.29,,R$ / m³,RAIZEN,2023-11-21
SE,SP,MOGI DAS CRUZES,AUTO POSTO JOAO XXIII - II LTDA,03.096.968/0001-51,AVENIDA JOSE MELONI,1280,A,VILA MOGILAR,08773-120,GNV,02/01/2023,5.39,,R$ / m³,VIBRA ENERGIA,2023-11-21
SE,SP,MOGI DAS CRUZES,AUTO POSTO TITANS LTDA,02.599.842/0001-37,RUA FREDERICO R. JAEGHER,27,,VL. BERNADOTTI,08735-620,GNV,02/01/2023,5.39,,R$ / m³,IPIRANGA,2023-11-21
SE,SP,MOGI GUACU,AUTO POSTO PARQUE CIDADE NOVA LTDA,55.509.384/0001-64,AVENIDA BANDEIRANTES,1135,,PARQUE CIDADE NOVA,13846-010,GNV,05/01/2023,4.94,,R$ / m³,RAIZEN,2023-11-21
SE,SP,MOGI GUACU,COMERCIAL GUACU DE PRODUTOS DE PETROLEO LTDA,44.765.741/0001-39,AVENIDA WALDEMAR ARMANI,300,,JD. GUACU MIRIM,13844-450,GNV,05/01/2023,4.99,,R$ / m³,VIBRA ENERGIA,2023-11-21
SE,SP,MOGI MIRIM,AUTO POSTO RVM MAX LTDA,07.822.477/0001-00,"RODOVIA SP 340  , KM  159,9",S/N,,MARIA BEATRIZ,13803-070,GNV,05/01/2023,5.19,,R$ / m³,BRANCA,2023-11-21
SE,SP,POA,PORTAL DE POA AUTO POSTO LTDA,04.576.763/0001-36,RODOVIA JOAO AFONSO DE SOUZA CASTELLANO,1890,,VILA JAU,08559-000,GNV,04/01/2023,4.89,,R$ / m³,BRANCA,2023-11-21
SE,SP,SANTO ANDRE,LIVIA AUTO POSTO LTDA,01.625.142/0001-07,AVENIDA JOSE ANTONIO ALMEIDA AMAZONAS,551,,VL GUIOMAR,09090-390,GNV,02/01/2023,5.59,,R$ / m³,VIBRA ENERGIA,2023-11-21
SE,SP,SANTO ANDRE,CATEQUESE AUTO POSTO LTDA,01.384.454/0001-76,AVENIDA CATEQUESE,1263,,VILA GUIOMAR,09090-401,GNV,02/01/2023,5.59,,R$ / m³,VIBRA ENERGIA,2023-11-21
SE,SP,SAO PAULO,SERVIÇOS AUTOMOTIVOS PEDRODAVI LTDA.,08.859.824/0001-23,RUA PAULO ANDREGHETTI,1484,,PARI,03022-000,GNV,02/01/2023,4.45,,R$ / m³,BRANCA,2023-11-21
SE,SP,SAO PAULO,POSTO DE SERVICOS SANTA RITA DO MONTE AZUL LTDA,07.695.106/0001-04,ESTRADA DE ITAPECERICA,1422,,VILA DAS BELEZAS,05835-002,GNV,02/01/2023,4.89,,R$ / m³,VIBRA ENERGIA,2023-11-21
SE,SP,SAO PAULO,AUTO POSTO DUQUE SALIM MALUF LTDA.,07.846.558/0001-31,AVENIDA SALIM FARAH MALUF,3400,,VILA BERTIOGA,03076-000,GNV,03/01/2023,4.99,,R$ / m³,VIBRA ENERGIA,2023-11-21
SE,SP,SAO PAULO,AUTO POSTO DUQUE ZAGOTTIS LTDA.,07.846.543/0001-73,AVENIDA ALBERTO DE ZAGOTTIS,567,,JURUBATUBA,04676-000,GNV,02/01/2023,5.29,,R$ / m³,VIBRA ENERGIA,2023-11-21
SE,SP,SAO PAULO,BR SUL AUTO POSTO LTDA,07.014.792/0001-00,AVENIDA SENADOR TEOTONIO VILELA,2631,,CIDADE DUTRA,04801-010,GNV,03/01/2023,4.99,,R$ / m³,BRANCA,2023-11-21
SE,SP,SAO PAULO,CENTRO DE ABASTECIMENTO DE GAS MILENA LTDA,04.815.245/0001-28,AVENIDA OTAVIANO ALVES DE LIMA,3926,,NOSSA SRA DO O,02901-000,GNV,02/01/2023,4.99,,R$ / m³,RAIZEN,2023-11-21
SE,SP,SAO PAULO,ARGETAX ADMINISTRACAO E PARTICIPACOES EM EMPREENDIMENTOS COMERCIAIS LTDA,04.383.988/0004-19,AVENIDA ELISEU DE ALMEIDA,2481,,BUTANTA,05330-000,GNV,02/01/2023,5.69,,R$ / m³,IPIRANGA,2023-11-21
SE,SP,SAO PAULO,CENTRO AUTOMOTIVO ARCO DO TRIUNFO LTDA.,04.966.902/0001-38,RUA DR. MOISES KAHAN,501,,BARRA FUNDA,01139-040,GNV,02/01/2023,5.09,,R$ / m³,VIBRA ENERGIA,2023-11-21
SE,SP,SAO PAULO,AUTO POSTO LIDER BANDEIRAS LTDA,05.025.949/0001-60,AVENIDA PRESIDENTE CASTELO BRANCO,3345,,BOM RETIRO,01142-200,GNV,02/01/2023,4.59,,R$ / m³,VIBRA ENERGIA,2023-11-21
SE,SP,SAO PAULO,CENTRO AUTOMOTIVO FINLANDIA LTDA,01.837.816/0001-37,RUA LAVARIZ,3,,PQ COLONIAL,04610-080,GNV,03/01/2023,4.99,,R$ / m³,IPIRANGA,2023-11-21
SE,SP,SAO PAULO,CENTRO AUTOMOTIVO PALACETE DAS AGUIAS LTDA,04.298.168/0001-86,AVENIDA WASHINGTON LUIZ,4604,,JARDIM AEROPORTO,04626-000,GNV,02/01/2023,4.79,,R$ / m³,IPIRANGA,2023-11-21
SE,SP,SAO PAULO,AUTO POSTO PLAYGAS LTDA,03.170.356/0001-61,AVENIDA MARQ DE SAO VICENTE,999,,VARZEA DA BARRA FUNDA,01139-003,GNV,02/01/2023,5.29,,R$ / m³,IPIRANGA,2023-11-21
SE,SP,SAO PAULO,CENTRO AUTOMOTIVO LAGOS ANDINOS LTDA,02.559.929/0001-80,AVENIDA MIGUEL ESTEFNO,2309,,SAUDE,04301-012,GNV,02/01/2023,5.39,,R$ / m³,IPIRANGA,2023-11-21
SE,SP,SAO PAULO,POSTO DE SERVIÇOS AVANTGARDE LTDA,02.328.737/0001-63,AVENIDA ENGENHEIRO CAETANO ÁLVARES,4605,,VILA ROMERO,02413-000,GNV,02/01/2023,4.99,,R$ / m³,RAIZEN,2023-11-21
