SE,RJ,PETROPOLIS,BR CORONEL VEIGA COMBUSTIVEIS LTDA,10.514.757/0001-57,RUA CORONEL VEIGA,687,,CORONEL VEIGA,25655-156,GNV,09/01/2023,4.99,,R$ / m³,VIBRA ENERGIA,2023-11-21
SE,RJ,RIO DE JANEIRO,AUTO POSTO DO TRABALHO S/A,03.139.910/0017-05,RUA NETUNO,662,,PAVUNA,21525-690,GNV,11/01/2023,4.76,,R$ / m³,BRANCA,2023-11-21
SE,RJ,SAO JOAO DE MERITI,AUTO POSTO ACONCHEGO DE MERITI LTDA,10.925.601/0001-69,RUA CANDIDO MAIA,12,,AGOSTINHO PORTO,25510-050,GNV,09/01/2023,4.79,,R$ / m³,BRANCA,2023-11-21
SE,RJ,DUQUE DE CAXIAS,AUTO POSTO DO TRABALHO S/A,03.139.910/0025-15,RODOVIA WASHINGTON LUIZ,12420,SITIO 21                  AREA C1,PILAR,25213-005,GNV,11/01/2023,4.89,,R$ / m³,BRANCA,2023-11-21
SE,SP,SAO JOSE DOS CAMPOS,MASTER VALE AUTO POSTO LTDA .,11.233.578/0001-04,AVENIDA CIDADE JARDIM,764,,CID. JARDIM,12231-675,GNV,09/01/2023,4.89,,R$ / m³,IPIRANGA,2023-11-21
SE,RJ,NOVA FRIBURGO,FRIGÁS AUTO POSTO E SERVIÇOS LTDA.,10.733.680/0001-06,AVENIDA ANTONIO MARIO DE AZEVEDO,436,AREA - A,DUAS PEDRAS,28613-000,GNV,11/01/2023,5.99,,R$ / m³,BRANCA,2023-11-21
SE,RJ,DUQUE DE CAXIAS,AUTO POSTO DO TRABALHO S/A,03.139.910/0022-72,RODOVIA WASHINGTON LUIZ,14131,,CHACARAS RIO-PETROPOLIS,25230-005,GNV,11/01/2023,4.89,,R$ / m³,BRANCA,2023-11-21
SE,RJ,SAO JOAO DE MERITI,AUTO POSTO DO TRABALHO S/A,03.139.910/0021-91,AVENIDA AUTOMOVEL CLUBE,1215,,JARDIM JOSE BONIFACIO,25565-171,GNV,09/01/2023,4.68,,R$ / m³,BRANCA,2023-11-21
SE,SP,JUNDIAI,AUTO POSTO CAMINHO DOS PASSAROS LTDA,10.862.556/0001-40,AVENIDA ANTONIO FREDERICO OZANAN,3400,,CENTRO,13215-485,GNV,12/01/2023,4.87,,R$ / m³,BRANCA,2023-11-21
S,RS,PORTO ALEGRE,SIM REDE DE POSTOS LTDA,07.473.735/0037-92,AVENIDA SAO PEDRO,55,,SAO GERALDO,90230-120,GNV,09/01/2023,5.56,,R$ / m³,VIBRA ENERGIA,2023-11-21
SE,SP,SAO PAULO,ARGETAX ADMINISTRACAO E PARTICIPACOES EM EMPREENDIMENTOS COMERCIAIS LTDA,04.383.988/0006-80,RUA CHICO PONTES,1292,,VILA GUILHERME,02067-002,GNV,09/01/2023,4.89,,R$ / m³,RAIZEN,2023-11-21
CO,MS,CAMPO GRANDE,ALLOY AUTO POSTO I LTDA,11.837.316/0001-59,AVENIDA FERNANDO CORREA DA COSTA,630,,CENTRO,79004-310,GNV,12/01/2023,4.69,,R$ / m³,BRANCA,2023-11-21
SE,SP,SAO CARLOS,ARTAM COMÉRCIO DE COMBUSTÍVEIS LTDA,10.579.113/0001-47,AVENIDA   DOUTOR TEIXEIRA DE BARROS,1258,,VILA PRADO,13574-033,GNV,10/01/2023,5.59,,R$ / m³,IPIRANGA,2023-11-21
SE,RJ,MARICA,POSTO DE COMBUSTIVEIS PIEDRAS DEL MAR LTDA.,11.270.315/0001-75,RODOVIA ERNANI DO AMARAL PEIXOTO,33,N/T,ITAPEBA,24912-710,GNV,11/01/2023,6.71,,R$ / m³,BRANCA,2023-11-21
SE,RJ,SAQUAREMA,CENTRO AUTOMOTIVO SAQUAREMA GAS LTDA,13.261.358/0001-10,RUA ADILSON OLIVEIRA,SN,LOTE  29,SAO GERALDO ( BACAXA),28995-175,GNV,11/01/2023,5.99,,R$ / m³,BRANCA,2023-11-21
NE,BA,ALAGOINHAS,2 A COMERCIO DE COMBUSTIVEIS GNV E LUBRIFICANTES LTDA,14.238.511/0001-50,RODOVIA BR 101  KM  116,S/N,SALA  01,CENTRO,48005-440,GNV,12/01/2023,4.29,,R$ / m³,PETROBAHIA,2023-11-21
S,RS,PORTO ALEGRE,CONJUNTO COMERCIAL OREL LTDA,01.367.677/0006-30,AVENIDA CAIRU,1477,,SAO JOAO,90230-031,GNV,09/01/2023,5.24,,R$ / m³,BRANCA,2023-11-21
SE,RJ,TERESOPOLIS,POSTO 01 TREVO ERMITAGE DE TERESOPOLIS LTDA,12.880.259/0001-53,RUA WILHELM CRISTIAN KLEME,850,,ERMITAGE,25975-550,GNV,11/01/2023,4.98,,R$ / m³,IPIRANGA,2023-11-21
S,RS,PORTO ALEGRE,SIM REDE DE POSTOS LTDA,07.473.735/0059-06,AVENIDA ASSIS BRASIL,9216,,SARANDI,91140-000,GNV,09/01/2023,5.59,,R$ / m³,BRANCA,2023-11-21
S,RS,SAO LEOPOLDO,NOBRE ABASTECEDORA DE COMBUSTIVEIS LTDA,03.179.047/0001-52,AVENIDA PAROBE,1200,,SCHARLAU,93140-000,GNV,10/01/2023,5.46,,R$ / m³,VIBRA ENERGIA,2023-11-21
SE,RJ,VOLTA REDONDA,ALIANÇA RETIRO VR COMERCIO DE GNV LTDA,12.937.073/0001-93,RUA GOMES FILHO,44,,RETIRO,27275-090,GNV,11/01/2023,5.29,,R$ / m³,BRANCA,2023-11-21
N,AM,MANAUS,AMAZON COMBUSTIVEIS PARA VEICULOS E CONSTRUCOES LTDA,10.988.014/0013-52,AVENIDA   TORQUATO TAPAJOS,7841,,TARUMA,69041-025,GNV,10/01/2023,4.19,,R$ / m³,ATEM' S,2023-11-21
NE,BA,SALVADOR,SODIC SOCIEDADE REVENDEDORA DE COMBUSTIVEIS LTDA,15.847.874/0010-47,RODOVIA BA 526,S/N,KM    05,CASSANGUE,41505-220,GNV,12/01/2023,4.29,,R$ / m³,VIBRA ENERGIA,2023-11-21
S,SC,ITAJAI,SIM REDE DE POSTOS LTDA,07.473.735/0073-56,RODOVIA BR 101,4850-A,"KM    116,8",SALSEIROS,88317-000,GNV,09/01/2023,6.09,,R$ / m³,BRANCA,2023-11-21
SE,RJ,BELFORD ROXO,AUTO POSTO DO TRABALHO S/A,03.139.910/0037-59,AVENIDA JOAQUIM DA COSTA LIMA,14201,,DOS FERREIRAS,26183-604,GNV,09/01/2023,4.99,,R$ / m³,BRANCA,2023-11-21
SE,SP,SUZANO,POSTO DE SERVICOS AUTOMOTIVOS E COMERCIO DE COMBUSTIVEIS ABU-DHABI LTDA,17.449.816/0001-08,RUA DOUTOR PRUDENTE DE MORAES,4135,,VILA SANTANA,08613-900,GNV,09/01/2023,4.89,,R$ / m³,IPIRANGA,2023-11-21
S,RS,CACHOEIRINHA,SAN FRANCISCO COMERCIAL DE COMBUSTIVEIS  LTDA,17.261.255/0001-00,AVENIDA FLORES DA CUNHA,3793,,VILA BOM PRINCIPIO,94950-001,GNV,10/01/2023,5.29,,R$ / m³,IPIRANGA,2023-11-21
SE,RJ,ARARUAMA,AUTO POSTO MONTEIROS DE ARARUAMA LTDA,12.573.801/0001-25,RODOVIA AMARAL PEIXOTO,S/N,KM 83 LT A 1 E B 1,CAPA AZUL,28970-000,GNV,10/01/2023,5.98,,R$ / m³,BRANCA,2023-11-21
SE,RJ,ITABORAI,POSTO DE COMBUSTIVEIS TREVO DE MANILHA LTDA,18.936.123/0001-02,RODOVIA GOVERNADOR MARIO COVAS - BR 101,S/N,"KM    KM 297,5",MANILHA,24855-148,GNV,12/01/2023,4.87,,R$ / m³,RAIZEN,2023-11-21
SE,MG,GOVERNADOR VALADARES,REDE HG COMBUSTIVEIS LTDA.,13.569.064/0004-00,AVENIDA RIO/BAHIA,S/N,KM: 412 E 33 METROS;,PLANALTO,35054-060,GNV,11/01/2023,5.19,,R$ / m³,VIBRA ENERGIA,2023-11-21
SE,RJ,SAQUAREMA,AUTO POSTO TREVO DE PRAIA SECA LTDA,04.701.270/0001-80,RODOVIA AMARAL PEIXOTO,"76,6",,PRAIA SECA,28993-975,GNV,10/01/2023,5.98,,R$ / m³,VIBRA ENERGIA,2023-11-21
S,SC,CRICIUMA,F. G. FRATELLI COMERCIAL DE COMBUSTIVEIS LTDA,09.517.479/0004-55,RODOVIA LUIZ ROSSO,1124,,RECANTO VERDE,88803-470,GNV,10/01/2023,5.99,,R$ / m³,BRANCA,2023-11-21
NE,BA,FEIRA DE SANTANA,POSTO BRX LTDA,19.878.814/0001-51,AVENIDA SAMPAIO,788,TERREO,CENTRO,44026-000,GNV,10/01/2023,4.16,,R$ / m³,VIBRA ENERGIA,2023-11-21
NE,PB,BAYEUX,PETROGAS COMERCIO DE COMBUSTIVEIS LTDA,21.553.439/0001-11,AVENIDA LIBERDADE,3545,ANDAR: 1; ANEXO: A;,SESI,58306-000,GNV,09/01/2023,4.44,,R$ / m³,ALESAT,2023-11-21
S,RS,GRAVATAI,ABASTECEDORA DE COMBUSTIVEIS CONFIANCA LTDA,20.707.919/0001-27,RUA DOIS DE NOVEMBRO,60,,SALGADO FILHO,94020-170,GNV,10/01/2023,5.26,,R$ / m³,BRANCA,2023-11-21
SE,SP,TAUBATE,CENTRO AUTOMOTIVO SETE ESTRELAS LTDA,55.278.543/0009-14,AVENIDA DOM PEDRO I,5391,,JARDIM BARONESA,12091-000,GNV,11/01/2023,4.97,,R$ / m³,BRANCA,2023-11-21
S,SC,JARAGUA DO SUL,POSTO Z15 LTDA,22.159.389/0001-55,AVENIDA PREFEITO WALDEMAR GRUBBA,4955,,VIEIRA,89257-002,GNV,11/01/2023,5.49,,R$ / m³,IPIRANGA,2023-11-21
S,RS,SAPUCAIA DO SUL,POSTO ZOOLOGICO LTDA,19.588.456/0001-42,RODOVIA BR 116,750,,TRES PORTOS,93212-220,GNV,10/01/2023,5.49,,R$ / m³,RAIZEN,2023-11-21
NE,SE,ARACAJU,PETROX COMERCIAL LTDA,05.297.480/0022-42,AVENIDA PRESIDENTE TANCREDO NEVES,4501,,JABOTIANA,49095-000,GNV,11/01/2023,5.09,,R$ / m³,PETROX DISTRIBUIDORA,2023-11-21
S,SC,TUBARAO,REDE FURNAS COMERCIO DE COMBUSTIVEIS LTDA,01.387.686/0016-64,AVENIDA MARECHAL DEODORO,883,,CENTRO,88701-010,GNV,09/01/2023,5.99,,R$ / m³,IPIRANGA,2023-11-21
S,RS,CANOAS,POSTO GUAJUVIRAS LTDA,14.934.689/0002-17,AVENIDA GETULIO VARGAS,6251,LOJA  01,MARECHAL RONDON,92020-513,GNV,09/01/2023,5.29,,R$ / m³,IPIRANGA,2023-11-21
NE,SE,ARACAJU,PETROX COMERCIAL LTDA,05.297.480/0023-23,AVENIDA CHANC OSVALDO ARANHA,3090,,OLARIA,49092-545,GNV,11/01/2023,5.09,,R$ / m³,VIBRA ENERGIA,2023-11-21
SE,RJ,ITAGUAI,PRS EMPRESA ADMINISTRADORA DE POSTOS DE COMBUSTIVEIS LTDA,10.955.352/0001-54,ESTRADA DEPUTADO OCTAVIO CABRAL,2355,ANTIGA AV. PIRANEMA,JARDIM AMERICA,23810-304,GNV,12/01/2023,4.48,,R$ / m³,RAIZEN,2023-11-21
SE,RJ,NITEROI,AUTO POSTO DO TRABALHO SANTA ROSA LTDA.,24.244.784/0001-61,RUA DOUTOR MÁRIO VIANA,264,,SANTA ROSA,24241-001,GNV,09/01/2023,4.58,,R$ / m³,IPIRANGA,2023-11-21
SE,RJ,SANTO ANTONIO DE PADUA,GNV PADUA COMERCIO DE COMBUSTIVEL LTDA - ME,15.252.610/0001-50,ESTRADA PADUA - PIRAPETINGA,SN,KM    01                  GALPAO02,ARRAIALZINHO,28470-000,GNV,10/01/2023,6.59,,R$ / m³,BRANCA,2023-11-21
S,SC,TUBARAO,POSTO CIDADE AZUL LTDA,23.768.366/0001-00,RODOVIA BR-101,281,KM 337,MORROTES,88704-801,GNV,10/01/2023,6.19,,R$ / m³,VIBRA ENERGIA,2023-11-21
SE,RJ,ITAGUAI,ENZO ITAGUAI II LTDA.,21.338.886/0001-58,RODOVIA RIO-SANTOS,SN,LOTE: 1 - QUADRA 96;,BRISA MAR,23825-205,GNV,12/01/2023,4.48,,R$ / m³,BRANCA,2023-11-21
S,RS,CANOAS,SIM REDE DE POSTOS LTDA,07.473.735/0149-99,AVENIDA GETULIO VARGAS,5800,,CENTRO,92010-242,GNV,09/01/2023,5.39,,R$ / m³,RAIZEN,2023-11-21
NE,BA,SALVADOR,POSTO DE COMBUSTIVEIS PORTAL DE SALVADOR LTDA.,30.407.524/0001-62,AVENIDA ANTONIO CARLOS MAGALHAES,4322,SAIDA DA RODOVIARIA,PITUBA,41800-700,GNV,10/01/2023,4.14,,R$ / m³,VIBRA ENERGIA,2023-11-21
S,SC,SAO JOSE,ROTA DO SOL COMERCIO DE COMBUSTIVEIS EIRELI,30.360.562/0001-07,AVENIDA PRESIDENTE KENNEDY,34,,CAMPINAS,88101-000,GNV,11/01/2023,5.39,,R$ / m³,IPIRANGA,2023-11-21
S,SC,CRICIUMA,COMERCIO DE COMBUSTIVEIS SAO PEDRO EIRELI,27.742.955/0001-70,AVENIDA CENTENARIO,6500,,JARDIM MARISTELA,88815-202,GNV,10/01/2023,5.59,,R$ / m³,IPIRANGA,2023-11-21
NE,SE,ARACAJU,RPB AUTO POSTO LTDA,07.075.892/0005-62,AVENIDA EMPRESARIO JOSE CARLOS SILVA,2003,,AEROPORTO,49035-000,GNV,11/01/2023,5.09,,R$ / m³,VIBRA ENERGIA,2023-11-21
NE,BA,SALVADOR,F A MARTINS DERIVADOS DE PETROLEO LTDA,31.219.518/0001-44,AVENIDA PROFESSOR MAGALHAES NETO,1304,POSTO LOTE 20,PITUBA,41810-012,GNV,10/01/2023,4.19,,R$ / m³,RAIZEN,2023-11-21
S,RS,PORTO ALEGRE,SIM REDE DE POSTOS LTDA,07.473.735/0153-75,AVENIDA FARRAPOS,4701,,NAVEGANTES,90220-007,GNV,11/01/2023,5.49,,R$ / m³,VIBRA ENERGIA,2023-11-21
NE,SE,ARACAJU,RPB AUTO POSTO LTDA,07.075.892/0006-43,AVENIDA PRES TANCREDO NEVES,1052,LOJA  01 POSTO DE COMBUST,JABOTIANA,49095-000,GNV,11/01/2023,5.09,,R$ / m³,VIBRA ENERGIA,2023-11-21
S,RS,PORTO ALEGRE,SIM REDE DE POSTOS LTDA,07.473.735/0173-19,AVENIDA ASSIS BRASIL,8703,,SARANDI,91140-001,GNV,09/01/2023,5.59,,R$ / m³,VIBRA ENERGIA,2023-11-21
S,SC,LAGUNA,ALFA AUTO POSTO LTDA,42.351.107/0001-24,AVENIDA GETULIO VARGAS,681,,MAGALHAES,88790-000,GNV,11/01/2023,5.99,,R$ / m³,BRANCA,2023-11-21
S,RS,LAJEADO,SIM REDE DE POSTOS LTDA,07.473.735/0187-14,RODOVIA ERS-130,2285,KM    72.8,SANTO ANDRE,95912-000,GNV,10/01/2023,5.87,,R$ / m³,CHARRUA,2023-11-21
NE,AL,ARAPIRACA,IBN PINTO E SILVA & CIA LTDA,01.242.690/0001-58,RODOVIA AL-110,678,KM    70,CANAFISTULA,57302-802,GNV,16/01/2023,4.69,,R$ / m³,IPIRANGA,2023-11-21
NE,BA,ALAGOINHAS,CPD ENERGETICOS E DERIVADOS DE PETROLEO LTDA.,08.359.486/0001-60,"RODOVIA BR 101, KM 110,5",S/N,,ZONA RURAL,48010-970,GNV,17/01/2023,4.29,,R$ / m³,VIBRA ENERGIA,2023-11-21
NE,BA,SALVADOR,ECOPOSTOS - COMBUSTIVEIS E SERVICOS LTDA,04.420.464/0004-50,AVENIDA BARROS REIS - LADO PAR,2938,ARRAIAL DO RETIRO,ARRAIAL DO RETIRO,41204-025,GNV,17/01/2023,4.14,,R$ / m³,VIBRA ENERGIA,2023-11-21
NE,BA,SALVADOR,J&J COMBUSTIVEIS LTDA,06.115.130/0001-56,AVENIDA ANTONIO CARLOS MAGALHAES,5863,,SANTA TERESA,40265-200,GNV,20/01/2023,4.24,,R$ / m³,IPIRANGA,2023-11-21
NE,BA,SALVADOR,AUTO POSTO CAMURUPIM LTDA,06.895.357/0001-61,AVENIDA OCTAVIO MANGABEIRA,429,,PITUBA,41830-050,GNV,18/01/2023,4.18,,R$ / m³,RAIZEN,2023-11-21
NE,BA,SALVADOR,POSTO KALILANDIA LTDA,15.151.046/0012-31,AVENIDA LUIS VIANA,2489,,PERNAMBUES,41130-530,GNV,16/01/2023,4.19,,R$ / m³,RAIZEN,2023-11-21
NE,BA,SALVADOR,GAS ON LINE COMERCIO E SERVICOS LTDA,05.033.611/0001-50,AVENIDA HEITOR DIAS,735,,PAU MIUDO,40315-518,GNV,17/01/2023,4.19,,R$ / m³,IPIRANGA,2023-11-21
NE,BA,SALVADOR,"GRL ORGANIZACAO REVENDEDORA DE COMBUSTIVEIS, LUBRIFICANTES LTDA",40.511.529/0005-18,AVENIDA BARROS REIS,3132,,PAU MIUDO,40310-010,GNV,17/01/2023,4.14,,R$ / m³,RAIZEN,2023-11-21
NE,BA,SALVADOR,POSTO PORTOSECO DE COMBUSTIVEIS LTDA,02.558.546/0001-98,RODOVIA BR 324,S/N,KM 09,PIRAJÁ,40100-000,GNV,17/01/2023,5.46,,R$ / m³,VIBRA ENERGIA,2023-11-21
NE,CE,MARACANAU,DIAS E ROMA LTDA,12.255.543/0002-10,RODOVIA DOUTOR MENDEL STEINBRUCH,9810,KM    04,DISTRITO INDUSTRIAL I,61939-210,GNV,18/01/2023,4.39,,R$ / m³,VIBRA ENERGIA,2023-11-21
NE,CE,MARACANAU,L & S COMERCIO DE COMBUSTIVEIS LTDA,02.858.003/0003-58,RODOVIA DOUTOR MENDEL STEINBRUCH,9953,0,PAJUÇARA,61910-000,GNV,18/01/2023,4.33,,R$ / m³,VIBRA ENERGIA,2023-11-21
SE,ES,LINHARES,POSTO OURO NEGRO LTDA,02.468.894/0001-74,AVENIDA SAMUEL BATISTA CRUZ,2319,,COLINA,29901-401,GNV,18/01/2023,4.99,,R$ / m³,VIBRA ENERGIA,2023-11-21
SE,ES,SERRA,AUTO SERVICO GASVIX LTDA,05.684.518/0001-05,RODOVIA BR 101 NORTE,S/N,"KM    8,5",CARAPINA GRANDE,29160-042,GNV,19/01/2023,4.79,,R$ / m³,VIBRA ENERGIA,2023-11-21
SE,ES,SERRA,COMERCIAL RALORI LTDA,00.611.875/0001-20,RODOVIA NORTE SUL,3595,LOTE  12 13 E 15,CIVIT II,29168-078,GNV,19/01/2023,4.79,,R$ / m³,BRANCA,2023-11-21
SE,ES,VILA VELHA,POSTO MEDITERRÂNEO LTDA.,05.904.268/0001-71,AVENIDA CARLOS LINDENBERG,1380,,COBILANDIA,29111-165,GNV,16/01/2023,4.89,,R$ / m³,VIBRA ENERGIA,2023-11-21
SE,ES,VILA VELHA,POSTO ARIBIRI DO GAS LTDA,04.850.382/0001-01,AVENIDA CARLOS LINDEMBERG,1944,,SANTA INEZ,29108-075,GNV,16/01/2023,4.89,,R$ / m³,VIBRA ENERGIA,2023-11-21
SE,ES,VILA VELHA,POSTO TIBERIO LTDA,01.166.046/0001-48,RODOVIA CARLOS LINDEMBERG,386,,JABURUNA,29123-600,GNV,16/01/2023,4.79,,R$ / m³,VIBRA ENERGIA,2023-11-21
SE,ES,VITORIA,J. S. PETROLEO E COMERCIO LTDA.,08.788.618/0001-70,AVENIDA DANTE MICHELINI,2461,,MATA DA PRAIA,29066-430,GNV,16/01/2023,4.79,,R$ / m³,RAIZEN,2023-11-21
SE,ES,VITORIA,ARARA AZUL REDE DE POSTOS LTDA,04.145.589/0006-81,RUA DONA MARIA ROSA,265,,ANDORINHAS,29045-221,GNV,16/01/2023,4.79,,R$ / m³,RAIZEN,2023-11-21
SE,ES,VITORIA,POSTO DE COMBUSTÍVEIS MIRANTE LTDA,02.922.895/0001-47,AVENIDA JOSE MARIA VIVACQUA SANTOS,1675,,AEROPORTO,29160-700,GNV,16/01/2023,4.79,,R$ / m³,IPIRANGA,2023-11-21
SE,MG,BETIM,MILLENNIUM DERIVADOS DE PETROLEO LTDA,03.848.560/0001-99,AVENIDA EDMEIA MATTOS LAZAROTTI,1441,,ANGOLA,32604-228,GNV,17/01/2023,5.24,,R$ / m³,ALESAT,2023-11-21
SE,MG,CONTAGEM,POSTO QUATRO RODAS LTDA,16.696.445/0001-98,AVENIDA TITO FULGENCIO,950,,JARDIM INDUSTRIAL,32215-000,GNV,16/01/2023,4.89,,R$ / m³,IPIRANGA,2023-11-21
SE,MG,CONTAGEM,POSTO TROVAO LTDA,01.333.257/0001-28,AVENIDA TITO FULGENCIO,1189,,JARDIM INDUSTRIAL,32215-000,GNV,16/01/2023,4.86,,R$ / m³,VIBRA ENERGIA,2023-11-21
SE,MG,JUIZ DE FORA,AUTO POSTO PETROGAS LTDA,03.862.967/0001-70,AVENIDA JUSCELINO KUBISTSCHEK,6000,,BENFICA,36081-000,GNV,16/01/2023,4.85,,R$ / m³,VIBRA ENERGIA,2023-11-21
SE,MG,JUIZ DE FORA,POSTO ELEFANTINHO LTDA,21.580.030/0001-94,AVENIDA BRASIL,3349,,CENTRO,36060-010,GNV,17/01/2023,4.85,,R$ / m³,RAIZEN,2023-11-21
SE,MG,SETE LAGOAS,GNV IGAS LTDA,04.758.543/0001-23,RUA DR. SEBASTIAO MASCARENHAS,188,,SAO GERALDO,35700-176,GNV,16/01/2023,4.85,,R$ / m³,ALESAT,2023-11-21
SE,MG,SETE LAGOAS,REDE SANTANA COMBUSTIVEIS E GNV SETE LAGOAS LTDA,04.305.250/0001-90,AVENIDA DR. RENATO AZEREDO,2299,,CHACARA DO PAIVA,35700-312,GNV,18/01/2023,4.85,,R$ / m³,BRANCA,2023-11-21
CO,MS,CAMPO GRANDE,COMERCIAL POSTO MIL LTDA,01.945.104/0001-31,AVENIDA MANOEL DA COSTA LIMA,459,,VILA IPIRANGA,79080-800,GNV,17/01/2023,4.99,,R$ / m³,BRANCA,2023-11-21
NE,PB,BAYEUX,MOTOGAS INDUSTRIA DE COMPRESSAO E COMERCIO DE GAS NATURAL LTDA,01.420.327/0001-85,LOC  BR 230 KM 31,S/N,,ESTRADA,58309-602,GNV,16/01/2023,4.44,,R$ / m³,BRANCA,2023-11-21
NE,PB,CABEDELO,W A BARRETO E CIA LTDA,70.098.470/0004-68,BR-230 KILOMETRO 13,S/N,,KILOMETRO 13,58100-100,GNV,18/01/2023,4.44,,R$ / m³,VIBRA ENERGIA,2023-11-21
NE,PB,CAMPINA GRANDE,POSTO DE COMBUSTIVEIS SAO MARCOS LTDA,01.106.085/0001-50,AVENIDA ASSIS CHATEAUBRIAND,878,,LIBERDADE,58105-000,GNV,17/01/2023,4.69,,R$ / m³,IPIRANGA,2023-11-21
NE,PE,CABO DE SANTO AGOSTINHO,PETRO CABO LTDA,05.097.635/0001-72,RODOVIA PE 60,1900,,GARAPU,54518-343,GNV,17/01/2023,3.99,,R$ / m³,VIBRA ENERGIA,2023-11-21
NE,PE,JABOATAO DOS GUARARAPES,SERVICAR S/A,09.798.307/0005-88,AVENIDA ARMINDO MOURA,461,,PIEDADE,54315-070,GNV,17/01/2023,3.99,,R$ / m³,VIBRA ENERGIA,2023-11-21
NE,PE,JABOATAO DOS GUARARAPES,CMA PETROLEO LTDA,05.263.779/0001-51,AVENIDA BERNARDO VIEIRA DE MELO,5160,,CANDEIAS,54450-020,GNV,17/01/2023,3.99,,R$ / m³,RAIZEN,2023-11-21
NE,PE,OLINDA,POSTO SAO JANUARIO LTDA,08.757.155/0001-89,AVENIDA OLINDA DOM HELDER CAMARA,514,,SANTA TEREZA,53010-005,GNV,17/01/2023,3.99,,R$ / m³,VIBRA ENERGIA,2023-11-21
NE,PE,OLINDA,POSTOS APM LTDA.,02.856.330/0001-09,"AVENIDA GOVERNADOR CARLOS DE LIMA CAVALCANTI,",2570,,CASA CAIADA,53130-000,GNV,17/01/2023,3.99,,R$ / m³,VIBRA ENERGIA,2023-11-21
NE,PE,PAULISTA,FM COMERCIO E DERIVADOS DE PETROLEO LTDA,04.637.954/0001-60,AVENIDA SENADOR SALGADO FILHO,18,,CENTRO,53400-000,GNV,18/01/2023,3.99,,R$ / m³,VIBRA ENERGIA,2023-11-21
NE,PE,PAULISTA,POSTO ATLANTIDA LTDA,03.771.831/0001-55,AVENIDA ANTONIO CABRAL DE SOUZA,530,QUADRA: 12; : NUCLEO HABITACIONAL ; : MARANGUAPE I;,MARANGUAPE I,53444-360,GNV,18/01/2023,3.99,,R$ / m³,BRANCA,2023-11-21
NE,PE,RECIFE,POSTO BIPIRANGA LTDA,07.090.825/0001-93,AVENIDA RECIFE,3532,,IPSEP,51350-670,GNV,18/01/2023,3.99,,R$ / m³,VIBRA ENERGIA,2023-11-21
NE,PE,RECIFE,M M PETROLEO LTDA,00.935.571/0001-18,AVENIDA GOVERNADOR AGAMENON MAGALHAES,1302,,CAMPO GRANDE,52031-330,GNV,18/01/2023,3.99,,R$ / m³,VIBRA ENERGIA,2023-11-21
NE,PE,RECIFE,POSTO IBIZA LTDA,03.281.744/0002-09,AVENIDA RECIFE,5421,,SAN MARTIN,51190-730,GNV,18/01/2023,3.99,,R$ / m³,RAIZEN,2023-11-21
NE,PE,RECIFE,CUNHA DERIVADOS DE PETROLEO LTDA,00.216.435/0001-78,AVENIDA MARECHAL MASCARENHAS DE MORAIS,3468,,IMBIRIBEIRA,51200-000,GNV,18/01/2023,3.99,,R$ / m³,VIBRA ENERGIA,2023-11-21
NE,PE,RECIFE,PETRO CAXANGA LTDA,03.737.645/0001-08,AVENIDA CAXANGA,4335,,IPUTINGA,50720-000,GNV,16/01/2023,3.99,,R$ / m³,DISLUB,2023-11-21
NE,PE,RECIFE,POSTO CONCORDE LTDA.,02.289.819/0001-46,AVENIDA ENG.DOMINGOS FERREIRA,50,,PINA,51011-050,GNV,18/01/2023,3.99,,R$ / m³,TDC DISTRIBUIDORA,2023-11-21
SE,RJ,ARARUAMA,CENTRO AUTOMOTIVO PRAIA DOS COQUEIROS LTDA,09.158.471/0001-05,RODOVIA AMARAL PEIXOTO,90031,KM    88,PRAIA DOS COQUEIROS,28970-000,GNV,16/01/2023,5.99,,R$ / m³,BRANCA,2023-11-21
SE,RJ,ARARUAMA,AUTO POSTO PISCA PISCA LTDA,28.529.501/0001-89,RODOVIA AMARAL PEIXOTO,S/N,KM 88,VILA CAPRI,28970-000,GNV,16/01/2023,6.09,,R$ / m³,IPIRANGA,2023-11-21
SE,RJ,CAMPOS DOS GOYTACAZES,ARARA FLUMINENSE COMERCIO DE COMBUSTIVEIS LTDA.,07.614.346/0004-71,AVENIDA ALBERTO TORRES,100,,CENTRO,28010-117,GNV,17/01/2023,5.19,,R$ / m³,RAIZEN,2023-11-21
SE,RJ,CAMPOS DOS GOYTACAZES,CORDEIRO BARROSO PETROLEO LTDA,05.064.564/0001-01,AVENIDA VINTE E OITO DE MARCO,458,,CENTRO,28020-740,GNV,18/01/2023,5.19,,R$ / m³,VIBRA ENERGIA,2023-11-21
SE,RJ,MARICA,AUTO POSTO NOSSA SENHORA PENHA DE FRANCA LTDA,03.610.892/0001-30,RODOVIA ERNANI DO AMARAL PEIXOTO,22944,POSTO                     GLEBA C             LOTE  1A,SAO JOSE DO IMBASSAI,24931-000,GNV,17/01/2023,6.07,,R$ / m³,BRANCA,2023-11-21
SE,RJ,NITEROI,AUTO POSTO MASTER DO FONSECA LTDA,07.531.770/0001-00,ALAMEDA SAO BOAVENTURA,1042,,FONSECA,24120-192,GNV,16/01/2023,4.49,,R$ / m³,IPIRANGA,2023-11-21
SE,RJ,NITEROI,DARIL POSTOS DE SERVICOS LTDA,30.065.650/0001-86,ALAMEDA SAO BOAVENTURA,254,,FONSECA,24355-090,GNV,16/01/2023,4.49,,R$ / m³,VIBRA ENERGIA,2023-11-21
SE,RJ,NITEROI,SCAL SERVICOS COMBUSTIVEIS E ACESSORIOS LTDA,29.722.824/0001-57,AVENIDA FELICIANO SODRE,622,,CENTRO,24030-011,GNV,16/01/2023,4.49,,R$ / m³,BRANCA,2023-11-21
SE,RJ,NITEROI,CENTRO AUTOMOTIVO PENDOTIBA LTDA,02.623.670/0001-90,ESTRADA CAETANO MONTEIRO,501,,PENDOTIBA,24320-570,GNV,16/01/2023,4.58,,R$ / m³,BRANCA,2023-11-21
SE,RJ,NITEROI,CENTRO AUTOMOTIVO PACO DE SOUZA LTDA.,01.487.893/0001-04,RUA JANSEN DE MELO,417,,CENTRO,24030-220,GNV,16/01/2023,4.99,,R$ / m³,IPIRANGA,2023-11-21
SE,RJ,NITEROI,AUTO POSTO CUBANGO LTDA,00.886.231/0001-44,RUA NORONHA TORREZAO,531,,CUBANGO,24240-181,GNV,16/01/2023,4.69,,R$ / m³,BRANCA,2023-11-21
SE,RJ,NOVA IGUACU,POSTO DE COMBUSTIVEIS POINT DE NOVA IGUACU LTDA,08.728.050/0001-00,"ESTRADA ANTIGA RIO SAO PAULO, BR 465",149,KM    32,PARQUE SAO FRANCISCO,26262-020,GNV,17/01/2023,4.74,,R$ / m³,BRANCA,2023-11-21
SE,RJ,NOVA IGUACU,MEGA NOVA IGUACU POSTO DE ABASTECIMENTO LTDA,06.179.155/0001-13,AVENIDA ABILIO AUGUSTO TAVORA,3500,,JARDIM ALVORADA,26210-000,GNV,17/01/2023,4.74,,R$ / m³,BRANCA,2023-11-21
SE,RJ,NOVA IGUACU,POSTO DE GASOLINA VIA LIGHT D IGUACU LTDA,02.754.990/0001-89,RUA CORONEL FRANCISCO SOARES,554,,CENTRO,26220-520,GNV,17/01/2023,4.69,,R$ / m³,BRANCA,2023-11-21
SE,RJ,NOVA IGUACU,POSTO KM 13 DA DUTRA LTDA,00.118.442/0001-37,RODOVIA PRESIDENTE DUTRA,13006,,PRATA,26010-003,GNV,17/01/2023,4.89,,R$ / m³,IPIRANGA,2023-11-21
SE,RJ,NOVA IGUACU,AUTO POSTO LEAO DE IGUACU LTDA,00.488.282/0001-18,AVENIDA ABILIO AUGUSTO TAVORA,4124,,CABUCU,26262-020,GNV,17/01/2023,4.94,,R$ / m³,RAIZEN,2023-11-21
SE,RJ,NOVA IGUACU,POSTO DE GASOLINA VASCO GAMA SOARES LTDA,04.590.222/0001-62,ESTRADA ADRIANOPOLIS,2560,2600,BOTAFOGO,26210-000,GNV,17/01/2023,4.99,,R$ / m³,ALESAT,2023-11-21
SE,RJ,NOVA IGUACU,REDE CH4 DE COMBUSTIVEIS LTDA,04.131.401/0001-31,RUA OSCAR SOARES,1000,,CENTRO,26220-099,GNV,17/01/2023,4.48,,R$ / m³,VIBRA ENERGIA,2023-11-21
SE,RJ,NOVA IGUACU,POSTO LIGHT HIGHWAY LTDA,03.475.408/0001-08,RUA OSCAR SOARES (CONTINUACAO COMO EST DR PLINIO CASA,36,,CENTRO,26220-099,GNV,17/01/2023,4.69,,R$ / m³,BRANCA,2023-11-21
SE,RJ,RIO DE JANEIRO,POSTO E GARAGEM DOM HELDER CAMARA LTDA,04.802.584/0001-70,AVENIDA DOM HELDER CAMARA,4539,,DEL CASTILHO,20771-000,GNV,17/01/2023,4.55,,R$ / m³,RAIZEN,2023-11-21
SE,RJ,RIO DE JANEIRO,AUTO POSTO MAP RECREIO LTDA.,03.661.061/0001-98,AVENIDA DAS AMERICAS,"10,2",,BARRA DA TIJUCA,22793-082,GNV,17/01/2023,4.78,,R$ / m³,VIBRA ENERGIA,2023-11-21
SE,RJ,RIO DE JANEIRO,POSTO SANTA CLARA DA PAVUNA LTDA,03.246.347/0001-07,AVENIDA PROFESSOR BERNARDINO DA ROCHA,113,,PAVUNA,21650-450,GNV,18/01/2023,4.37,,R$ / m³,VIBRA ENERGIA,2023-11-21
SE,RJ,RIO DE JANEIRO,AUTO POSTO DO TRABALHO S/A,03.139.910/0003-00,ESTRADA DOS BANDEIRANTES,7650,,CURICICA,22780-085,GNV,16/01/2023,4.55,,R$ / m³,BRANCA,2023-11-21
SE,RJ,RIO DE JANEIRO,AUTO POSTO DO TRABALHO S/A,03.139.910/0002-29,AVENIDA AYRTON SENNA,5600,,JACAREPAGUA,22775-005,GNV,16/01/2023,4.58,,R$ / m³,BRANCA,2023-11-21
SE,RJ,RIO DE JANEIRO,POSTO REGINAS LTDA,00.083.430/0001-14,AVENIDA BRASIL,2190,,BENFICA,20930-040,GNV,16/01/2023,4.49,,R$ / m³,VIBRA ENERGIA,2023-11-21
SE,RJ,RIO DE JANEIRO,CENTRO AUTOMOTIVO COOPGAS LTDA,04.851.288/0001-69,RUA ITAPIRU,711,,CATUMBI,20251-031,GNV,16/01/2023,4.59,,R$ / m³,BRANCA,2023-11-21
SE,RJ,RIO DE JANEIRO,AUTO POSTO GNV SANTA CRUZ II LTDA,04.879.407/0001-91,RUA TAPEVI,11,,PENHA,21210-690,GNV,17/01/2023,4.59,,R$ / m³,BRANCA,2023-11-21
SE,RJ,RIO DE JANEIRO,POSTO TULIPA LTDA,05.117.875/0001-91,AVENIDA GEREMARIO DANTAS,1076,,JACAREPAGUA,22760-401,GNV,16/01/2023,4.69,,R$ / m³,VIBRA ENERGIA,2023-11-21
SE,RJ,RIO DE JANEIRO,AUTO POSTO FUTURO GNV DE BONSUCESSO LTDA,05.037.349/0001-11,AVENIDA BRASIL,5721,,BONSUCESSO,21040-360,GNV,16/01/2023,4.44,,R$ / m³,BRANCA,2023-11-21
SE,RJ,RIO DE JANEIRO,BRAGAL BENFICA AUTO POSTO DE ABASTECIMENTO E GARAGE LTD,05.022.562/0001-50,RUA SÃO LUIZ GONZAGA,1951,,SÃO CRISTÓVÃO,20910-063,GNV,16/01/2023,4.44,,R$ / m³,RAIZEN,2023-11-21
SE,RJ,RIO DE JANEIRO,AUTO POSTO JATINHO LTDA,04.914.244/0001-30,RUA GRUCAI,900,,PENHA,21020-250,GNV,17/01/2023,4.58,,R$ / m³,ALESAT,2023-11-21
SE,RJ,RIO DE JANEIRO,LEÃO VERMELHO COMBUSTIVEIS LTDA,04.919.248/0001-01,AVENIDA PASTOR MARTIN LUTHER KING JUNIOR,8102,,IRAJÁ,21235-000,GNV,17/01/2023,4.48,,R$ / m³,BRANCA,2023-11-21
SE,RJ,RIO DE JANEIRO,FROSINONE POSTO DE GNV LTDA,04.926.070/0001-26,AVENIDA BRASIL,1851,1851 FUNDOS,SAO CRISTOVAO,20930-040,GNV,16/01/2023,4.44,,R$ / m³,BRANCA,2023-11-21
SE,RJ,RIO DE JANEIRO,POSTO JACUI LTDA,03.596.816/0001-18,ESTRADA DO SAPE,445,,TURIACU,21550-010,GNV,17/01/2023,4.59,,R$ / m³,VIBRA ENERGIA,2023-11-21
SE,RJ,RIO DE JANEIRO,POSTO DE GASOLINA MARECHAL DE BANGU LTDA,02.553.357/0001-22,ESTRADA DA AGUA BRANCA,3074,,PADRE MIGUEL,21860-001,GNV,18/01/2023,4.69,,R$ / m³,BRANCA,2023-11-21
SE,RJ,RIO DE JANEIRO,LM & JB AUTO POSTO LTDA,04.919.736/0001-19,AVENIDA MERITI,3027,,VILA DA PENHA,21220-202,GNV,17/01/2023,4.49,,R$ / m³,BRANCA,2023-11-21
SE,RJ,RIO DE JANEIRO,PIRAQUARA AUTO POSTO LTDA,02.825.532/0001-93,AVENIDA MARECHAL FONTENELLE,5721,,REALENGO,21750-000,GNV,18/01/2023,4.47,,R$ / m³,RAIZEN,2023-11-21
SE,RJ,RIO DE JANEIRO,AUTO POSTO CREMONEZE LTDA,01.988.505/0001-79,ESTRADA DO MENDANHA,4240,,CAMPO GRANDE,23092-002,GNV,16/01/2023,4.34,,R$ / m³,IPIRANGA,2023-11-21
SE,RJ,RIO DE JANEIRO,AUTO POSTO DE SERVICOS ELITE DE MADUREIRA LTDA,04.923.368/0001-82,RUA CAROLINA MACHADO,670,,MADUREIRA,21351-021,GNV,17/01/2023,4.69,,R$ / m³,VIBRA ENERGIA,2023-11-21
SE,RJ,RIO DE JANEIRO,AUTO POSTO PARADA DA PRAÇA LTDA,04.919.058/0001-94,AVENIDA SANTA CRUZ,5450,,BANGU,21830-000,GNV,18/01/2023,4.47,,R$ / m³,BRANCA,2023-11-21
SE,RJ,RIO DE JANEIRO,AUTO POSTO GOMENSORO LTDA,04.904.156/0001-58,RUA GOMENSORO,9,,OLARIA,21071-420,GNV,16/01/2023,4.49,,R$ / m³,RAIZEN,2023-11-21
SE,RJ,RIO DE JANEIRO,POSTO PALACIO GUANABARA LTDA,04.816.108/0001-08,RUA PINHEIRO MACHADO,83,83/FUNDOS,LARANJEIRAS,22231-090,GNV,16/01/2023,4.89,,R$ / m³,RAIZEN,2023-11-21
SE,RJ,RIO DE JANEIRO,POSTO DE ABASTECIMENTO A GAS SANTA AMELIA LTDA,04.198.018/0001-09,RUA SANTA AMELIA,45,,TIJUCA,20260-030,GNV,16/01/2023,4.79,,R$ / m³,VIBRA ENERGIA,2023-11-21
SE,RJ,RIO DE JANEIRO,POSTO DE GASOLINA E SERVICOS NOVA VALQUEIRE LTDA,04.161.918/0001-73,AVENIDA JAMBEIRO,955,,VILA VALQUEIRE,21330-300,GNV,18/01/2023,4.69,,R$ / m³,RAIZEN,2023-11-21
SE,RJ,RIO DE JANEIRO,POSTO RFD LTDA.,03.996.678/0001-64,AVENIDA BRASIL,1960,,CAJU,20930-040,GNV,16/01/2023,4.49,,R$ / m³,RAIZEN,2023-11-21
SE,RJ,RIO DE JANEIRO,W M DO LOCAL COMERCIO E SERVICOS LTDA,03.995.690/0001-54,AVENIDA DOM HELDER CAMARA,7832,,ABOLIÇÃO,20751-002,GNV,16/01/2023,4.38,,R$ / m³,BRANCA,2023-11-21
SE,RJ,RIO DE JANEIRO,AUTO POSTO FABIANA OESTE LTDA,03.610.121/0001-43,AVENIDA BRASIL,"34,5",,BANGU,21863-000,GNV,18/01/2023,4.79,,R$ / m³,VIBRA ENERGIA,2023-11-21
SE,RJ,RIO DE JANEIRO,AUTO POSTO E SERVICO BAM BAM LTDA,03.325.858/0001-14,AVENIDA BRASIL,8108,,RAMOS,21030-001,GNV,16/01/2023,4.54,,R$ / m³,BRANCA,2023-11-21
