SE,RJ,ITABORAI,POSTO JUANOTO LTDA.,03.510.561/0001-29,RODOVIA BR 101,S/N,KM 297,MANILHA,24800-001,GNV,19/01/2023,4.48,,R$ / m³,TOTALENERGIES,2023-11-21
SE,RJ,ITABORAI,POSTO NOTA 1000 DE ITABORAI COMERCIO DE COMBUSTIVEIS E LUBRIFICANTES LTDA,01.786.465/0001-82,RODOVIA AMARAL PEIXOTO - BR 101,S/N,KM 25 QD 04 LT 89/90,TRES PONTES,24800-001,GNV,19/01/2023,4.48,,R$ / m³,VIBRA ENERGIA,2023-11-21
SE,RJ,ITABORAI,POSTO DUQUE MANILHA LTDA,05.144.206/0001-09,RODOVIA BR 101,S/N,"KM 4,5 - AR 03",CALUNDU,24800-000,GNV,19/01/2023,4.89,,R$ / m³,BRANCA,2023-11-21
SE,RJ,ITABORAI,AUTO POSTO CIDADE GEBARA LTDA,04.231.145/0001-54,AVENIDA UM,S/N,LOTES 59-60-61-62-63,CIDADE GEBARA,24800-001,GNV,19/01/2023,4.48,,R$ / m³,IPIRANGA,2023-11-21
SE,RJ,ITABORAI,POSTO F1 RACING LTDA.,03.922.066/0001-27,AVENIDA VINTE E DOIS DE MAIO  LADO PAR,2952,LOTE  04 05 E 06          QUADRA05,SANTO EXPEDITO,24812-516,GNV,19/01/2023,4.79,,R$ / m³,VIBRA ENERGIA,2023-11-21
SE,RJ,NILOPOLIS,AUTO POSTO NILOPOLIS LTDA,40.438.186/0001-80,AVENIDA GETULIO DE MOURA,13,,OLINDA,26510-000,GNV,17/01/2023,4.79,,R$ / m³,BRANCA,2023-11-21
SE,RJ,PETROPOLIS,POSTO DE ABASTECIMENTO VITORIA 040 LTDA.,07.570.135/0001-31,ESTRADA BR 040,"KM82,9",,CAPELA,25665-091,GNV,16/01/2023,4.99,,R$ / m³,RAIZEN,2023-11-21
SE,RJ,PETROPOLIS,ENZO ITAIPAVA LTDA,01.904.245/0001-06,ESTRADA UNIAO INDUSTRIA,9429,,ITAIPAVA,25730-730,GNV,16/01/2023,4.99,,R$ / m³,RAIZEN,2023-11-21
SE,RJ,PETROPOLIS,IPI CENTER LTDA,03.457.301/0001-37,RUA TREZE DE MAIO,135,LOJA 3,CENTRO,25685-230,GNV,16/01/2023,4.99,,R$ / m³,IPIRANGA,2023-11-21
NE,RN,PARNAMIRIM,POSTO PINHEIRO BORGES LTDA,08.277.717/0003-59,AVENIDA PILOTO PEREIRA TIM,2437,0,CENTRO,59150-000,GNV,16/01/2023,4.19,,R$ / m³,VIBRA ENERGIA,2023-11-21
NE,RN,PARNAMIRIM,POSTOS EMAUS COMERCIO E SERVICOS LTDA,03.979.385/0001-79,RODOVIA BR 101,1999,CS KM BL 8,EMAUS,59150-000,GNV,16/01/2023,4.11,,R$ / m³,ALESAT,2023-11-21
NE,RN,PARNAMIRIM,J MENDES REVENDEDORA DE COMBUSTIVEIS E DERIVADOS LTDA,03.315.118/0005-20,AVENIDA MARIA LACERDA MONTENEGRO,1732,POSTO DE COMBUSTIVEL,NOVA PARNAMIRIM,59152-600,GNV,16/01/2023,4.19,,R$ / m³,BRANCA,2023-11-21
NE,RN,PARNAMIRIM,POSTO COHABINAL LTDA,01.829.334/0001-35,AVENIDA JOAO XXIII,622,,COHABINAL,59140-690,GNV,16/01/2023,4.19,,R$ / m³,VIBRA ENERGIA,2023-11-21
S,RS,GRAVATAI,AUTO POSTO BRAZUCA LTDA.,06.970.308/0001-46,AVENIDA ELY CORREA,570,,SÍTIO SOBRADO,94180-130,GNV,16/01/2023,5.39,,R$ / m³,VIBRA ENERGIA,2023-11-21
S,RS,PORTO ALEGRE,MC BR COMERCIO DE COMBUSTIVEIS LTDA,07.681.536/0001-69,AVENIDA IPIRANGA,5800,,PETROPOLIS,90610-000,GNV,18/01/2023,5.49,,R$ / m³,VIBRA ENERGIA,2023-11-21
S,RS,PORTO ALEGRE,COMERCIAL TRES FIGUEIRAS LTDA,01.429.112/0001-25,AVENIDA PROF.CRISTIANO FISCHER,1950,,PARTENON,91410-000,GNV,18/01/2023,5.49,,R$ / m³,BRANCA,2023-11-21
S,RS,PORTO ALEGRE,POSTO DE COMBUSTIVEIS DEA LTDA,03.299.835/0001-82,RUA J. THADEO ONAR,35,,VILA IPIRANGA,91340-070,GNV,18/01/2023,5.49,,R$ / m³,VIBRA ENERGIA,2023-11-21
S,SC,BIGUACU,AMA COMERCIO DE COMBUSTIVEIS LTDA,04.614.908/0001-46,RODOVIA BR 101,S/N,KM 195,RIO CAVEIRAS,88160-000,GNV,17/01/2023,5.39,,R$ / m³,IPIRANGA,2023-11-21
S,SC,FLORIANOPOLIS,POSTO DE COMBUSTIVEIS FAROL DA ILHA LTDA,07.793.610/0001-39,RUA PROFESSORA SOFIA QUINT DE SOUZA,349,,CAPOEIRAS,88085-040,GNV,16/01/2023,5.79,,R$ / m³,RAIZEN MIME,2023-11-21
S,SC,JOINVILLE,AUTO POSTO MONACO LTDA,05.659.692/0001-06,RUA PIAUI,480,,BUCAREIN,89202-210,GNV,16/01/2023,5.59,,R$ / m³,IPIRANGA,2023-11-21
S,SC,JOINVILLE,AUTO POSTO WALVILLE LTDA,03.977.064/0001-35,RUA WALDOMIRO JOSE BORGES,1030,,SANTA CATARINA,89233-048,GNV,16/01/2023,5.79,,R$ / m³,BRANCA,2023-11-21
S,SC,JOINVILLE,POSTO ALDI LTDA.,01.577.127/0001-30,RUA MAX COLIN,585,,CENTRO,89204-040,GNV,16/01/2023,5.59,,R$ / m³,VIBRA ENERGIA,2023-11-21
S,SC,JOINVILLE,AUTO POSTO PRUDENTE LTDA,00.354.911/0001-17,RUA BLUMENAU,3011,,SANTO ANTONIO,89204-251,GNV,16/01/2023,5.99,,R$ / m³,IPIRANGA,2023-11-21
S,SC,LAGUNA,AUTO POSTO REPUBLICA JULIANA LTDA,95.788.949/0001-04,RODOVIA SC 436,SN,KM 2,MATO ALTO,88790-000,GNV,16/01/2023,5.99,,R$ / m³,BRANCA,2023-11-21
S,SC,LAGUNA,AUTO POSTO CABECUDAS LTDA,82.540.576/0001-06,RODOVIA BR 101,SN,KM 313,CABECUDA,88790-000,GNV,16/01/2023,5.99,,R$ / m³,IPIRANGA,2023-11-21
S,SC,SAO JOSE,MAXIMO COMERCIO DE COMBUSTIVEIS LTDA,04.466.071/0001-35,RUA JOAO AMBROSIO DA SILVA,2587,,BARREIROS,88111-550,GNV,18/01/2023,5.39,,R$ / m³,BRANCA,2023-11-21
S,SC,SAO JOSE,AUTO POSTO NIENKOTTER LTDA,75.459.461/0005-50,RODOVIA BR 101 KM 210,S/N,AREA INDUSTRIAL,FAZENDA STO ANTONIO,88104-800,GNV,18/01/2023,5.39,,R$ / m³,VIBRA ENERGIA,2023-11-21
S,SC,SAO JOSE,PERES MULLER LTDA.,04.519.713/0002-06,RUA PAULINO PEDRO HERMES,588,,FLORESTA,88110-693,GNV,18/01/2023,5.59,,R$ / m³,VIBRA ENERGIA,2023-11-21
SE,SP,ARACATUBA,AUTO POSTO PITANGUEIRAS ARACATUBA LTDA EM RECUPERACAO JUDICIAL,04.179.648/0001-28,RUA DAS ROSAS,100,,JARDIM DO TREVO,16070-030,GNV,17/01/2023,5.59,,R$ / m³,IPIRANGA,2023-11-21
SE,SP,BARUERI,AUTO POSTO DUQUE BARUERI LTDA.,07.830.357/0001-46,RUA CAMPOS SALES,934,,CENTRO,06420-390,GNV,17/01/2023,5.99,,R$ / m³,VIBRA ENERGIA,2023-11-21
SE,SP,BARUERI,POSTO DE SERVICOS DUQUE ALPHAVILLE LTDA,07.773.037/0001-00,ALAMEDA RIO NEGRO,600,,ALPHAVILLE,06454-000,GNV,17/01/2023,5.99,,R$ / m³,VIBRA ENERGIA,2023-11-21
SE,SP,CAMPINAS,AUTO POSTO BARAO DE ITAPURA CAMPINAS LTDA,03.595.317/0001-06,AVENIDA BARAO DE ITAPURA,641,,BOTAFOGO,13020-431,GNV,18/01/2023,4.95,,R$ / m³,BRANCA,2023-11-21
SE,SP,CAMPINAS,RODOCAMP AUTO SERVICE LTDA,01.109.449/0001-55,AVENIDA MERCEDES BENZ,1,GLEBA 1                   QT 8907,DISTRITO INDUSTRIAL,13054-750,GNV,18/01/2023,5.29,,R$ / m³,IPIRANGA,2023-11-21
SE,SP,CAMPINAS,AUTO POSTO 2002 DE CAMPINAS LTDA,01.257.449/0001-00,AVENIDA PRINCESA D'OESTE,2002,,JD PARAISO,13026-137,GNV,18/01/2023,5.19,,R$ / m³,IPIRANGA,2023-11-21
SE,SP,INDAIATUBA,COMERCIAL DE COMBUSTIVEIS VISCONDE US LTDA.,07.778.461/0001-39,AVENIDA VISCONDE DE INDAIATUBA,1076,,JARDIM AMERICA,13338-010,GNV,18/01/2023,5.69,,R$ / m³,VIBRA ENERGIA,2023-11-21
SE,SP,ITATIBA,AUTO POSTO TREVO DE ITATIBA LTDA.,03.085.922/0001-37,AVENIDA MARECHAL CASTELO BRANCO,845,,BAIRRO ENGENHO,13255-350,GNV,16/01/2023,4.97,,R$ / m³,BRANCA,2023-11-21
SE,SP,LIMEIRA,AUTO POSTO N.O. LTDA,07.014.538/0001-02,AVENIDA MAJOR JOSE LEVY SOBRINHO,1516,,BOA VISTA,13486-190,GNV,19/01/2023,5.45,,R$ / m³,IPIRANGA,2023-11-21
SE,SP,OSASCO,CENTRO AUTOMOTIVO PONTE METALICA DE OSASCO LTDA,08.694.117/0001-24,AVENIDA DOS AUTONOMISTAS,1987,,VILA YARA,06020-015,GNV,17/01/2023,4.99,,R$ / m³,RAIZEN,2023-11-21
SE,SP,SAO BERNARDO DO CAMPO,TERIOS AUTO POSTO LTDA,03.537.531/0001-06,RUA ALFERES BONILHA,531,,VILA MAGNOLIA,09721-230,GNV,17/01/2023,5.49,,R$ / m³,VIBRA ENERGIA,2023-11-21
SE,SP,SAO CARLOS,AUTO POSTO FLANBOYANT LTDA,67.949.974/0001-97,AVENIDA PROF LUIZ A.DE OLIVEIRA,366,,VILA MARINA,13566-340,GNV,17/01/2023,5.59,,R$ / m³,VIBRA ENERGIA,2023-11-21
SE,SP,SAO CARLOS,LOPES & LOPES SAO CARLOS LTDA,59.601.161/0001-83,RODOVIA WASHINGTON LUIZ,S/N,KM    236,JARDIM GUANABARA,13565-800,GNV,17/01/2023,5.6,,R$ / m³,IPIRANGA,2023-11-21
SE,SP,SAO JOSE DOS CAMPOS,POSTO SHOPPING VALE JCN LTDA,05.276.832/0001-59,AVENIDA DEPUTADO BENEDITO MATARAZZO,9183,,JARDIM OSWALDO CRUZ,12216-580,GNV,16/01/2023,4.89,,R$ / m³,VIBRA ENERGIA,2023-11-21
SE,SP,SAO JOSE DOS CAMPOS,AUTO POSTO VITRINE LTDA,03.940.189/0001-90,AVENIDA DR. NELSON D'AVILA,1810,,JD. SAO DIMAS,12245-031,GNV,16/01/2023,4.89,,R$ / m³,BRANCA,2023-11-21
S,RS,CAXIAS DO SUL,SIM REDE DE POSTOS LTDA,07.473.735/0004-24,RUA JOAO NICHELE,2227,SALA A,CINQUENTENARIO,95012-631,GNV,17/01/2023,5.95,,R$ / m³,BRANCA,2023-11-21
SE,SP,ARARAQUARA,IGAS COMERCIO DE COMBUSTIVEIS LTDA,10.394.030/0001-83,AVENIDA AROEIRAS,35,,JARDIM AROEIRAS,14800-656,GNV,17/01/2023,5.46,,R$ / m³,ALESAT,2023-11-21
SE,RJ,DUQUE DE CAXIAS,JJP 88 POSTO DE ABASTECIMENTO E AUTO SERVIÇO LTDA.,01.783.666/0001-26,ALAMEDA SANTA  ALICE,88,LT. 12 A,VILA SANTA ALICE,25250-140,GNV,18/01/2023,4.86,,R$ / m³,BRANCA,2023-11-21
SE,RJ,MARICA,REDE OSORIO'S DE MARICA COMERCIO DE GAS NATURAL COMPRIMIDO LTDA,09.547.694/0001-56,RUA JOSE BARBOSA DA CUNHA,S/N,"LOTE  01,02,12",ITAPEBA,24912-350,GNV,17/01/2023,5.47,,R$ / m³,BRANCA,2023-11-21
SE,RJ,SAO JOAO DE MERITI,POSTO DE GASOLINA JB MERITI LTDA,10.559.563/0001-78,RUA SAO JOAO BATISTA,977,,CENTRO,25515-520,GNV,16/01/2023,4.49,,R$ / m³,BRANCA,2023-11-21
SE,MG,POCOS DE CALDAS,POSTO ACACIAS LTDA,09.128.405/0001-84,AVENIDA SANTO ANTONIO,310,,JARDIM CASCATINHA,37701-036,GNV,18/01/2023,5.15,,R$ / m³,VIBRA ENERGIA,2023-11-21
SE,RJ,RIO DE JANEIRO,AUTO POSTO DO TRABALHO S/A,03.139.910/0015-43,ESTRADA DO PONTAL,459,,RECREIO DOS BANDEIRANTES,22790-877,GNV,17/01/2023,4.89,,R$ / m³,BRANCA,2023-11-21
S,SC,TUBARAO,REDE FURNAS COMERCIO DE COMBUSTIVEIS LTDA,01.387.686/0010-79,AVENIDA PATRICIO LIMA,90,,HUMAITA,88704-410,GNV,16/01/2023,5.99,,R$ / m³,IPIRANGA,2023-11-21
SE,RJ,VOLTA REDONDA,POSTO DE GASOLINA BARRETO E SILVA LTDA,08.962.639/0001-60,RODOVIA LUCIO MEIRA,299,299/001 E 299/002   KM    13                        BR 393,SAO LUIZ,27250-050,GNV,18/01/2023,5.29,,R$ / m³,BRANCA,2023-11-21
SE,RJ,RIO DE JANEIRO,AUTO POSTO GIRASSOL LTDA,05.008.630/0001-26,ESTRADA DOS BANDEIRANTES,892,,TAQUARA,22710-112,GNV,16/01/2023,4.57,,R$ / m³,VIBRA ENERGIA,2023-11-21
CO,MT,VARZEA GRANDE,AUTO POSTO SANTOS DUMONT EIRELI,07.634.857/0001-02,AVENIDA JOSE PONCE DE ARRUDA,675,,AEROPORTO,78110-798,GNV,17/01/2023,3.54,,R$ / m³,BRANCA,2023-11-21
SE,RJ,PETROPOLIS,BR CORONEL VEIGA COMBUSTIVEIS LTDA,10.514.757/0001-57,RUA CORONEL VEIGA,687,,CORONEL VEIGA,25655-156,GNV,16/01/2023,4.99,,R$ / m³,VIBRA ENERGIA,2023-11-21
SE,MG,JUIZ DE FORA,MAN GNV LTDA.,10.173.887/0002-54,AVENIDA SETE DE SETEMBRO,743,,COSTA CARVALHO,36070-000,GNV,17/01/2023,4.85,,R$ / m³,VIBRA ENERGIA,2023-11-21
SE,RJ,RIO DE JANEIRO,AUTO POSTO DO TRABALHO S/A,03.139.910/0017-05,RUA NETUNO,662,,PAVUNA,21525-690,GNV,18/01/2023,4.46,,R$ / m³,BRANCA,2023-11-21
SE,RJ,SAO JOAO DE MERITI,AUTO POSTO ACONCHEGO DE MERITI LTDA,10.925.601/0001-69,RUA CANDIDO MAIA,12,,AGOSTINHO PORTO,25510-050,GNV,16/01/2023,4.79,,R$ / m³,BRANCA,2023-11-21
SE,RJ,DUQUE DE CAXIAS,AUTO POSTO DO TRABALHO S/A,03.139.910/0025-15,RODOVIA WASHINGTON LUIZ,12420,SITIO 21                  AREA C1,PILAR,25213-005,GNV,18/01/2023,4.79,,R$ / m³,BRANCA,2023-11-21
SE,RJ,DUQUE DE CAXIAS,AUTO POSTO DO TRABALHO S/A,03.139.910/0022-72,RODOVIA WASHINGTON LUIZ,14131,,CHACARAS RIO-PETROPOLIS,25230-005,GNV,18/01/2023,4.79,,R$ / m³,BRANCA,2023-11-21
SE,RJ,SAO JOAO DE MERITI,AUTO POSTO DO TRABALHO S/A,03.139.910/0021-91,AVENIDA AUTOMOVEL CLUBE,1215,,JARDIM JOSE BONIFACIO,25565-171,GNV,16/01/2023,4.49,,R$ / m³,BRANCA,2023-11-21
SE,SP,SAO PAULO,ARGETAX ADMINISTRACAO E PARTICIPACOES EM EMPREENDIMENTOS COMERCIAIS LTDA,04.383.988/0006-80,RUA CHICO PONTES,1292,,VILA GUILHERME,02067-002,GNV,16/01/2023,4.89,,R$ / m³,RAIZEN,2023-11-21
S,SC,BALNEARIO CAMBORIU,REDE ECONOMIC COMERCIO DE COMBUSTIVEIS LTDA,08.940.015/0002-22,RODOVIA BR-101,KM 138,,NOVA ESPERANCA,88336-200,GNV,17/01/2023,5.74,,R$ / m³,AMERICANOIL,2023-11-21
SE,SP,SAO CARLOS,ARTAM COMÉRCIO DE COMBUSTÍVEIS LTDA,10.579.113/0001-47,AVENIDA   DOUTOR TEIXEIRA DE BARROS,1258,,VILA PRADO,13574-033,GNV,17/01/2023,5.59,,R$ / m³,IPIRANGA,2023-11-21
SE,RJ,NOVA IGUACU,POSTO DE GNV SERVAUTO II LTDA,10.371.066/0001-41,RODOVIA PRESIDENTE DUTRA BR 116,2560,,AUSTIN,26031-000,GNV,17/01/2023,4.79,,R$ / m³,BRANCA,2023-11-21
SE,RJ,MARICA,POSTO DE COMBUSTIVEIS PIEDRAS DEL MAR LTDA.,11.270.315/0001-75,RODOVIA ERNANI DO AMARAL PEIXOTO,33,N/T,ITAPEBA,24912-710,GNV,17/01/2023,6.71,,R$ / m³,BRANCA,2023-11-21
SE,RJ,SAO GONCALO,GAZPARK PARTICIPACOES LTDA,04.830.682/0001-10,AVENIDA VISCONDE DE SANTAREM,651,"LOTE  01 , 02 , A , B",TRIBOBO,24753-560,GNV,17/01/2023,4.48,,R$ / m³,BRANCA,2023-11-21
SE,RJ,SAQUAREMA,CENTRO AUTOMOTIVO SAQUAREMA GAS LTDA,13.261.358/0001-10,RUA ADILSON OLIVEIRA,SN,LOTE  29,SAO GERALDO ( BACAXA),28995-175,GNV,17/01/2023,5.99,,R$ / m³,BRANCA,2023-11-21
S,RS,PORTO ALEGRE,COMÉRCIO DE COMBUSTÍVEIS LASSARI LTDA.,07.013.898/0001-81,AVENIDA IPIRANGA,3884,,AZENHA,90610-000,GNV,18/01/2023,5.29,,R$ / m³,IPIRANGA,2023-11-21
NE,BA,ALAGOINHAS,2 A COMERCIO DE COMBUSTIVEIS GNV E LUBRIFICANTES LTDA,14.238.511/0001-50,RODOVIA BR 101  KM  116,S/N,SALA  01,CENTRO,48005-440,GNV,17/01/2023,4.29,,R$ / m³,PETROBAHIA,2023-11-21
S,RS,PORTO ALEGRE,CONJUNTO COMERCIAL OREL LTDA,01.367.677/0006-30,AVENIDA CAIRU,1477,,SAO JOAO,90230-031,GNV,17/01/2023,5.24,,R$ / m³,BRANCA,2023-11-21
SE,RJ,TERESOPOLIS,POSTO 01 TREVO ERMITAGE DE TERESOPOLIS LTDA,12.880.259/0001-53,RUA WILHELM CRISTIAN KLEME,850,,ERMITAGE,25975-550,GNV,17/01/2023,4.98,,R$ / m³,IPIRANGA,2023-11-21
S,RS,PORTO ALEGRE,SIM REDE DE POSTOS LTDA,07.473.735/0059-06,AVENIDA ASSIS BRASIL,9216,,SARANDI,91140-000,GNV,17/01/2023,5.49,,R$ / m³,BRANCA,2023-11-21
S,RS,SAO LEOPOLDO,NOBRE ABASTECEDORA DE COMBUSTIVEIS LTDA,03.179.047/0001-52,AVENIDA PAROBE,1200,,SCHARLAU,93140-000,GNV,17/01/2023,5.22,,R$ / m³,VIBRA ENERGIA,2023-11-21
SE,RJ,VOLTA REDONDA,ALIANÇA RETIRO VR COMERCIO DE GNV LTDA,12.937.073/0001-93,RUA GOMES FILHO,44,,RETIRO,27275-090,GNV,17/01/2023,5.29,,R$ / m³,BRANCA,2023-11-21
CO,MS,CAMPO GRANDE,ALBATROZ COMERCIAL DE PETROLEO LTDA,05.383.103/0001-00,AVENIDA COSTA E SILVA,831,SALAO 01,VILA PROGRESSO,79050-010,GNV,17/01/2023,4.89,,R$ / m³,TAURUS,2023-11-21
SE,ES,SAO MATEUS,POSTO DE COMBUSTIVEIS FERRARI SAO MATEUS LTDA,09.369.995/0001-37,RODOVIA BR-101 NORTE,921,KM: 63;,VILA NOVA,29941-010,GNV,19/01/2023,4.59,,R$ / m³,RAIZEN,2023-11-21
N,AM,MANAUS,AMAZON COMBUSTIVEIS PARA VEICULOS E CONSTRUCOES LTDA,10.988.014/0013-52,AVENIDA   TORQUATO TAPAJOS,7841,,TARUMA,69041-025,GNV,17/01/2023,4.19,,R$ / m³,ATEM' S,2023-11-21
S,SC,ITAJAI,SIM REDE DE POSTOS LTDA,07.473.735/0073-56,RODOVIA BR 101,4850-A,"KM    116,8",SALSEIROS,88317-000,GNV,16/01/2023,5.59,,R$ / m³,BRANCA,2023-11-21
SE,RJ,BELFORD ROXO,AUTO POSTO DO TRABALHO S/A,03.139.910/0037-59,AVENIDA JOAQUIM DA COSTA LIMA,14201,,DOS FERREIRAS,26183-604,GNV,18/01/2023,4.89,,R$ / m³,BRANCA,2023-11-21
SE,SP,SUZANO,POSTO DE SERVICOS AUTOMOTIVOS E COMERCIO DE COMBUSTIVEIS ABU-DHABI LTDA,17.449.816/0001-08,RUA DOUTOR PRUDENTE DE MORAES,4135,,VILA SANTANA,08613-900,GNV,18/01/2023,4.89,,R$ / m³,IPIRANGA,2023-11-21
S,RS,CACHOEIRINHA,SAN FRANCISCO COMERCIAL DE COMBUSTIVEIS  LTDA,17.261.255/0001-00,AVENIDA FLORES DA CUNHA,3793,,VILA BOM PRINCIPIO,94950-001,GNV,16/01/2023,5.29,,R$ / m³,IPIRANGA,2023-11-21
SE,RJ,ARARUAMA,AUTO POSTO MONTEIROS DE ARARUAMA LTDA,12.573.801/0001-25,RODOVIA AMARAL PEIXOTO,S/N,KM 83 LT A 1 E B 1,CAPA AZUL,28970-000,GNV,16/01/2023,5.98,,R$ / m³,BRANCA,2023-11-21
SE,MG,GOVERNADOR VALADARES,REDE HG COMBUSTIVEIS LTDA.,13.569.064/0004-00,AVENIDA RIO/BAHIA,S/N,KM: 412 E 33 METROS;,PLANALTO,35054-060,GNV,18/01/2023,5.19,,R$ / m³,VIBRA ENERGIA,2023-11-21
SE,RJ,SAQUAREMA,AUTO POSTO TREVO DE PRAIA SECA LTDA,04.701.270/0001-80,RODOVIA AMARAL PEIXOTO,"76,6",,PRAIA SECA,28993-975,GNV,16/01/2023,6.09,,R$ / m³,VIBRA ENERGIA,2023-11-21
NE,PE,JABOATAO DOS GUARARAPES,GUARARAPES COMBUSTIVEIS LTDA,19.253.000/0001-21,AVENIDA AYRTON SENNA DA SILVA,11,,PIEDADE,54400-020,GNV,17/01/2023,3.99,,R$ / m³,VIBRA ENERGIA,2023-11-21
NE,BA,FEIRA DE SANTANA,POSTO BRX LTDA,19.878.814/0001-51,AVENIDA SAMPAIO,788,TERREO,CENTRO,44026-000,GNV,17/01/2023,4.16,,R$ / m³,VIBRA ENERGIA,2023-11-21
S,RS,GRAVATAI,ABASTECEDORA DE COMBUSTIVEIS CONFIANCA LTDA,20.707.919/0001-27,RUA DOIS DE NOVEMBRO,60,,SALGADO FILHO,94020-170,GNV,16/01/2023,5.26,,R$ / m³,BRANCA,2023-11-21
SE,SP,TAUBATE,CENTRO AUTOMOTIVO SETE ESTRELAS LTDA,55.278.543/0009-14,AVENIDA DOM PEDRO I,5391,,JARDIM BARONESA,12091-000,GNV,16/01/2023,4.97,,R$ / m³,BRANCA,2023-11-21
S,SC,JARAGUA DO SUL,POSTO Z15 LTDA,22.159.389/0001-55,AVENIDA PREFEITO WALDEMAR GRUBBA,4955,,VIEIRA,89257-002,GNV,17/01/2023,5.49,,R$ / m³,IPIRANGA,2023-11-21
S,RS,SAPUCAIA DO SUL,POSTO ZOOLOGICO LTDA,19.588.456/0001-42,RODOVIA BR 116,750,,TRES PORTOS,93212-220,GNV,17/01/2023,5.49,,R$ / m³,RAIZEN,2023-11-21
NE,SE,ARACAJU,PETROX COMERCIAL LTDA,05.297.480/0022-42,AVENIDA PRESIDENTE TANCREDO NEVES,4501,,JABOTIANA,49095-000,GNV,18/01/2023,5.09,,R$ / m³,PETROX DISTRIBUIDORA,2023-11-21
S,RS,CANOAS,POSTO GUAJUVIRAS LTDA,14.934.689/0002-17,AVENIDA GETULIO VARGAS,6251,LOJA  01,MARECHAL RONDON,92020-513,GNV,16/01/2023,5.29,,R$ / m³,IPIRANGA,2023-11-21
NE,SE,ARACAJU,PETROX COMERCIAL LTDA,05.297.480/0023-23,AVENIDA CHANC OSVALDO ARANHA,3090,,OLARIA,49092-545,GNV,16/01/2023,5.09,,R$ / m³,VIBRA ENERGIA,2023-11-21
SE,RJ,SANTO ANTONIO DE PADUA,GNV PADUA COMERCIO DE COMBUSTIVEL LTDA - ME,15.252.610/0001-50,ESTRADA PADUA - PIRAPETINGA,SN,KM    01                  GALPAO02,ARRAIALZINHO,28470-000,GNV,16/01/2023,6.59,,R$ / m³,BRANCA,2023-11-21
S,SC,TUBARAO,POSTO CIDADE AZUL LTDA,23.768.366/0001-00,RODOVIA BR-101,281,KM 337,MORROTES,88704-801,GNV,16/01/2023,6.09,,R$ / m³,VIBRA ENERGIA,2023-11-21
S,RS,CANOAS,SIM REDE DE POSTOS LTDA,07.473.735/0149-99,AVENIDA GETULIO VARGAS,5800,,CENTRO,92010-242,GNV,16/01/2023,5.39,,R$ / m³,RAIZEN,2023-11-21
S,SC,SAO JOSE,ROTA DO SOL COMERCIO DE COMBUSTIVEIS EIRELI,30.360.562/0001-07,AVENIDA PRESIDENTE KENNEDY,34,,CAMPINAS,88101-000,GNV,18/01/2023,5.39,,R$ / m³,IPIRANGA,2023-11-21
NE,SE,ARACAJU,RPB AUTO POSTO LTDA,07.075.892/0005-62,AVENIDA EMPRESARIO JOSE CARLOS SILVA,2003,,AEROPORTO,49035-000,GNV,18/01/2023,5.09,,R$ / m³,VIBRA ENERGIA,2023-11-21
S,RS,PORTO ALEGRE,SIM REDE DE POSTOS LTDA,07.473.735/0153-75,AVENIDA FARRAPOS,4701,,NAVEGANTES,90220-007,GNV,18/01/2023,5.49,,R$ / m³,VIBRA ENERGIA,2023-11-21
NE,PE,JABOATAO DOS GUARARAPES,MARIA ALICE CAVALCANTI DE MORAIS EIRELI,32.522.471/0001-56,AVENIDA AYRTON SENNA DA SILVA,2884,,PIEDADE,54410-240,GNV,17/01/2023,3.99,,R$ / m³,VIBRA ENERGIA,2023-11-21
S,RS,PORTO ALEGRE,SIM REDE DE POSTOS LTDA,07.473.735/0173-19,AVENIDA ASSIS BRASIL,8703,,SARANDI,91140-001,GNV,17/01/2023,5.49,,R$ / m³,VIBRA ENERGIA,2023-11-21
S,RS,IJUI,SIM REDE DE POSTOS LTDA,07.473.735/0167-70,RODOVIA BR 285,S/N,KM    462,INTERIOR,98700-000,GNV,19/01/2023,5.4,,R$ / m³,BRANCA,2023-11-21
S,SC,LAGUNA,ALFA AUTO POSTO LTDA,42.351.107/0001-24,AVENIDA GETULIO VARGAS,681,,MAGALHAES,88790-000,GNV,16/01/2023,5.99,,R$ / m³,BRANCA,2023-11-21
S,RS,LAJEADO,SIM REDE DE POSTOS LTDA,07.473.735/0187-14,RODOVIA ERS-130,2285,KM    72.8,SANTO ANDRE,95912-000,GNV,17/01/2023,5.87,,R$ / m³,CHARRUA,2023-11-21
NE,AL,ARAPIRACA,IBN PINTO E SILVA & CIA LTDA,01.242.690/0001-58,RODOVIA AL-110,678,KM    70,CANAFISTULA,57302-802,GNV,24/01/2023,4.69,,R$ / m³,IPIRANGA,2023-11-21
NE,AL,PALMEIRA DOS INDIOS,SEVERINO S. LOPES & CIA. LTDA,05.331.412/0002-09,AVENIDA MUNIZ FALCÃO,1640,"LOTES 08 E 09, LOT. GASTÃO LEÃO REGO",JOSÉ MAIA COSTA,57605-260,GNV,25/01/2023,5.27,,R$ / m³,VIBRA ENERGIA,2023-11-21
NE,BA,ALAGOINHAS,CPD ENERGETICOS E DERIVADOS DE PETROLEO LTDA.,08.359.486/0001-60,"RODOVIA BR 101, KM 110,5",S/N,,ZONA RURAL,48010-970,GNV,25/01/2023,4.29,,R$ / m³,VIBRA ENERGIA,2023-11-21
NE,BA,SALVADOR,ECOPOSTOS - COMBUSTIVEIS E SERVICOS LTDA,04.420.464/0004-50,AVENIDA BARROS REIS - LADO PAR,2938,ARRAIAL DO RETIRO,ARRAIAL DO RETIRO,41204-025,GNV,24/01/2023,4.14,,R$ / m³,VIBRA ENERGIA,2023-11-21
NE,BA,SALVADOR,J&J COMBUSTIVEIS LTDA,06.115.130/0001-56,AVENIDA ANTONIO CARLOS MAGALHAES,5863,,SANTA TERESA,40265-200,GNV,25/01/2023,4.24,,R$ / m³,IPIRANGA,2023-11-21
NE,BA,SALVADOR,POSTO KALILANDIA LTDA,15.151.046/0012-31,AVENIDA LUIS VIANA,2489,,PERNAMBUES,41130-530,GNV,23/01/2023,4.19,,R$ / m³,RAIZEN,2023-11-21
NE,BA,SALVADOR,GAS ON LINE COMERCIO E SERVICOS LTDA,05.033.611/0001-50,AVENIDA HEITOR DIAS,735,,PAU MIUDO,40315-518,GNV,24/01/2023,4.14,,R$ / m³,IPIRANGA,2023-11-21
NE,BA,SALVADOR,POSTO GAMELEIRA LTDA,13.570.353/0001-79,"RODOVIA RODOVIA BR 324, KM 9,5",S/N,POSTO,PIRAJA,40301-155,GNV,25/01/2023,4.28,,R$ / m³,VIBRA ENERGIA,2023-11-21
NE,BA,SALVADOR,"GRL ORGANIZACAO REVENDEDORA DE COMBUSTIVEIS, LUBRIFICANTES LTDA",40.511.529/0005-18,AVENIDA BARROS REIS,3132,,PAU MIUDO,40310-010,GNV,24/01/2023,4.14,,R$ / m³,RAIZEN,2023-11-21
NE,BA,SALVADOR,POSTOS MATARIPE ABASTECIMENTOS E SERVICOS LTDA,13.578.265/0001-13,AVENIDA MARIO LEAL FERREIRA,2230,VALE DO BONOCO,BROTAS,40285-600,GNV,24/01/2023,4.19,,R$ / m³,VIBRA ENERGIA,2023-11-21
NE,CE,FORTALEZA,DIAS COMERCIO DE DERIVADOS DE PETROLEO LTDA,08.509.458/0001-82,RODOVIA DOUTOR MENDEL STEINBRUCH,6750,,ARACAPE,60765-005,GNV,25/01/2023,4.39,,R$ / m³,RAIZEN,2023-11-21
NE,CE,MARACANAU,DIAS E ROMA LTDA,12.255.543/0002-10,RODOVIA DOUTOR MENDEL STEINBRUCH,9810,KM    04,DISTRITO INDUSTRIAL I,61939-210,GNV,25/01/2023,4.39,,R$ / m³,VIBRA ENERGIA,2023-11-21
NE,CE,MARACANAU,L & S COMERCIO DE COMBUSTIVEIS LTDA,02.858.003/0003-58,RODOVIA DOUTOR MENDEL STEINBRUCH,9953,0,PAJUÇARA,61910-000,GNV,25/01/2023,4.37,,R$ / m³,VIBRA ENERGIA,2023-11-21
SE,ES,LINHARES,POSTO OURO NEGRO LTDA,02.468.894/0001-74,AVENIDA SAMUEL BATISTA CRUZ,2319,,COLINA,29901-401,GNV,25/01/2023,4.99,,R$ / m³,VIBRA ENERGIA,2023-11-21
SE,ES,SERRA,AUTO SERVICO GASVIX LTDA,05.684.518/0001-05,RODOVIA BR 101 NORTE,S/N,"KM    8,5",CARAPINA GRANDE,29160-042,GNV,26/01/2023,4.79,,R$ / m³,VIBRA ENERGIA,2023-11-21
SE,ES,SERRA,COMERCIAL RALORI LTDA,00.611.875/0001-20,RODOVIA NORTE SUL,3595,LOTE  12 13 E 15,CIVIT II,29168-078,GNV,25/01/2023,4.79,,R$ / m³,BRANCA,2023-11-21
SE,ES,VILA VELHA,POSTO ARIBIRI DO GAS LTDA,04.850.382/0001-01,AVENIDA CARLOS LINDEMBERG,1944,,SANTA INEZ,29108-075,GNV,23/01/2023,4.89,,R$ / m³,VIBRA ENERGIA,2023-11-21
SE,ES,VILA VELHA,POSTO TIBERIO LTDA,01.166.046/0001-48,RODOVIA CARLOS LINDEMBERG,386,,JABURUNA,29123-600,GNV,23/01/2023,4.79,,R$ / m³,VIBRA ENERGIA,2023-11-21
SE,ES,VITORIA,J. S. PETROLEO E COMERCIO LTDA.,08.788.618/0001-70,AVENIDA DANTE MICHELINI,2461,,MATA DA PRAIA,29066-430,GNV,23/01/2023,4.79,,R$ / m³,RAIZEN,2023-11-21
SE,ES,VITORIA,ARARA AZUL REDE DE POSTOS LTDA,04.145.589/0006-81,RUA DONA MARIA ROSA,265,,ANDORINHAS,29045-221,GNV,23/01/2023,4.79,,R$ / m³,RAIZEN,2023-11-21
SE,ES,VITORIA,POSTO DE COMBUSTÍVEIS MIRANTE LTDA,02.922.895/0001-47,AVENIDA JOSE MARIA VIVACQUA SANTOS,1675,,AEROPORTO,29160-700,GNV,23/01/2023,4.79,,R$ / m³,IPIRANGA,2023-11-21
SE,MG,BETIM,MILLENNIUM DERIVADOS DE PETROLEO LTDA,03.848.560/0001-99,AVENIDA EDMEIA MATTOS LAZAROTTI,1441,,ANGOLA,32604-228,GNV,24/01/2023,5.24,,R$ / m³,ALESAT,2023-11-21
SE,MG,CONTAGEM,POSTO TROVAO LTDA,01.333.257/0001-28,AVENIDA TITO FULGENCIO,1189,,JARDIM INDUSTRIAL,32215-000,GNV,23/01/2023,4.87,,R$ / m³,VIBRA ENERGIA,2023-11-21
SE,MG,JUIZ DE FORA,SEMPRE COMERCIO DE COMBUSTIVEL LTDA.,08.111.871/0004-37,AVENIDA BRASIL,5201,,MARIANO PROCOPIO,36035-030,GNV,24/01/2023,4.85,,R$ / m³,RAIZEN,2023-11-21
SE,MG,JUIZ DE FORA,AUTO POSTO PETROGAS LTDA,03.862.967/0001-70,AVENIDA JUSCELINO KUBISTSCHEK,6000,,BENFICA,36081-000,GNV,23/01/2023,4.85,,R$ / m³,VIBRA ENERGIA,2023-11-21
SE,MG,SETE LAGOAS,GNV IGAS LTDA,04.758.543/0001-23,RUA DR. SEBASTIAO MASCARENHAS,188,,SAO GERALDO,35700-176,GNV,23/01/2023,4.85,,R$ / m³,ALESAT,2023-11-21
SE,MG,SETE LAGOAS,REDE SANTANA COMBUSTIVEIS E GNV SETE LAGOAS LTDA,04.305.250/0001-90,AVENIDA DR. RENATO AZEREDO,2299,,CHACARA DO PAIVA,35700-312,GNV,23/01/2023,4.85,,R$ / m³,BRANCA,2023-11-21
CO,MS,CAMPO GRANDE,COMERCIAL POSTO MIL LTDA,01.945.104/0001-31,AVENIDA MANOEL DA COSTA LIMA,459,,VILA IPIRANGA,79080-800,GNV,26/01/2023,4.99,,R$ / m³,BRANCA,2023-11-21
NE,PB,BAYEUX,MOTOGAS INDUSTRIA DE COMPRESSAO E COMERCIO DE GAS NATURAL LTDA,01.420.327/0001-85,LOC  BR 230 KM 31,S/N,,ESTRADA,58309-602,GNV,23/01/2023,4.44,,R$ / m³,BRANCA,2023-11-21
NE,PB,CABEDELO,W A BARRETO E CIA LTDA,70.098.470/0004-68,BR-230 KILOMETRO 13,S/N,,KILOMETRO 13,58100-100,GNV,25/01/2023,4.44,,R$ / m³,VIBRA ENERGIA,2023-11-21
NE,PB,CAMPINA GRANDE,MOTOGAS INDUSTRIA DE COMPRESSAO E COMERCIO DE GAS NATURAL LTDA,01.420.327/0004-28,AVENIDA ASSIS CHATEAUBRIAND,2675,,LIBERDADE,58105-421,GNV,23/01/2023,4.69,,R$ / m³,BRANCA,2023-11-21
NE,PB,CAMPINA GRANDE,NOBREGA COMBUSTIVEIS LIMITADA,00.497.918/0001-98,RUA JOAQUIM CAROCA,517,,UNIVERSITARIO,58429-120,GNV,25/01/2023,4.69,,R$ / m³,BRANCA,2023-11-21
NE,PB,CAMPINA GRANDE,POSTO DE COMBUSTIVEIS SAO MARCOS LTDA,01.106.085/0001-50,AVENIDA ASSIS CHATEAUBRIAND,878,,LIBERDADE,58105-000,GNV,23/01/2023,4.69,,R$ / m³,IPIRANGA,2023-11-21
NE,PE,CABO DE SANTO AGOSTINHO,PETRO CABO LTDA,05.097.635/0001-72,RODOVIA PE 60,1900,,GARAPU,54518-343,GNV,23/01/2023,3.99,,R$ / m³,VIBRA ENERGIA,2023-11-21
NE,PE,JABOATAO DOS GUARARAPES,CMA PETROLEO LTDA,05.263.779/0001-51,AVENIDA BERNARDO VIEIRA DE MELO,5160,,CANDEIAS,54450-020,GNV,24/01/2023,3.99,,R$ / m³,RAIZEN,2023-11-21
NE,PE,OLINDA,POSTOS APM LTDA.,02.856.330/0001-09,"AVENIDA GOVERNADOR CARLOS DE LIMA CAVALCANTI,",2570,,CASA CAIADA,53130-000,GNV,24/01/2023,3.99,,R$ / m³,VIBRA ENERGIA,2023-11-21
NE,PE,PAULISTA,FM COMERCIO E DERIVADOS DE PETROLEO LTDA,04.637.954/0001-60,AVENIDA SENADOR SALGADO FILHO,18,,CENTRO,53400-000,GNV,25/01/2023,3.99,,R$ / m³,VIBRA ENERGIA,2023-11-21
NE,PE,RECIFE,INVESTGAS LOCACAO E INVESTIMENTO LIMITADA,07.617.461/0003-19,AVENIDA DA RECUPERACAO,S/N,BR 101 KM 57,GUABIRABA,52091-010,GNV,24/01/2023,3.99,,R$ / m³,VIBRA ENERGIA,2023-11-21
NE,PE,RECIFE,PETRO JOQUEI COMBUSTIVEL LTDA,07.815.352/0001-44,RUA CARLOS GOMES,758,,PRADO,50720-110,GNV,24/01/2023,3.99,,R$ / m³,DISLUB,2023-11-21
NE,PE,RECIFE,M M PETROLEO LTDA,00.935.571/0001-18,AVENIDA GOVERNADOR AGAMENON MAGALHAES,1302,,CAMPO GRANDE,52031-330,GNV,24/01/2023,3.99,,R$ / m³,VIBRA ENERGIA,2023-11-21
NE,PE,RECIFE,WANDERLEY E CLAUDENIER LTDA,08.191.686/0001-57,AVENIDA JOAQUIM RIBEIRO,40,ESQ VOLTA AO MUNDO,CAXANGA,50980-000,GNV,24/01/2023,3.99,,R$ / m³,RAIZEN,2023-11-21
NE,PE,RECIFE,PETRO CAXANGA LTDA,03.737.645/0001-08,AVENIDA CAXANGA,4335,,IPUTINGA,50720-000,GNV,24/01/2023,3.99,,R$ / m³,DISLUB,2023-11-21
S,PR,PONTA GROSSA,POSTO BOA VISTA LTDA,77.488.005/0001-30,AVENIDA DOM PEDRO II,1383,,NOVA RUSSIA,84053-000,GNV,25/01/2023,6.09,,R$ / m³,RAIZEN,2023-11-21
SE,RJ,ARARUAMA,CENTRO AUTOMOTIVO PRAIA DOS COQUEIROS LTDA,09.158.471/0001-05,RODOVIA AMARAL PEIXOTO,90031,KM    88,PRAIA DOS COQUEIROS,28970-000,GNV,23/01/2023,5.99,,R$ / m³,BRANCA,2023-11-21
