Regiao - Sigla,Estado - Sigla,Municipio,Revenda,CNPJ da Revenda,Nome da Rua,Numero Rua,Complemento,Bairro,Cep,Produto,Data da Coleta,Valor de Venda,Valor de Compra,Unidade de Medida,Bandeira,Data da Carga ETL
SE,RJ,RIO DE JANEIRO,POSTO E GARAGEM DOM HELDER CAMARA LTDA,04.802.584/0001-70,AVENIDA DOM HELDER CAMARA,4539,,DEL CASTILHO,20771-000,DIESEL,19/06/2023,4.89,,R$ / litro,RAIZEN,2023-11-21
SE,RJ,RIO DE JANEIRO,RIO NOVA PARADA SRC - POSTO DE GASOLINA LTDA.,05.982.730/0001-59,AVENIDA BRASIL,2021,,BENFICA,20930-041,DIESEL,19/06/2023,5.16,,R$ / litro,RAIZEN,2023-11-21
SE,RJ,RIO DE JANEIRO,AUTO POSTO RECANTO DAS PALMEIRAS LTDA,06.031.327/0001-07,RUA PINTOR LEANDRO JOAQUIM,11,CIDADE DE DEUS,JACAREPAGUA,22770-650,DIESEL,19/06/2023,4.89,,R$ / litro,RAIZEN,2023-11-21
SE,RJ,RIO DE JANEIRO,AUTO POSTO FUTURO GNV DE BONSUCESSO LTDA,05.037.349/0001-11,AVENIDA BRASIL,5721,,BONSUCESSO,21040-360,DIESEL,20/06/2023,4.89,,R$ / litro,BRANCA,2023-11-21
SE,RJ,RIO DE JANEIRO,PIT STOP POSTO DE SERVICOS LTDA,00.622.706/0001-95,AVENIDA BRASIL,9107,,PENHA,21030-000,DIESEL,20/06/2023,5.39,,R$ / litro,VIBRA ENERGIA,2023-11-21
SE,RJ,RIO DE JANEIRO,WEST POINT CAR POSTO DE ABASTECIMENTO LTDA,04.515.980/0001-16,ESTRADA DO MENDANHA,1518,,CAMPO GRANDE,23087-280,DIESEL,19/06/2023,4.95,,R$ / litro,BRANCA,2023-11-21
SE,RJ,RIO DE JANEIRO,POSTO GIGANTE DA DUTRA LTDA,04.488.570/0001-23,RODOVIA PRESIDENTE DUTRA,555,,PARADA DE LUCAS,21240-000,DIESEL,20/06/2023,5.09,,R$ / litro,VIBRA ENERGIA,2023-11-21
SE,RJ,RIO DE JANEIRO,AUTO POSTO CREMONEZE LTDA,01.988.505/0001-79,ESTRADA DO MENDANHA,4240,,CAMPO GRANDE,23092-002,DIESEL,19/06/2023,4.94,,R$ / litro,IPIRANGA,2023-11-21
SE,RJ,RIO DE JANEIRO,AUTO POSTO GOMENSORO LTDA,04.904.156/0001-58,RUA GOMENSORO,9,,OLARIA,21071-420,DIESEL,20/06/2023,4.94,,R$ / litro,RAIZEN,2023-11-21
SE,RJ,RIO DE JANEIRO,AUTO POSTO LUAR  DE OLARIA LTDA.,04.792.023/0001-37,RUA URANOS,1401,,OLARIA,21060-070,DIESEL,20/06/2023,4.99,,R$ / litro,BRANCA,2023-11-21
SE,RJ,RIO DE JANEIRO,POSTO RFD LTDA.,03.996.678/0001-64,AVENIDA BRASIL,1960,,CAJU,20930-040,DIESEL,20/06/2023,5.45,,R$ / litro,RAIZEN,2023-11-21
SE,RJ,RIO DE JANEIRO,POSTO GRANDE OESTE LTDA,03.552.843/0001-99,ESTRADA DO MENDANHA,3246,,CAMPO GRANDE,23097-003,DIESEL,19/06/2023,5.27,,R$ / litro,BRANCA,2023-11-21
SE,RJ,RIO DE JANEIRO,AUTO POSTO E SERVICO BAM BAM LTDA,03.325.858/0001-14,AVENIDA BRASIL,8108,,RAMOS,21030-001,DIESEL,20/06/2023,4.89,,R$ / litro,BRANCA,2023-11-21
SE,RJ,RIO DE JANEIRO,FRENTANA POSTO DE SERVICO LTDA,02.776.121/0001-55,ESTRADA DOS BANDEIRANTES,7800,,CURICICA,22780-084,DIESEL,19/06/2023,5.18,,R$ / litro,BRANCA,2023-11-21
SE,RJ,RIO DE JANEIRO,AUTO POSTO GARDÊNIA AZUL LTDA,02.464.455/0001-93,AVENIDA TENENTE CORONEL MUNIZ DE ARAGÃO,S/N,LOTES 1 E 2,JACAREPAGUÁ,22765-002,DIESEL,19/06/2023,4.87,,R$ / litro,VIBRA ENERGIA,2023-11-21
SE,RJ,RIO DE JANEIRO,POSTO DE GASOLINA NOVA JERUSALEM LTDA,02.358.402/0001-98,AVENIDA BRASIL,5810,,BONSUCESSO,21040-000,DIESEL,20/06/2023,4.94,,R$ / litro,VIBRA ENERGIA,2023-11-21
SE,RJ,SANTO ANTONIO DE PADUA,LIMA BORGES & CIA LTDA,29.114.782/0001-71,RODOVIA BR RJ 186,171,KM 1,SANTA CRUZ,28470-000,DIESEL,19/06/2023,4.86,,R$ / litro,ALESAT,2023-11-21
SE,RJ,SANTO ANTONIO DE PADUA,PADILHA XAVIER COMÉRCIO E SERVIÇOS LTDA,03.748.097/0001-03,RUA HAMILTON ABREU LEITE,S/N,,COSME E DAMIÃO,28470-000,DIESEL,19/06/2023,4.69,,R$ / litro,BRANCA,2023-11-21
SE,RJ,SANTO ANTONIO DE PADUA,AUTO POSTO BOA NOVA DE PÁDUA LTDA,04.543.402/0001-93,ESTRADA PÁDUA PIRAPETINGA,S/N,KM 16 - BOA NOVA,5 º DISTRITO,28470-000,DIESEL,19/06/2023,4.09,,R$ / litro,BRANCA,2023-11-21
SE,RJ,SANTO ANTONIO DE PADUA,POSTO UNIAO PADUA LTDA,03.734.859/0001-12,RUA JOSE DE ALENCAR LEITE,37,,CENTRO,28470-000,DIESEL,19/06/2023,5.12,,R$ / litro,VIBRA ENERGIA,2023-11-21
SE,RJ,SAO GONCALO,AUTO POSTO ARRASTAO LTDA,02.098.872/0001-60,AVENIDA DR. EUGENIO BORGES,1757,,RIO DO OURO,24751-000,DIESEL,19/06/2023,4.99,,R$ / litro,BRANCA,2023-11-21
SE,RJ,SAO GONCALO,POSTO LINDO PARQUE LTDA,05.507.103/0001-66,AVENIDA PRESIDENTE HUMBERTO DE ALENCAR CASTELO BRANCO,1910,,LINDO PARQUE,24420-006,DIESEL,19/06/2023,5.99,,R$ / litro,BRANCA,2023-11-21
SE,RJ,SAO GONCALO,OSORIO'S POSTO E SERVICOS LTDA,04.315.617/0001-57,AVENIDA JOSE MENDONCA DE CAMPOS,1335,,MUTONDO,24450-265,DIESEL,19/06/2023,4.84,,R$ / litro,IPIRANGA,2023-11-21
SE,RJ,SAO GONCALO,POSTO ABREU LTDA,03.668.507/0001-06,RUA MAGALHAES BASTOS,3065,,BOA VISTA,24466-250,DIESEL,19/06/2023,5.69,,R$ / litro,RAIZEN,2023-11-21
SE,RJ,SAO GONCALO,POSTO DE GASOLINA CATARINAO LTDA - EPP,01.524.458/0001-02,AVENIDA DR ALBINO IMPARATO,450,,JARDIM CATARINA,24710-150,DIESEL,19/06/2023,4.69,,R$ / litro,BRANCA,2023-11-21
SE,RJ,SAO GONCALO,AUTO POSTO PRIMEIRAO DO LARANJAL LTDA,04.584.261/0001-57,AVENIDA BISPO DOM JOAO DA MATA,SN,LOTE A,VISTA ALEGRE,24722-525,DIESEL,19/06/2023,5.69,,R$ / litro,VIBRA ENERGIA,2023-11-21
SE,RJ,SAO GONCALO,AUTO POSTO ALEM MAR 2000 LTDA,03.881.873/0001-49,RUA CAPITAO JOAO MANOEL,3364,"",PORTO NOVO,24435-550,DIESEL,19/06/2023,4.69,,R$ / litro,VIBRA ENERGIA,2023-11-21
SE,RJ,SAO GONCALO,CENTRO AUTOMOTIVO DI ITALIA 614 LTDA,03.851.120/0001-90,AVENIDA JOAQUIM DE OLIVEIRA,S/N,4612 LOTE,BOA VISTA,24466-141,DIESEL,19/06/2023,5.49,,R$ / litro,BRANCA,2023-11-21
SE,RJ,SAO GONCALO,POSTO UBAJARA LTDA,01.905.576/0001-60,ESTRADA DA CONCEICAO,567,,ITAUNA,24461-840,DIESEL,19/06/2023,5.14,,R$ / litro,VIBRA ENERGIA,2023-11-21
SE,RJ,SAO GONCALO,AUTO POSTO ALEM DO RIO LTDA,01.028.161/0001-56,RUA VISCONDE DE ITAUNA,1311,"",GRADIM,24466-140,DIESEL,19/06/2023,4.69,,R$ / litro,VIBRA ENERGIA,2023-11-21
SE,RJ,SAO JOAO DE MERITI,POSTO F M DA DUTRA LTDA,03.971.151/0001-85,RODOVIA PRESIDENTE DUTRA,S/N,"KM 8,75",COELHO DA ROCHA,25570-720,DIESEL,20/06/2023,4.72,,R$ / litro,RAIZEN,2023-11-21
SE,RJ,SAO JOAO DE MERITI,AUTO POSTO MARRAKESHY LTDA,07.156.996/0001-78,AVENIDA PRESIDENTE LINCOLN,130,,JARDIM MERITI,25555-201,DIESEL,20/06/2023,5.29,,R$ / litro,RAIZEN,2023-11-21
SE,RJ,SAO JOAO DE MERITI,POSTO DE COMBUSTIVEIS MAIORAL LTDA,05.757.181/0001-19,AVENIDA ARTHUR ANTONIO SENDAS,1062,,CENTRO,25515-420,DIESEL,20/06/2023,5.09,,R$ / litro,BRANCA,2023-11-21
SE,RJ,SAO JOAO DE MERITI,POSTO SERVICO VIP DE SAO JOAO DE MERITI LTDA,02.454.272/0001-97,AVENIDA GETULIO DE MOURA,289,LT 20 E 21    QD 8,CENTRO,25520-661,DIESEL,20/06/2023,5.19,,R$ / litro,BRANCA,2023-11-21
SE,RJ,SAQUAREMA,VERTICE DE SAQUAREMA AUTO POSTO LTDA,08.000.653/0001-82,RUA PROFESSOR SOUZA,777,,BACAXA,28993-000,DIESEL,22/06/2023,5.49,,R$ / litro,BRANCA,2023-11-21
SE,RJ,SAQUAREMA,AUTO POSTO DE SERVIÇO PISSIL LTDA,03.310.691/0001-18,RODOVIA AMARAL PEIXOTO,S/N,"RJ 106 - KM 70,5",BACAXÁ,22765-002,DIESEL,21/06/2023,5.49,,R$ / litro,BRANCA,2023-11-21
SE,RJ,SAQUAREMA,PETROSALLES AUTO POSTO LTDA,00.928.338/0001-08,RUA 21,S/N,"LOTE 04, QUADRA 2229",JACONÉ,28990-000,DIESEL,20/06/2023,5.69,,R$ / litro,VIBRA ENERGIA,2023-11-21
SE,RJ,TRES RIOS,POSTO DE GASOLINA CUTUBA LTDA,07.887.403/0001-43,ESTRADA BR 393 RODOVIA LUCIO MEIRA,S/N,KM 171 + 750 METROS,NOVA NITEROI,25804-010,DIESEL,21/06/2023,4.69,,R$ / litro,BRANCA,2023-11-21
SE,RJ,TRES RIOS,COMERCIO DE PETROLEO E DERIVADOS COND DO RIO NOVO LTDA,86.774.965/0001-57,RUA BARBOSA DE ANDRADE,242,,CENTRO,25802-160,DIESEL,20/06/2023,5.19,,R$ / litro,RAIZEN,2023-11-21
SE,RJ,TRES RIOS,POSTO DUAS COLUNAS LTDA,30.991.855/0001-92,AVENIDA CONDESSA DO RIO NOVO,1051,,CENTRO,25803-000,DIESEL,21/06/2023,4.99,,R$ / litro,VIBRA ENERGIA,2023-11-21
SE,RJ,VOLTA REDONDA,POSTO DE GASOLINA CAMURI LTDA.,30.440.945/0001-95,RUA FERNANDO FERRARI,898,0,RETIRO,27280-080,DIESEL,20/06/2023,5.25,,R$ / litro,IPIRANGA,2023-11-21
NE,RN,CAICO,ALYSSON SMITH DA NOBREGA MAIA,05.757.137/0001-09,RODOVIA BR 427,1,KM    4.5,VILA ALTIVA II,59300-000,DIESEL,21/06/2023,5.29,,R$ / litro,BRANCA,2023-11-21
NE,RN,CAICO,POSTO DE COMBUSTIVEL BOA VISTA LTDA,04.077.134/0001-61,RUA RUI MARIZ,1259,,BOA PASSAGEM,59300-000,DIESEL,21/06/2023,5.44,,R$ / litro,VIBRA ENERGIA,2023-11-21
NE,RN,CAICO,AUTO POSTO IRMAOS LTDA,08.533.200/0001-11,RUA RENATO DANTAS,787,,CENTRO,59300-000,DIESEL,21/06/2023,5.19,,R$ / litro,RAIZEN,2023-11-21
NE,RN,CAICO,POSTO CAICO LTDA,04.209.396/0001-32,RUA MANOEL GONCALVES DE MELO,375,,BARRA NOVA,59300-000,DIESEL,21/06/2023,5.2,,R$ / litro,VIBRA ENERGIA,2023-11-21
NE,RN,NATAL,M. B. COM. E DERIVADOS DE PETROLEO EIRELI,08.345.698/0001-99,RUA JAGUARARI,4227,,CANDELARIA,59064-500,DIESEL,19/06/2023,5.89,,R$ / litro,ALESAT,2023-11-21
NE,RN,NATAL,CARAU COMBUSTIVEIS LTDA,05.564.770/0002-61,AVENIDA RUI BARBOSA,1295,,LAGOA NOVA,59056-300,DIESEL,19/06/2023,4.99,,R$ / litro,ALESAT,2023-11-21
NE,RN,NATAL,SOCIEDADE DOIS IRMAOS LTDA,08.208.910/0001-76,RUA MARIO NEGOCIO,2298,,QUINTAS,59037-155,DIESEL,19/06/2023,5.49,,R$ / litro,BRANCA,2023-11-21
NE,RN,NATAL,JOAQUIM ALVES FLOR & CIA LTDA,08.328.395/0008-34,AV BEL TOMAZ LANDIM,4500,,IGAPÓ,59104-000,DIESEL,19/06/2023,4.99,,R$ / litro,VIBRA ENERGIA,2023-11-21
NE,RN,NATAL,DISTRIBUIDORA DE COMBUSTIVEIS FRONTEIRAS LTDA,02.343.493/0001-98,RUA DAO SILVEIRA,8000,,PITIMBU,59066-180,DIESEL,20/06/2023,4.99,,R$ / litro,ALESAT,2023-11-21
N,RO,PORTO VELHO,V A VICENTE - EPP,01.751.896/0001-03,RUA PLACIDO DE CASTRO,9962,,MARIANA,76813-548,DIESEL,20/06/2023,5.13,,R$ / litro,VIBRA ENERGIA,2023-11-21
N,RO,ARIQUEMES,J M COMERCIO DE COMBUSTIVEL LTDA,07.928.956/0001-05,AVENIDA CAPITAO SILVIO ESQUINA COM RUA PERIMETRAL LESTE,5303,,SETOR 02,78930-000,DIESEL,19/06/2023,5.19,,R$ / litro,VIBRA ENERGIA,2023-11-21
N,RO,ARIQUEMES,AUTO POSTO SILVESTRE COMÉRCIO DE COMBUTÍVEIS EIRELI,07.939.258/0001-05,AVENIDA TRANCREDO NEVES,2675,,SETOR 03,78930-000,DIESEL,19/06/2023,5.4,,R$ / litro,VIBRA ENERGIA,2023-11-21
N,RO,ARIQUEMES,",D. E. COMÉRCIO DE COMBUSTÍVEIS LTDA",05.147.841/0001-40,AVENIDA CANÃA,2987,,SETOR 03,78930-000,DIESEL,19/06/2023,5.54,,R$ / litro,IPIRANGA,2023-11-21
N,RO,ARIQUEMES,SÃO VICENTE COMBUSTÍVEIS LTDA,01.788.375/0001-20,LOTE 102 GLEBA 05,S/N,,SETOR DE CHACARAS,78930-000,DIESEL,19/06/2023,5.7,,R$ / litro,IPIRANGA,2023-11-21
N,RO,ARIQUEMES,CENTRAL POSTO POLEGATO COMERCIO DE COMBUSTIVEIS EIRELI,05.482.993/0001-07,AVENIDA CANAA,3381-A,LOTE 2-A                  BLOCO A                   QUADRA COMERCIAL,SETOR 03,76870-503,DIESEL,19/06/2023,5.34,,R$ / litro,VIBRA ENERGIA,2023-11-21
N,RO,ARIQUEMES,R C COMERCIO DE COMBUSTIVEIS LTDA,04.269.976/0001-15,AVENIDA CAPITAO SILVIO,3798 B,,SETOR DE GRANDES AREAS,76872-899,DIESEL,19/06/2023,5.15,,R$ / litro,BRANCA,2023-11-21
N,RO,CACOAL,AUTO POSTO SOBERANO LTDA,07.219.464/0001-32,AVENIDA CASTELO BRANCO,21026,,NOVO HORIZONTE,76962-070,DIESEL,20/06/2023,5.13,,R$ / litro,VIBRA ENERGIA,2023-11-21
N,RO,CACOAL,VIOLATO E CIA LTDA,04.903.852/0002-20,AVENIDA SÃO PAULO,2800,,CENTRO,78976-020,DIESEL,20/06/2023,5.34,,R$ / litro,VIBRA ENERGIA,2023-11-21
N,RO,CACOAL,PEREIRA COMERCIO DE PETROLEO LTDA,05.921.366/0001-17,AVENIDA CASTELO BRANCO,20080,,NOVO HORIZONTE,78976-970,DIESEL,20/06/2023,6.35,,R$ / litro,IPIRANGA,2023-11-21
N,RO,CACOAL,CRIVALE AUTO POSTO LTDA,05.057.143/0001-53,AVENIDA CASTELO BRANCO,S/N,"LOTE 01, QUADRA 78, SETOR 06",JARDIM BANDEIRANTES,78976-230,DIESEL,20/06/2023,5.62,,R$ / litro,IPIRANGA,2023-11-21
N,RO,PIMENTA BUENO,MARKA COMERCIO DE COMBUSTIVEIS LTDA,06.100.868/0001-40,AVENIDA CARLOS DONEJE,S/N,"LOTES 07 E 08, QUADRA 18, SETOR 03",SERINGAL,78984-000,DIESEL,21/06/2023,5.5,,R$ / litro,VIBRA ENERGIA,2023-11-21
N,RO,PIMENTA BUENO,VIEIRA & RANITE LTDA,03.566.347/0001-94,RODOVIA BR 364 KM 194,S/N,QUADRA 02,SETOR INDUSTRIAL,78984-000,DIESEL,21/06/2023,5.55,,R$ / litro,IPIRANGA,2023-11-21
N,RO,PIMENTA BUENO,AUTO POSTO PIMENTA BUENO LTDA,04.380.678/0001-06,RODOVIA BR 364,S/N,KM 197,CENTRO,78984-000,DIESEL,21/06/2023,5.53,,R$ / litro,VIBRA ENERGIA,2023-11-21
N,RO,PIMENTA BUENO,POSTO SIMONI LTDA,02.988.602/0001-24,AVENIDA MARECHAL RONDON,2245,,APIDIA,76970-000,DIESEL,21/06/2023,5.54,,R$ / litro,IPIRANGA,2023-11-21
N,RO,PIMENTA BUENO,COMERCIO DE PETROLEO PIMENTAO LTDA,02.527.341/0001-45,"RODOVIA BR 364, KM 507",S/N,,BELA VISTA,76970-000,DIESEL,21/06/2023,5.06,,R$ / litro,VIBRA ENERGIA,2023-11-21
N,RO,PORTO VELHO,ÁGUIA COMERCIO COMBUSTÍVEIS E DERIVADOS PETRÓLEO LTDA,00.907.431/0001-36,RUA UNIÃO,2495,,SOCIALISTA,76829-252,DIESEL,20/06/2023,5.26,,R$ / litro,VIBRA ENERGIA,2023-11-21
N,RR,BOA VISTA,J. M. G. VALLADAO,07.379.366/0001-62,AVENIDA VENEZUELA,887,,PRICUMA,69309-690,DIESEL,20/06/2023,5.6,,R$ / litro,BRANCA,2023-11-21
N,RR,BOA VISTA,MARTINS & CIA LTDA,06.993.922/0001-23,AVENIDA SAO SEBASTIAO,1813,,SANTA TEREZA,69314-152,DIESEL,20/06/2023,5.7,,R$ / litro,VIBRA ENERGIA,2023-11-21
N,RR,BOA VISTA,A P FACCIO,03.611.874/0001-73,AVENIDA BRASIL,1228,QUADRA 74,CINTURAO VERDE,69312-450,DIESEL,20/06/2023,5.7,,R$ / litro,VIBRA ENERGIA,2023-11-21
N,RR,BOA VISTA,J. PEREIRA DE JESUS & CIA LTDA,03.980.102/0001-09,RUA 01,56,,JARDIM TROPICAL,69314-580,DIESEL,20/06/2023,5.6,,R$ / litro,VIBRA ENERGIA,2023-11-21
N,RR,BOA VISTA,RENY DE A. RODRIGUES EIRELI,01.982.756/0001-46,AVENIDA DAS GUIANAS C/BENTO BRASIL,568,,CALUNGA,69308-161,DIESEL,20/06/2023,5.7,,R$ / litro,VIBRA ENERGIA,2023-11-21
N,RR,BOA VISTA,KOTINSKI & CIA LTDA,01.468.484/0001-60,AVENIDA VILLE ROY,5002,,SAO FRANCISCO,69305-098,DIESEL,19/06/2023,5.7,,R$ / litro,VIBRA ENERGIA,2023-11-21
N,RR,BOA VISTA,RORAIPETRO RORAIMA PETROLEO LTDA,00.581.612/0002-04,AVENIDA GENERAL ATAIDE TEIVE,4412,,CAIMBE,69312-218,DIESEL,20/06/2023,5.6,,R$ / litro,BRANCA,2023-11-21
N,RR,BOA VISTA,RORAIPETRO RORAIMA PETROLEO LTDA,00.581.612/0001-15,RUA CECILIA BRASIL,969,,CENTRO,69301-080,DIESEL,20/06/2023,5.6,,R$ / litro,BRANCA,2023-11-21
S,RS,ALVORADA,ANTONIO HOFFMANN SANTANA,08.818.686/0001-34,AVENIDA PRESIDENTE GETULIO VARGAS,3501,,PRIMAVERA,94818-000,DIESEL,20/06/2023,4.79,,R$ / litro,VIBRA ENERGIA,2023-11-21
S,RS,ALVORADA,C. M. J. COMERCIO DE COMBUSTIVEIS LTDA,07.694.512/0001-44,AVENIDA PRESIDENTE GETULIO VARGAS,5559,,TIJUCA,94836-000,DIESEL,20/06/2023,4.79,,R$ / litro,BRANCA,2023-11-21
S,RS,ALVORADA,COMERCIAL DE COMBUSTIVEIS OTTEN LTDA,02.716.930/0001-71,AVENIDA PRESIDENTE VARGAS,259,,CENTRO,94810-000,DIESEL,20/06/2023,5.39,,R$ / litro,IPIRANGA,2023-11-21
S,RS,BAGE,L. CASTRO COMERCIO DE COMBUSTIVEIS LTDA,05.799.373/0002-79,RUA EMÍLIO GUILAIN,673,,CENTRO,96415-100,DIESEL,21/06/2023,5.89,,R$ / litro,IPIRANGA,2023-11-21
S,RS,BAGE,F.F.STAEVIE COMBUSTIVEIS LTDA,05.757.241/0001-01,AVENIDA SANTA TECLA,1891,,GETULIO VARGAS,96413-000,DIESEL,21/06/2023,5.67,,R$ / litro,VIBRA ENERGIA,2023-11-21
S,RS,BAGE,L. CASTRO COMERCIO DE COMBUSTIVEIS LTDA,05.799.373/0001-98,AVENIDA ESPANHA,1190,,HIDRAULICA,96408-000,DIESEL,21/06/2023,5.89,,R$ / litro,IPIRANGA,2023-11-21
S,RS,BAGE,GBI COMBUSTIVEIS LTDA.,90.589.698/0001-15,RUA GENERAL SAMPAIO,201,,CENTRO,96400-370,DIESEL,21/06/2023,5.99,,R$ / litro,IPIRANGA,2023-11-21
S,RS,BAGE,COMERCIAL INTERNACIONAL LTDA,93.810.919/0001-21,RUA GAL.OSORIO,98,,CENTRO,96405-050,DIESEL,21/06/2023,6.06,,R$ / litro,IPIRANGA,2023-11-21
S,RS,CACHOEIRA DO SUL,COOP. DOS MOTORISTAS PROFIS. DE CACHOEIRA DO SUL LTDA,87.012.050/0001-77,RUA MIGUEL LORETO SOBRINHO,28,ESQUINA COM BR 153,DISTRITO INDUSTRIAL,96501-150,DIESEL,21/06/2023,4.84,,R$ / litro,IPIRANGA,2023-11-21
S,RS,CANOAS,NEVES OLIVEIRA & CIA LTDA,01.257.413/0001-19,RUA BOQUEIRAO,2710,,ESTANCIA VELHA,92032-420,DIESEL,19/06/2023,4.89,,R$ / litro,IPIRANGA,2023-11-21
S,RS,CANOAS,MD COMERCIAL DE COMBUSTIVEIS LTDA,02.603.779/0003-27,AVENIDA SANTOS FERREIRA,3800,,ESTANCIA VELHA,92030-000,DIESEL,19/06/2023,5.09,,R$ / litro,BRANCA,2023-11-21
S,RS,SAO LEOPOLDO,POSTOS DE COMBUSTIVEIS REDESINOS LTDA,01.731.418/0001-31,AVENIDA FEITORIA,4288,,FEITORIA,93048-000,DIESEL,19/06/2023,4.89,,R$ / litro,BRANCA,2023-11-21
S,RS,CANOAS,M MELLO & CIA LTDA,04.300.484/0001-45,AVENIDA GETULIO VARGAS,3881,,NITEROI,92110-330,DIESEL,19/06/2023,4.75,,R$ / litro,BRANCA,2023-11-21
S,RS,CANOAS,CONJUNTO COMERCIAL OREL LTDA,01.367.677/0001-25,AVENIDA DR BARCELOS,1505,,CENTRO,92310-200,DIESEL,19/06/2023,7.19,,R$ / litro,BRANCA,2023-11-21
S,RS,CAXIAS DO SUL,AUTO POSTO PETROLINO LTDA,02.272.093/0002-10,AVENIDA   ALEXANDRE RIZZO,703,,DESVIO RIZZO,95110-000,DIESEL,20/06/2023,4.93,,R$ / litro,BRANCA,2023-11-21
S,RS,CAXIAS DO SUL,ANDEBRAZ MEGA POSTOS LTDA,04.596.456/0004-60,RUA ANGELO AGOSTINI,888,,PIONEIRO,95042-090,DIESEL,19/06/2023,4.98,,R$ / litro,VIBRA ENERGIA,2023-11-21
S,RS,CAXIAS DO SUL,POSTO TIROL LTDA,02.321.002/0001-08,ESTRADA BR 116,2570,ESQUINA LUIZ MICHELON,LUIZ MICHELON,95070-070,DIESEL,19/06/2023,4.99,,R$ / litro,IPIRANGA,2023-11-21
S,RS,CAXIAS DO SUL,SQUIZZATO COMERCIO DE COMBUSTIVEIS LTDA,00.547.721/0001-16,RUA ALEXANDRE RIZZO,877,,DESVIO RIZZO,95110-000,DIESEL,20/06/2023,4.94,,R$ / litro,RAIZEN,2023-11-21
S,RS,CRUZ ALTA,COMERCIAL DE COMBUSTIVEIS MARTINS LTDA,89.599.666/0001-11,RUA BARAO DO RIO BRANCO,779,,CENTRO,98005-030,DIESEL,21/06/2023,5.29,,R$ / litro,VIBRA ENERGIA,2023-11-21
S,RS,LAJEADO,COMERCIO DE COMBUSTIVEIS FLORESTAL LTDA,02.558.109/0007-60,RODOVIA BR 386,1005,KM 347,HIDRAULICA,95900-000,DIESEL,20/06/2023,4.59,,R$ / litro,VIBRA ENERGIA,2023-11-21
S,RS,NOVO HAMBURGO,DG COMERCIO DE COMBUSTIVEIS E LUBRIFICANTES LTDA,07.852.300/0001-48,RUA RINCAO,1110,,PETROPOLIS,93346-340,DIESEL,21/06/2023,4.59,,R$ / litro,BRANCA,2023-11-21
S,RS,NOVO HAMBURGO,DA COMERCIO DE COMBUSTIVEIS E LUBRIFICANTES LTDA,07.779.562/0001-24,AVENIDA GENERAL DALTRO FILHO,494,,HAMBURGO VELHO,93534-034,DIESEL,19/06/2023,4.59,,R$ / litro,BRANCA,2023-11-21
S,RS,NOVO HAMBURGO,DC COMÉRCIO DE COMBUSTÍVEIS E LUBRIFICANTES LTDA.,07.779.520/0001-93,RUA MUNDO NOVO,133,,CANUDOS,93548-000,DIESEL,21/06/2023,4.59,,R$ / litro,BRANCA,2023-11-21
S,RS,PELOTAS,PRINCESA COMERCIO DE COMBUSTIVEIS LTDA - ME,08.051.523/0001-79,ESTRADA BR 116 KM 513,S/N,,RETIRO,96065-000,DIESEL,19/06/2023,5.53,,R$ / litro,IPIRANGA,2023-11-21
S,RS,PELOTAS,LUIZ ERMINDO TIMM,02.702.870/0001-38,AVENIDA FERNANDO OSORIO,3088,,TRES VENDAS,96065-000,DIESEL,19/06/2023,4.99,,R$ / litro,BRANCA,2023-11-21
S,RS,PELOTAS,COMERCIO DE COMBUSTIVEIS AVENIDA LTDA,01.378.099/0002-03,AVENIDA FERNANDO OSORIO,5660,,TRES VENDAS,96065-000,DIESEL,19/06/2023,4.89,,R$ / litro,BRANCA,2023-11-21
S,RS,PELOTAS,CORRIENTES COMERCIO DE COMBUSTIVEIS LTDA.,87.455.002/0005-87,AVENIDA RIO GRANDE DO SUL,1154,,LARANJAL,96090-590,DIESEL,20/06/2023,4.94,,R$ / litro,BRANCA,2023-11-21
S,RS,PELOTAS,COMERCIO DE COMBUSTIVEIS AVENIDA LTDA,01.378.099/0001-22,AVENIDA DUQUE DE CAXIAS,208,,FRAGATA,96030-002,DIESEL,20/06/2023,5.25,,R$ / litro,IPIRANGA,2023-11-21
S,RS,RIO GRANDE,MARE COMBUSTIVEIS E INCORPORACOES LTDA,01.718.007/0001-06,AVENIDA ITALIA,1950,,VILA MARIA JOSE,96203-000,DIESEL,20/06/2023,4.89,,R$ / litro,BRANCA,2023-11-21
S,RS,SANTA CRUZ DO SUL,ABASTECEDORA VINTE E OITO LTDA,07.565.952/0001-00,RUA SAO JOSE,1449,,CENTRO,96810-460,DIESEL,20/06/2023,5.34,,R$ / litro,RAIZEN,2023-11-21
S,RS,SANTA CRUZ DO SUL,F. C. SMIDT & CIA. LTDA.,06.194.094/0001-63,AVENIDA DEPUTADO EUCLIDES NICOLAU KLIEMANN,1720,,ARROIO GRANDE,96835-000,DIESEL,20/06/2023,5.14,,R$ / litro,CHARRUA,2023-11-21
S,RS,SANTA CRUZ DO SUL,GIOVANE F. PICK & CIA. LTDA.,02.906.922/0002-79,TRAVESSA VINICIUS DE MORAES,387,POSTO CENTRAL,VILA SCHULTZ,96845-760,DIESEL,20/06/2023,5.29,,R$ / litro,IPIRANGA,2023-11-21
S,RS,SANTA CRUZ DO SUL,POSTO WENZEL LTDA.,05.407.017/0001-81,AVENIDA PREFEITO ORLANDO OSCAR BAUMHARDT,2019,,LINHA SANTA CRUZ,96822-050,DIESEL,20/06/2023,5.19,,R$ / litro,CHARRUA,2023-11-21
S,RS,SANTA CRUZ DO SUL,ABASTECEDORA DE COMBUSTIVEIS T W LTDA,00.110.559/0001-74,RUA SENADOR PINHEIRO MACHADO,1367,,SENAI,96845-850,DIESEL,20/06/2023,5.12,,R$ / litro,RAIZEN,2023-11-21
S,RS,SANTA MARIA,CAMOBI COMERCIO E TRANSPORTES LTDA,07.538.128/0001-52,ESTRADA RS 509,5015,,CAMOBI,97095-000,DIESEL,20/06/2023,4.99,,R$ / litro,VIBRA ENERGIA,2023-11-21
S,RS,SANTA MARIA,COMERCIO DE COMBUSTIVEIS PADOIN LTDA,04.340.316/0002-64,"RODOVIA RST 287 KM 2,8",S/N,,CAMOBI,97060-500,DIESEL,20/06/2023,5.19,,R$ / litro,VIBRA ENERGIA,2023-11-21
S,RS,SANTA MARIA,POSTO DE COMBUSTIVEIS FAIXA NOVA - EIRELI,05.549.818/0001-81,RODOVIA RST 287,1389,,CAMOBI,97105-910,DIESEL,20/06/2023,4.85,,R$ / litro,CHARRUA,2023-11-21
S,RS,SANTA MARIA,COMERCIO DE COMBUSTIVEIS PADOIN LTDA,04.340.316/0001-83,AVENIDA GOVERNADOR WALTER JOBIM,353,,PATRONATO,97020-355,DIESEL,20/06/2023,5.19,,R$ / litro,VIBRA ENERGIA,2023-11-21
S,RS,SANTA MARIA,SIQUEIRA COMBUSTIVEIS - EIRELI,00.404.231/0001-60,AVENIDA ANGELO BOLSON,738,,MEDIANEIRA,97070-000,DIESEL,20/06/2023,5.79,,R$ / litro,RAIZEN,2023-11-21
S,RS,SANTA ROSA,COOPERATIVA MISTA SAO LUIZ LTDA,98.338.072/0041-35,AVENIDA INHACORA,673,,CENTRO,98780-818,DIESEL,21/06/2023,5.04,,R$ / litro,RODOIL,2023-11-21
S,RS,SANTA ROSA,AUTO POSTO EXPEDICIONÁRIO LTDA.,04.265.280/0001-10,AVENIDA EXPEDICIONARIO WEBER,734,,CENTRO,98900-000,DIESEL,21/06/2023,4.99,,R$ / litro,IPIRANGA,2023-11-21
S,RS,SANTA ROSA,FLAVIA P. SCHNEIDER,93.884.450/0001-75,AVENIDA BORGES DE MEDEIROS,39,0,CENTRO,98900-000,DIESEL,21/06/2023,4.99,,R$ / litro,IPIRANGA,2023-11-21
S,RS,SANTA ROSA,POSTO DE COMBUSTIVEIS VACCARI LTDA,87.687.489/0001-08,AVENIDA RIO BRANCO,26,,CENTRO,98780-702,DIESEL,21/06/2023,4.99,,R$ / litro,IPIRANGA,2023-11-21
S,RS,SANTANA DO LIVRAMENTO,AUTO POSTO CABURE LTDA,90.207.218/0001-04,RUA 13 DE MAIO,1364,,CENTRO,97573-500,DIESEL,20/06/2023,5.49,,R$ / litro,VIBRA ENERGIA,2023-11-21
S,RS,SAO LEOPOLDO,ABASTECEDORA DE COMBUSTIVEIS BR 116 EIRELI,05.238.312/0001-51,AVENIDA FEITORIA,600,,BAIRRO SO JOSE,93040-290,DIESEL,19/06/2023,4.89,,R$ / litro,BRANCA,2023-11-21
S,RS,SAO LEOPOLDO,POSTO MONTREAL LTDA.,03.613.556/0001-41,AVENIDA GETULIO VARGAS,780,,CENTRO,93025-000,DIESEL,19/06/2023,4.67,,R$ / litro,RAIZEN,2023-11-21
S,RS,SAO LEOPOLDO,ARGOS COMERCIAL DE COMBUSTIVEIS LTDA,00.959.052/0001-90,AVENIDA CAXIAS DO SUL,950,,RIO DOS SINOS,93110-000,DIESEL,19/06/2023,4.64,,R$ / litro,RAIZEN,2023-11-21
S,RS,SAPIRANGA,POSTO FERRABRAZ LTDA,04.750.332/0001-44,RODOVIA RS-239,200,KM 30,VOO LIVRE,93822-200,DIESEL,21/06/2023,4.64,,R$ / litro,BRANCA,2023-11-21
S,RS,TORRES,ABASTECEDORA DE COMBUSTIVEIS ENGENHO VELHO LTDA,02.670.376/0001-39,AVENIDA CASTELO BRANCO,1051,,ENGENHO VELHO,95560-000,DIESEL,21/06/2023,4.56,,R$ / litro,BRANCA,2023-11-21
S,RS,URUGUAIANA,J A LIMA & CIA LTDA,87.540.225/0004-61,ESTRADA BR 290 KM 714,SN,,INTERIOR,97510-431,DIESEL,20/06/2023,5.17,,R$ / litro,RAIZEN,2023-11-21
S,RS,URUGUAIANA,PILLON COMERCIO DE COMBUSTIVEIS LTDA,74.108.226/0001-47,AVENIDA MARECHAL SETEMBRINO DE CARVALHO,1438,BLOCO A,IPIRANGA,97507-380,DIESEL,20/06/2023,5.33,,R$ / litro,RAIZEN,2023-11-21
S,RS,VACARIA,ANDEBRAZ MEGA POSTOS LTDA,04.596.456/0005-40,RODOVIA BR.116 - KM.43,S/N.,,RODOVIA,95200-000,DIESEL,19/06/2023,4.98,,R$ / litro,RODOIL,2023-11-21
S,RS,VACARIA,COMERCIO DE COMBUSTIVEIS POLLY POSITION LTDA,08.051.756/0001-71,AVENIDA JUSCELINO K DE OLIVEIRA,8669,,JARDIM DOS PAMPAS,95200-000,DIESEL,19/06/2023,4.69,,R$ / litro,BRANCA,2023-11-21
S,RS,VACARIA,PG COMERCIO E TRANSPORTES DE COMBUSTIVEIS LTDA,88.645.635/0001-97,AVENIDA MILITAR,2525,,GLORIA,95216-014,DIESEL,19/06/2023,4.96,,R$ / litro,IPIRANGA,2023-11-21
S,RS,VACARIA,POSTO DE COMBUSTIVEIS ULYSSE MARASCHIN LTDA,01.978.708/0002-65,AVENIDA MILITAR,398,,NOSSA SENHORA DE FATIMA,95210-024,DIESEL,19/06/2023,5.29,,R$ / litro,BRANCA,2023-11-21
S,RS,VIAMAO,AUTO POSTO GALANOS LTDA,07.478.127/0001-60,ESTRADA DO COCAO,4724,,JARDIM DO COCAO,94420-230,DIESEL,19/06/2023,4.69,,R$ / litro,IPIRANGA,2023-11-21
S,RS,VIAMAO,POSTO DE COMBUSTIVEL DA FIGUEIRA EIRELI,02.308.408/0001-50,RODOVIA RS 040 KM 18,3536,,AGUAS CLARAS,94760-970,DIESEL,19/06/2023,4.96,,R$ / litro,RAIZEN,2023-11-21
S,SC,XANXERE,AUTO POSTO COLPANI LTDA,01.925.729/0001-31,ROD. SC 480,S/N,KM 90,NOSSA SENHORA DE LOURDES,89820-000,DIESEL,21/06/2023,4.87,,R$ / litro,VIBRA ENERGIA,2023-11-21
S,SC,BRUSQUE,POSTO CARAVELLAS LTDA,03.782.332/0001-63,ROTULA FELIPE SCHMIDT,341,,CENTRO,88350-000,DIESEL,20/06/2023,5.69,,R$ / litro,VIBRA ENERGIA,2023-11-21
S,SC,CONCORDIA,POSTO SAO JORGE LTDA,85.152.536/0001-85,RUA ADILIO HILARIO MUTZENBERG,1607,,GUILHERME REICH,89709-132,DIESEL,19/06/2023,5.4,,R$ / litro,BRANCA,2023-11-21
S,SC,CRICIUMA,MG COMERCIO DE COMBUSTIVEIS LTDA,07.777.289/0001-07,AVENIDA LUIZ LAZZARIN,25,,RIO MAINA,88817-000,DIESEL,20/06/2023,4.99,,R$ / litro,IPIRANGA,2023-11-21
S,SC,CRICIUMA,POSTO IMOLA LTDA,05.525.987/0001-81,RODOVIA SEBASTIAO TOLEDO DOS SANTOS,1441,LOTE  15                  PAVLH I,COLONINHA ZILLI,88810-805,DIESEL,20/06/2023,4.84,,R$ / litro,BRANCA,2023-11-21
S,SC,CRICIUMA,COMERCIAL DE COMBUSTIVEIS GOULART LTDA,00.446.121/0001-61,AVENIDA UNIVERSITARIA,S/N,,SÃO DEFENDE,88806-000,DIESEL,20/06/2023,4.69,,R$ / litro,IPIRANGA,2023-11-21
S,SC,CRICIUMA,AUTO POSTO E COMERCIO DAROLT LTDA,81.389.868/0001-27,RUA DESEMBARGADOR PEDRO SILVA,S/N,,SÃO LUIZ,88803-200,DIESEL,19/06/2023,4.84,,R$ / litro,IPIRANGA,2023-11-21
S,SC,CRICIUMA,POSTO ALBINO COMERCIO DE COMBUSTIVEIS E TRANSPORTES LTDA,82.169.897/0001-46,AVENIDA LUIZ LAZZARIN,2274,,SANTO ANTONIO,88810-350,DIESEL,20/06/2023,4.84,,R$ / litro,RAIZEN MIME,2023-11-21
S,SC,LAGES,COMERCIO DE COMBUSTIVEIS COPACABANA LTDA,04.290.969/0002-86,AVENIDA 1.O  DE MAIO,"1,113",,POPULAR,88526-070,DIESEL,21/06/2023,4.99,,R$ / litro,ALESAT,2023-11-21
S,SC,LAGES,AUTO POSTO DUQUE LTDA.,05.598.939/0001-13,AVENIDA DUQUE DE CAXIAS,508,,SAGR CORACAO JESUS,88508-000,DIESEL,22/06/2023,5.34,,R$ / litro,IPIRANGA,2023-11-21
S,SC,LAGES,AUTO POSTO OURO PRETO LTDA,80.731.235/0001-92,AVENIDA DOM PEDRO SEGUNDO,299,,CORAL,88509-130,DIESEL,21/06/2023,5.19,,R$ / litro,IPIRANGA,2023-11-21
S,SC,LAGES,COMERCIO DE COMBUSTIVEIS COPACABANA LTDA,04.290.969/0001-03,AVENIDA BELIZIARIO RAMOS,1135,POSTO,COPACABANA,88504-040,DIESEL,22/06/2023,4.99,,R$ / litro,ALESAT,2023-11-21
S,SC,PALHOCA,MARQUINHO COMBUSTIVEIS E SERVICOS LTDA,05.991.479/0001-99,RUA NOSSA SENHORA APARECIDA,S/N,,JARDIM ELDORADO,88133-400,DIESEL,19/06/2023,5.09,,R$ / litro,ALESAT,2023-11-21
S,SC,PALHOCA,AUTO POSTO PUEL LTDA,04.308.320/0001-64,"RUA LATERAL, BR 101",S/N,KM 213,CENTRO,88130-040,DIESEL,19/06/2023,5.34,,R$ / litro,IPIRANGA,2023-11-21
S,SC,TUBARAO,COMERCIAL DE COMBUSTIVEIS SAO MARCOS LTDA,07.192.985/0001-43,RUA SEVERIANO ALBINO CORREA,567,,FABIO SILVA,88702-700,DIESEL,19/06/2023,4.69,,R$ / litro,BRANCA,2023-11-21
