CO,GO,VALPARAISO DE GOIAS,AUTO SHOPPING DERIVADOS DE PETROLEO LTDA,37.063.328/0012-10,RUA RIO DE JANEIRO,S/N,QUADRA04                  LOTE  08,PARQUE MARAJO,72874-212,DIESEL,28/06/2023,4.75,,R$ / litro,IPIRANGA,2023-11-21
N,RO,PORTO VELHO,NEYJHON COMÉRCIO DE DERIVADOS DE PETRÓLEO LTDA. - ME.,00.590.065/0001-34,AVENIDA CALAMA,5658,,FLODOALDO PONTES PINTO,78908-010,DIESEL,28/06/2023,5.15,,R$ / litro,BRANCA,2023-11-21
CO,GO,VALPARAISO DE GOIAS,AUTO SHOPPING DERIVADOS DE PETROLEO LTDA,37.063.328/0019-96,RUA 101,S/N,QUADRA134                 LOTE  2  3  E 4,JARDIM CEU AZUL,72871-101,DIESEL,26/06/2023,4.75,,R$ / litro,IPIRANGA,2023-11-21
SE,SP,ASSIS,POSTO PAULISTA BRUTUS LTDA,10.257.090/0001-54,AVENIDA ABILIO DUARTE DE SOUZA,887,,PARQUE DAS ACACIAS,19813-000,DIESEL,26/06/2023,5.74,,R$ / litro,RAIZEN,2023-11-21
NE,BA,POCOES,AUTO POSTO APACHE LTDA PP,09.153.856/0001-71,AVENIDA JUCELINO KUBISTCHECK,737-A,LOJA  01,PITUBA,45260-000,DIESEL,28/06/2023,4.44,,R$ / litro,RAIZEN,2023-11-21
SE,MG,UBERABA,AUTO POSTO RIBEIRO LTDA,04.173.913/0001-60,RUA JOAO DALLACQUA,540,,BEIJA FLOR,38051-331,DIESEL,29/06/2023,4.79,,R$ / litro,VIBRA ENERGIA,2023-11-21
SE,SP,ITU,NOSSO POSTO DE ITU LTDA,09.609.285/0001-37,RUA MAESTRO ISAIAS SPARANINZE BELCUFINE,114,,JARDIM PADRE BENTO,13313-103,DIESEL,29/06/2023,4.99,,R$ / litro,BRANCA,2023-11-21
NE,BA,JEQUIE,CIDADE NOVA COMERCIO DE DERIVADOS DE PETROLEO LTDA,10.298.695/0001-93,AVENIDA GOVERNADOR AURELIO RODRIGUES VIANA,80,,KENNEDY,45201-475,DIESEL,28/06/2023,4.89,,R$ / litro,VIBRA ENERGIA,2023-11-21
N,PA,CAMETA,M & M MEDEIROS LTDA,10.243.691/0001-08,RUA 23 DE NOVEMBRO,SN,,CENTRO,68400-000,DIESEL,27/06/2023,5.39,,R$ / litro,SABBÁ,2023-11-21
S,RS,OSORIO,KM 1 - COMERCIO DE COMBUSTIVEIS LTDA.,08.542.850/0002-04,RODOVIA BR 101,SN,KM    83.8,COSTA VERDE,95520-000,DIESEL,27/06/2023,4.59,,R$ / litro,VIBRA ENERGIA,2023-11-21
SE,MG,ARAGUARI,NETO COMERCIO DE COMBUSTIVEIS LTDA,08.369.237/0001-56,RODOVIA BR 050,S/N,KM 39,SUBURBIO,38442-239,DIESEL,27/06/2023,4.59,,R$ / litro,BRANCA,2023-11-21
SE,MG,PARACATU,COMERCIAL DE COMBUSTIVEIS PORTAL DE MINAS III LTDA,09.600.242/0001-90,RODOVIA MARGINAL BR 040,430,,ALTO DO CORREGO,38600-000,DIESEL,28/06/2023,5.12,,R$ / litro,ALESAT,2023-11-21
S,SC,SAO JOSE,AUTO POSTO VIADUTO LTDA,04.308.884/0004-40,AVENIDA JOSUE DI BERNARDI,981,,CAMPINAS,88101-201,DIESEL,27/06/2023,5.14,,R$ / litro,BRANCA,2023-11-21
CO,MT,CACERES,RODOMAX COMERCIO DE COMBUSTIVEIS LTDA,07.860.097/0003-13,RUA GENERAL OZORIO,1931,,CENTRO,78200-000,DIESEL,27/06/2023,4.9,,R$ / litro,BRANCA,2023-11-21
S,PR,ARAPONGAS,BREDA COMÉRCIO DE COMBUSTSTÍVEIS LTDA.,08.991.173/0001-20,AVENIDA MARACANÃ,3530,,VILA ARAPONGUINHA,86703-000,DIESEL,29/06/2023,4.79,,R$ / litro,RAIZEN,2023-11-21
NE,BA,VALENCA,IVANILTON ALCANTARA & CIA LTDA - EPP,09.224.069/0001-73,AVENIDA DENDEZEIROS,S/N,FIM DE ACESSO,GRACA,45400-000,DIESEL,26/06/2023,4.99,,R$ / litro,BRANCA,2023-11-21
SE,MG,GOVERNADOR VALADARES,AUTO POSTO BARROS MIRANDA LTDA,08.767.699/0001-21,AVENIDA DOUTOR RAIMUNDO MONTEIRO REZENDE,4585,,ALTINOPOLIS,35053-680,DIESEL,28/06/2023,4.79,,R$ / litro,VIBRA ENERGIA,2023-11-21
S,PR,CAMPO MOURAO,AUTO POSTO GARRA LTDA - ME,09.476.803/0001-91,RODOVIA BR 158,3025,AVELINO PIACENTINI,JD NOSSA SENHORA APARECIDA,87309-650,DIESEL,27/06/2023,4.59,,R$ / litro,STANG,2023-11-21
S,RS,NOVO HAMBURGO,ARGOS COMERCIAL DE COMBUSTIVEIS LTDA,00.959.052/0003-51,RUA SETE DE SETEMBRO,1270,,LIBERDADE,93332-365,DIESEL,26/06/2023,4.89,,R$ / litro,BRANCA,2023-11-21
S,RS,CACHOEIRINHA,VENICE POSTO DE SERVICOS LTDA,09.485.163/0001-86,AVENIDA GENERAL FLORES DA CUNHA,1617,,VILA IMBUHY,94910-002,DIESEL,28/06/2023,4.74,,R$ / litro,BRANCA,2023-11-21
S,SC,LAGES,STANG & STANG LTDA,08.033.253/0014-98,AVENIDA DOM PEDRO II,967,ESQ C/ RUA PARANA,SAO CRISTOVAO,88509-000,DIESEL,28/06/2023,4.99,,R$ / litro,STANG,2023-11-21
SE,ES,LINHARES,AUTO POSTO LINHARES LTDA,10.331.576/0001-95,AVENIDA JOSE TESCH,657,,SHELL,29901-500,DIESEL,28/06/2023,4.79,,R$ / litro,IPIRANGA,2023-11-21
SE,SP,ARARAQUARA,AUTO POSTO MEDITERRANEO DE ARARAQUARA LTDA,09.448.326/0001-50,AVENIDA ANTONIO DE PADUA CORREA,374,,CENTRO,14800-500,DIESEL,28/06/2023,5.19,,R$ / litro,RAIZEN,2023-11-21
S,PR,MARECHAL CANDIDO RONDON,M A TONIN & CIA LTDA,09.182.923/0001-86,AVENIDA RIO GRANDE DO SUL,7000,,BOA VISTA,85960-000,DIESEL,29/06/2023,4.87,,R$ / litro,RAIZEN,2023-11-21
S,PR,PARANAVAI,A M MEURER COMÉRCIO DE COMBUSTÍVEIS LTDA.,09.492.742/0001-56,RUA MANOEL RIBAS,1770,,CENTRO,87704-000,DIESEL,29/06/2023,4.99,,R$ / litro,BRANCA,2023-11-21
NE,MA,SAO JOSE DE RIBAMAR,POSTO ALIANCA LTDA,10.269.882/0001-49,"AVENIDA TANCREDO NEVES, 120","0,416666667",,VILA FLAMENGO,65110-000,DIESEL,27/06/2023,4.55,,R$ / litro,BRANCA,2023-11-21
S,RS,BAGE,COMERCIAL INTERNACIONAL LTDA,93.810.919/0003-93,RUA BARAO DO TRIUNFO,900,,CENTRO,96400-120,DIESEL,28/06/2023,6.06,,R$ / litro,IPIRANGA,2023-11-21
N,TO,ARAGUAINA,TOCA DA ONCA COMERCIO DE DERIVADOS DE PETROLEO LTDA,06.333.164/0001-17,AVENIDA FILADELFIA,1886,LT-01 DA QD-01,JARDIM ITATIAIA,77813-410,DIESEL,27/06/2023,5.29,,R$ / litro,VIBRA ENERGIA,2023-11-21
SE,SP,ITAQUAQUECETUBA,G.A.P. POSTO DE SERVICOS LTDA,10.444.611/0001-82,ESTRADA DO MANDI,1100,GLEBA 3B1,MANDI,08596-000,DIESEL,28/06/2023,5.19,,R$ / litro,IPIRANGA,2023-11-21
SE,SP,SAO BERNARDO DO CAMPO,COOPERATIVA DE CONSUMO DOS TRANSPORTADORES RODOVIARIOS AUTONOMOS DE TRANSPORTES DE VEICULOS (COOPERCEG),03.525.685/0004-20,RUA DOS FELTRINS,951,,DEMARCHI,09820-280,DIESEL,27/06/2023,4.58,,R$ / litro,BRANCA,2023-11-21
S,RS,PELOTAS,ABASTECEDORA DE COMBUSTIVEIS ROGUIL LTDA,09.557.442/0001-08,ESTRADA BR 392,12501,,FRAGATA,96050-500,DIESEL,27/06/2023,5.53,,R$ / litro,BRANCA,2023-11-21
SE,MG,LEOPOLDINA,POSTO FILINTO DE ANDRADE LTDA,08.638.750/0001-03,RODOVIA BR 116,S/N,KM 769 + 900 METROS,DA ONÇA,36700-000,DIESEL,28/06/2023,4.79,,R$ / litro,RAIZEN,2023-11-21
SE,ES,LINHARES,AUTO POSTO E SERVICOS BNH LTDA,07.584.368/0001-93,AVENIDA PRESIDENTE CAFE FILHO,SN,QUADRA 351-A,NOVO HORIZONTE,29902-400,DIESEL,26/06/2023,4.89,,R$ / litro,RAIZEN,2023-11-21
SE,MG,MONTES CLAROS,LPJ COMBUSTÍVEIS LTDA.,09.502.042/0001-03,AVENIDA MESTRA FININHA,3602,,AUGUSTA MOTA,39400-000,DIESEL,27/06/2023,4.99,,R$ / litro,IPIRANGA,2023-11-21
NE,MA,BARRA DO CORDA,G. A. MEDEIROS & CIA LTDA.,09.241.193/0001-47,AVENIDA ELIEZER MOREIRA,1,,VILA CANADÁ,65950-000,DIESEL,27/06/2023,4.85,,R$ / litro,BRANCA,2023-11-21
S,PR,MARINGA,POSTO ALDO MARINGA LTDA,09.428.424/0001-26,RODOVIA PR-317,5088,,GLEBA RIBEIRAO PINGUIM,87065-011,DIESEL,27/06/2023,4.74,,R$ / litro,BRANCA,2023-11-21
CO,MT,RONDONOPOLIS,AUTO POSTO BURITI LTDA,09.043.923/0001-03,AVENIDA GOIANIA,1747,,RESIDENCIAL BURITI,78715-020,DIESEL,29/06/2023,5.27,,R$ / litro,BRANCA,2023-11-21
S,PR,APUCARANA,M C S F COMBUSTIVEIS LTDA,09.620.780/0001-47,AVENIDA MINAS GERAIS,2191,,VILA NOVA,86804-000,DIESEL,27/06/2023,5.17,,R$ / litro,BRANCA,2023-11-21
SE,MG,CONGONHAS,POSTO CIRCUITO DO OURO LTDA,08.223.318/0001-43,RUA SANTO ANTONIO,319,,PRAIA,36415-000,DIESEL,27/06/2023,4.59,,R$ / litro,RAIZEN,2023-11-21
N,RO,CACOAL,BECHI & BECHI LTDA,10.473.085/0001-89,AVENIDA BELO HORIZONTE,2963,,CENTRO,78975-015,DIESEL,27/06/2023,5.4,,R$ / litro,IPIRANGA,2023-11-21
SE,SP,SANTOS,VIA PORTO COMERCIO E SERVICOS AUTOMOTIVOS LTDA,10.221.953/0001-33,AVENIDA GOVERNADOR MARIO COVAS JUNIOR,738,,ESTUARIO,11020-300,DIESEL,26/06/2023,5.19,,R$ / litro,IPIRANGA,2023-11-21
SE,SP,RIBEIRAO PRETO,POSTO ANTONIO MARTINEZ JUNIOR LTDA,10.442.027/0001-98,RUA FLAVIO CANESIN,15,,RECREIO DAS ACACIAS,14098-558,DIESEL,28/06/2023,5.19,,R$ / litro,VIBRA ENERGIA,2023-11-21
S,PR,CAMBE,C. DE PAULA & MONTEIRO LTDA,06.033.080/0001-68,RODOVIA MELLO PEIXOTO,S/N,KM 166,JARDIM UNIÃO,86185-700,DIESEL,27/06/2023,4.52,,R$ / litro,BRANCA,2023-11-21
CO,GO,ANAPOLIS,AUTO POSTO MASUT IX LTDA,10.384.624/0001-03,AVENIDA JK,2852,,JK NOVA CAPITAL,75105-080,DIESEL,27/06/2023,4.99,,R$ / litro,MASUT DISTRIBUIDORA,2023-11-21
N,AP,SANTANA,AEROPOSTO COMBUSTIVEIS AUTOMOTIVOS LTDA,08.580.311/0001-89,RUA CAPITAO EUCLIDES RODRIGUES,115,,CENTRAL,68925-192,DIESEL,27/06/2023,4.99,,R$ / litro,VIBRA ENERGIA,2023-11-21
NE,BA,EUNAPOLIS,AUTO POSTO DESEJO LTDA.,09.622.438/0001-86,AVENIDA DAVID JONAS FADINI,2798,,JUCA ROSA,45823-431,DIESEL,29/06/2023,4.89,,R$ / litro,BRANCA,2023-11-21
N,AM,MANAUS,COMSERVICO LTDA,03.552.884/0002-66,AVENIDA GRANDE CIRCULAR,101,LOTE  101-COM.ALIAN.C/DEUS,CIDADE NOVA,69099-785,DIESEL,27/06/2023,4.79,,R$ / litro,VIBRA ENERGIA,2023-11-21
N,PA,PARAGOMINAS,TAUARI COMERCIO DE COMBUSTIVEIS LTDA,10.266.958/0001-82,AVENIDA BELO HORIZONTE,S/N,"LOTES 01, 02, 03, 04      QUADRA 05, BLOCO 04",MODULO II,68626-290,DIESEL,28/06/2023,4.98,,R$ / litro,BRANCA,2023-11-21
CO,GO,AGUAS LINDAS DE GOIAS,AUTO POSTO JURACI JUNIOR LTDA - ME,09.373.967/0001-93,QUADRA 06,S/N,"LOTE  14, 15, 16",SETOR JARDIM QUERENCIA,72910-000,DIESEL,26/06/2023,4.79,,R$ / litro,BRANCA,2023-11-21
N,AC,CRUZEIRO DO SUL,MARCOS A.S. CORDEIRO,10.562.906/0001-53,ESTRADA DA VARIANTE,S/N,KM 01,MIRITIZAL,69980-000,DIESEL,26/06/2023,6.72,,R$ / litro,ATEM' S,2023-11-21
NE,PI,PICOS,",ANTONIO ROBERTO BATISTA",09.483.486/0001-30,AVENIDA SENADOR HELVIDIO NUNES,4416,,JUNCA,64600-000,DIESEL,28/06/2023,4.99,,R$ / litro,BRANCA,2023-11-21
N,AM,MANAUS,M. S. COMBUSTIVEIS LTDA.,10.570.884/0001-73,RUA MARIA ANDRADE,1240,,CRESPO,69073-010,DIESEL,26/06/2023,5.19,,R$ / litro,ATEM' S,2023-11-21
NE,MA,BACABAL,SOARES & NASCIMENTO LTDA,10.555.096/0001-08,ESTRADA BR 316 - KM 361,5,,CENTRO,65700-000,DIESEL,29/06/2023,5.09,,R$ / litro,IPIRANGA,2023-11-21
S,PR,CASTRO,POSTO SAFF LTDA,10.327.548/0001-02,RUA CORONEL OLEGARIO DE MACEDO,175,SALA 01,RIO BRANCO,84165-690,DIESEL,27/06/2023,4.79,,R$ / litro,IPIRANGA,2023-11-21
CO,GO,GOIANIA,POSTO JARDIM HELVECIA COMERCIO VAREJISTA DE COMBUSTIVEIS LTDA,02.287.610/0002-24,AVENIDA PRESIDENTE KENNEDY,1004,QD. 56 LT. 08,JARDIM SÃO JUDAS TADEU,74685-830,DIESEL,30/06/2023,4.54,,R$ / litro,IPIRANGA,2023-11-21
SE,SP,BARUERI,BETHA SERVICOS AUTOMOTIVOS LTDA.,04.718.285/0001-51,AVENIDA ANAPOLIS,204,,BETHAVILLE I,06404-250,DIESEL,27/06/2023,4.97,,R$ / litro,VIBRA ENERGIA,2023-11-21
CO,MT,VARZEA GRANDE,INOVAR COMERCIO DE COMBUSTIVEL LTDA,10.587.334/0001-67,RODOVIA MARIO ANDREAZZA,211,,GUARITA,78110-002,DIESEL,28/06/2023,4.74,,R$ / litro,BRANCA,2023-11-21
NE,BA,BARREIRAS,AUTO POSTO CENTER LTDA,08.113.064/0002-91,AVENIDA CLERISTON ANDRADE,1007,,CENTRO,47800-193,DIESEL,28/06/2023,5.09,,R$ / litro,VIBRA ENERGIA,2023-11-21
SE,SP,SAO BERNARDO DO CAMPO,MEGA POSTO ASSUNCAO LTDA,09.437.341/0001-01,AVENIDA CAPITAO CASA,1701,ANEXO 1703,DOS CASA,09812-000,DIESEL,27/06/2023,4.99,,R$ / litro,VIBRA ENERGIA,2023-11-21
SE,SP,PRESIDENTE PRUDENTE,AUTO POSTO ANA JACINTA LTDA,10.495.673/0001-13,AVENIDA CIDADE FUKUYAMA,67,,DISTRITO INDUSTRIAL BELMIRO MAGANINI,19064-210,DIESEL,28/06/2023,4.5,,R$ / litro,BRANCA,2023-11-21
NE,RN,NATAL,POSTO DA TAMARINEIRA LTDA,08.450.405/0001-33,RUA APODI,349,,CIDADE ALTA,59020-130,DIESEL,26/06/2023,4.68,,R$ / litro,VIBRA ENERGIA,2023-11-21
SE,MG,IPATINGA,POSTO ML 300 LTDA EPP,10.418.777/0001-24,AVENIDA MONTEIRO LOBATO,300,,CIDADE NOBRE,35162-394,DIESEL,28/06/2023,4.59,,R$ / litro,BRANCA,2023-11-21
S,PR,MARINGA,AMERICANO III AUTO POSTO LTDA,09.292.000/0001-87,RODOVIA PR-317,5989,"LOTE 201-A-1 REM,         SAIDA P/CAMPO MOURAO",PQ. INDUSTRIAL,87065-005,DIESEL,27/06/2023,5.06,,R$ / litro,IPIRANGA,2023-11-21
N,AM,MANAUS,V K COMERCIO DE DERIVADOS DE PETROLEO LTDA,10.264.755/0001-57,RUA DONA MIMI,555,,MORRO DA LIBERDADE,69074-760,DIESEL,26/06/2023,6.16,,R$ / litro,IPIRANGA,2023-11-21
SE,MG,MONTES CLAROS,TRIALEM COMBUSTIVEIS LTDA,10.572.553/0001-72,RODOVIA BR-365,267,LETRA: C; KM: 0 TREVO ANEL ROD SUL;,MAJOR PRATES,39403-203,DIESEL,27/06/2023,4.57,,R$ / litro,IPIRANGA,2023-11-21
CO,GO,AGUAS LINDAS DE GOIAS,AUTO POSTO J.J JUNIOR LTDA,10.515.562/0001-21,AVENIDA AVENIDA JK,S/N,"QUADRA45                  LOTE  06,07,08 E 09",SETOR JARDIM BRASILIA,72910-001,DIESEL,26/06/2023,4.79,,R$ / litro,BRANCA,2023-11-21
NE,BA,FEIRA DE SANTANA,POSTOS RENASCER LTDA.,10.603.039/0001-57,AVENIDA GOVERNADOR JOAO DURVAL CARNEIRO,3797,P.  DE COMBUSTIVEIS,CASEB,44052-064,DIESEL,29/06/2023,4.75,,R$ / litro,BRANCA,2023-11-21
S,SC,TUBARAO,REDE FURNAS COMERCIO DE COMBUSTIVEIS LTDA,01.387.686/0010-79,AVENIDA PATRICIO LIMA,90,,HUMAITA,88704-410,DIESEL,26/06/2023,5.39,,R$ / litro,IPIRANGA,2023-11-21
SE,SP,ITATIBA,CALOPSYTA COMERCIO DE COMBUSTIVEIS E DERIVADOS DE PETROLEO LTDA,10.785.683/0001-93,AVENIDA MARECHAL CASTELO BRANCO,760,,JARDIM DA LUZ,13255-350,DIESEL,27/06/2023,4.57,,R$ / litro,VIBRA ENERGIA,2023-11-21
SE,SP,FRANCA,POSTO ACESSO LIVRE LTDA - ME,10.555.147/0001-00,AV. DR. SEVERINO TOSTES MEIRELLES,2460,,DISTRITO INDUSTRIAL,14406-004,DIESEL,26/06/2023,4.63,,R$ / litro,BRANCA,2023-11-21
SE,MG,JUIZ DE FORA,AUTO POSTO PAPAGAIO LTDA,10.782.507/0001-06,AV. PRESIDENTE JUSCELINO KUBITSCHEK,5553,A,NOVA ERA,36087-000,DIESEL,26/06/2023,5.34,,R$ / litro,VIBRA ENERGIA,2023-11-21
NE,PI,PARNAIBA,BARBARA NUNES BARBOSA SANTOS LTDA,02.705.744/0002-18,RUA TABAJARA,551,,SAO FRANCISCO,64215-210,DIESEL,26/06/2023,5.25,,R$ / litro,ALESAT,2023-11-21
S,RS,PORTO ALEGRE,AUTO POSTO BOA VIAGEM LTDA,02.463.295/0003-20,AVENIDA A.J. RENNER,2255,,HUMAITA,90250-000,DIESEL,27/06/2023,5.25,,R$ / litro,IPIRANGA,2023-11-21
SE,RJ,VOLTA REDONDA,POSTO DE GASOLINA BARRETO E SILVA LTDA,08.962.639/0001-60,RODOVIA LUCIO MEIRA,299,299/001 E 299/002   KM    13                        BR 393,SAO LUIZ,27250-050,DIESEL,26/06/2023,4.89,,R$ / litro,BRANCA,2023-11-21
N,RO,ARIQUEMES,AUDI COMERCIO DE DERIVADOS DE PETROLEO LTDA EPP,10.320.118/0001-50,AVENIDA CANAÃ,4610,ESQ. C/ RUA CANARIO,SETOR 02,76873-294,DIESEL,26/06/2023,5.79,,R$ / litro,SABBÁ,2023-11-21
NE,PB,SOUSA,I. E. COMERCIO DE DERIVADOS DE PETROLEO LIMITADA,10.254.592/0001-21,RUA JOAO BOSCO MARQUES DE SOUSA,556,,GATO PRETO,58802-340,DIESEL,28/06/2023,4.95,,R$ / litro,BRANCA,2023-11-21
NE,SE,NOSSA SENHORA DO SOCORRO,PETROX COMERCIAL LTDA,05.297.480/0015-13,RODOVIA BR 101,S/N,KM 89,PARQUE DOS FAROIS,49160-000,DIESEL,28/06/2023,5.09,,R$ / litro,PETROX DISTRIBUIDORA,2023-11-21
N,AM,TEFE,G. A. L. AMORIM COMBUSTIVEL E NAVEGAÇÃO,10.627.465/0001-20,RUA DA PAZ,1289,,SÃO JOÃO,69470-000,DIESEL,27/06/2023,6.55,,R$ / litro,EQUADOR,2023-11-21
SE,SP,MIRASSOL,AUTO POSTO MIRAMAX LTDA,10.943.250/0001-19,RUA OSVALDO CRUZ,21-56,,CENTRO,15130-000,DIESEL,29/06/2023,4.99,,R$ / litro,BRANCA,2023-11-21
S,PR,APUCARANA,BRZ SUL COMERCIO DE COMBUSTIVEIS LTDA,10.601.388/0001-30,AVENIDA PARANA,196,,VILA CASSALA,86804-340,DIESEL,29/06/2023,5.14,,R$ / litro,IPIRANGA,2023-11-21
SE,RJ,PETROPOLIS,BR CORONEL VEIGA COMBUSTIVEIS LTDA,10.514.757/0001-57,RUA CORONEL VEIGA,687,,CORONEL VEIGA,25655-156,DIESEL,29/06/2023,4.89,,R$ / litro,VIBRA ENERGIA,2023-11-21
SE,SP,SOROCABA,EMERSON LEAO FEITOSA SOROCABA - ME,05.073.520/0001-48,AVENIDA IPANEMA,5060,,VILA NOVA SOROCABA,18070-671,DIESEL,28/06/2023,4.69,,R$ / litro,BRANCA,2023-11-21
SE,SP,EMBU DAS ARTES,RODOANEL SUL - COMERCIO VAREJISTA DE COMBUSTIVEIS LTDA,10.978.180/0001-34,RODOVIA REGIS BITTENCOURT (BR-116),S/N,ALT. KM 280,CENTRO,06830-000,DIESEL,26/06/2023,4.99,,R$ / litro,VIBRA ENERGIA,2023-11-21
CO,GO,RIO VERDE,VIOLETA VI AUTO POSTO LTDA,05.836.486/0001-16,AVENIDA PRESIDENTE VARGAS,341,,JARDIM PRESIDENTE,75903-290,DIESEL,26/06/2023,5.04,,R$ / litro,RAIZEN,2023-11-21
SE,SP,FRANCA,AUTO POSTO CITY PETROPOLIS LTDA,07.461.781/0001-60,AVENIDA RICARTE SOARES SILVA,"1,3",,JARDIM MARAMBAIA,14409-648,DIESEL,27/06/2023,4.89,,R$ / litro,VIBRA ENERGIA,2023-11-21
SE,SP,SAO VICENTE,AUTO POSTO NAUTICA FREI GASPAR LTDA,10.559.732/0001-70,RUA FREI GASPAR,3304,,CIDADE NAUTICA,11350-000,DIESEL,28/06/2023,4.92,,R$ / litro,BRANCA,2023-11-21
CO,GO,PORANGATU,J. M. DA SILVA & FILHOS LTDA,33.360.405/0002-70,AVENIDA BRASILIA,359,QUADRA1                   LOTE  0                   SALA  1,VILA CAVALCANTE,76550-000,DIESEL,27/06/2023,4.7,,R$ / litro,BRANCA,2023-11-21
NE,AL,MACEIO,PINTO E SARMENTO LTDA,01.774.803/0001-66,AVENIDA MENINO MARCELO,SN,VIA EXPRESSA,SERRARIA,57046-000,DIESEL,28/06/2023,4.49,,R$ / litro,BRANCA,2023-11-21
CO,GO,LUZIANIA,AUTO POSTO DOM VITAL II LTDA,10.751.904/0001-02,RUA SAO PAULO,S/N,CHACARAS VERA CRUZ        FAZENDA QUINTA GLEBA,CIDADE OSFAYA,72855-621,DIESEL,26/06/2023,4.75,,R$ / litro,BRANCA,2023-11-21
N,TO,ARAGUAINA,MADRIGAL COMÉRCIO DE COMBUSTÍVEIS LTDA.,10.656.087/0001-03,RUA PREFEITO JOAO DE SOUZA LIMA,25,QD. 63 - LOTE 1-A,SAO JOAO,77807-160,DIESEL,28/06/2023,4.99,,R$ / litro,VIBRA ENERGIA,2023-11-21
SE,MG,ARAXA,REDE DE POSTOS OLIVEIRA LTDA,11.165.625/0001-20,RUA UBERABA,990,,ALVORADA,38180-001,DIESEL,27/06/2023,4.99,,R$ / litro,TOTALENERGIES,2023-11-21
SE,MG,IPATINGA,COMERCIAL DE COMBUSTIVEIS BOM RETIRO LTDA,10.864.329/0001-54,RUA MARTIM AFONSO DE SOUZA,33,,BOM RETIRO,35160-235,DIESEL,27/06/2023,4.69,,R$ / litro,ALESAT,2023-11-21
SE,MG,IPATINGA,COMERCIAL DE COMBUSTIVEIS CARAVELAS LTDA,10.865.072/0001-55,RUA JUNDIAI,95,,CARAVELAS,35164-281,DIESEL,27/06/2023,4.69,,R$ / litro,ALESAT,2023-11-21
N,AM,MANAUS,AMAZON COMBUSTIVEIS PARA VEICULOS E CONSTRUCOES LTDA,10.988.014/0001-19,AVENIDA GRANDE OTELO,1902,CJ. CASTELO BRANCO,PARQUE 10,69055-021,DIESEL,26/06/2023,4.79,,R$ / litro,ATEM' S,2023-11-21
SE,ES,GUARAPARI,POSTO SOL COMERCIO DE COMBUSTIVEIS LTDA,10.405.989/0001-77,AVENIDA PADRE JOSE DE ANCHIETA,963,,PRAIA DO MORRO,29216-660,DIESEL,27/06/2023,6.19,,R$ / litro,RAIZEN,2023-11-21
SE,MG,JUIZ DE FORA,POSTO UNIVERSO LTDA,10.513.796/0001-30,RUA VITORINO BRAGA,700,,VITORINO BRAGA,36060-000,DIESEL,26/06/2023,5.05,,R$ / litro,VIBRA ENERGIA,2023-11-21
SE,MG,ITUIUTABA,POSTO EXPOPEC EIRELI,11.211.101/0001-28,AVENIDA NIVALDO INACIO MOREIRA,2500,,LAGOA AZUL I,38307-178,DIESEL,26/06/2023,4.89,,R$ / litro,BRANCA,2023-11-21
CO,GO,AGUAS LINDAS DE GOIAS,AUTO POSTO PONTEIO LTDA,11.030.816/0001-84,QUADRA 02,S/N,LOTE  01,VIVENDAS PARAISO,72925-109,DIESEL,26/06/2023,4.74,,R$ / litro,BRANCA,2023-11-21
CO,GO,FORMOSA,PARANA COMERCIO DE COMBUSTIVEIS E LUBRIFICANTES LTDA,11.216.796/0001-30,AVENIDA MAESTRO JOAO LUIZ DO ESPIRITO SANTO,1234,QUADRA01,PARQUE LAGUNA II,73814-005,DIESEL,28/06/2023,4.89,,R$ / litro,VIBRA ENERGIA,2023-11-21
NE,BA,FEIRA DE SANTANA,JMF - COMERCIO DE COMBUSTIVEIS LTDA,04.524.416/0003-21,RODOVIA BR-116,S/N,KM    425,NOVO HORIZONTE,44036-331,DIESEL,29/06/2023,5.14,,R$ / litro,IPIRANGA,2023-11-21
N,TO,ARAGUAINA,PREMIUM COMERCIO DE DERIVADOS DE PETROLEO LTDA,09.217.206/0001-42,AVENIDA JOSE DE BRITO SOARES,1101,,ANHANGUERA,77818-530,DIESEL,28/06/2023,4.98,,R$ / litro,RAIZEN,2023-11-21
SE,ES,ARACRUZ,AUTO POSTO E SERVICOS ARACRUZ - COLINA DE BELA VISTA LTDA,10.813.831/0001-36,AVENIDA CASTELO BRANCO,14,QUADRARC 06 -                   LOTEAMENTO COLINA,BELA VISTA,29192-066,DIESEL,26/06/2023,4.99,,R$ / litro,RAIZEN,2023-11-21
N,AM,MANAUS,AMAZON COMBUSTIVEIS PARA VEICULOS E CONSTRUCOES LTDA,10.988.014/0004-61,AVENIDA ITAUBA,44,,JORGE TEIXEIRA,69088-240,DIESEL,27/06/2023,4.79,,R$ / litro,SABBÁ,2023-11-21
S,PR,UMUARAMA,AUTO POSTO BALANCAO LTDA,10.976.494/0001-06,RUA JAMIL HELU,4535,ROD.PR 323 - KM 306,ZONA SUBURBANA,87507-015,DIESEL,26/06/2023,4.62,,R$ / litro,BRANCA,2023-11-21
SE,SP,VOTUPORANGA,KONSTRU COMERCIO DE DERIVADOS DE PETROLEO LTDA,10.458.824/0001-63,AVENIDA DEPUTADO AUREO FERREIRA,849,,VILA RECANTO DAS AGUAS,15503-415,DIESEL,26/06/2023,4.95,,R$ / litro,VIBRA ENERGIA,2023-11-21
SE,SP,PINDAMONHANGABA,AUTO POSTO MARECHAL PINDA LTDA,10.765.882/0001-30,RUA DOUTOR FREDERICO MACHADO,27,,CENTRO,12410-040,DIESEL,29/06/2023,4.82,,R$ / litro,BRANCA,2023-11-21
S,RS,CAXIAS DO SUL,SIM REDE DE POSTOS LTDA,07.473.735/0007-77,RODOVIA RS 122 KM 66,S/N,SALA A,FORQUETA,95115-550,DIESEL,28/06/2023,4.94,,R$ / litro,VIBRA ENERGIA,2023-11-21
CO,GO,TRINDADE,AUTO POSTO LIDERANÇA LTDA.,11.411.546/0001-51,AVENIDA MARGINAL SUL,2798,"QD. A -  LTS 05,06",VILA EMANUEL,75380-000,DIESEL,26/06/2023,4.69,,R$ / litro,ALESAT,2023-11-21
SE,SP,DRACENA,POSTO NACIONAL DE DRACENA LTDA,10.799.031/0001-08,RODOVIA COMANDANTE JOAO RIBEIRO DE BARROS KM 646,S/N,,PALMEIRAS,17900-000,DIESEL,28/06/2023,4.69,,R$ / litro,BRANCA,2023-11-21
S,RS,ALEGRETE,DIAS & COSTA COMERCIAL DE COMBUSTIVEIS LTDA,11.418.781/0001-55,RUA VENANCIO AIRES,12,,CENTRO,97541-500,DIESEL,27/06/2023,5.59,,R$ / litro,IPIRANGA,2023-11-21
CO,GO,TRINDADE,BATISTA E ESTANISLAU LTDA - ME,05.242.009/0001-22,AVENIDA JUSCELINO KUBITSCHEK,960,QUADRA142                 LOTE  08/10,VILA PAI ETERNO,75380-000,DIESEL,26/06/2023,4.69,,R$ / litro,BRANCA,2023-11-21
SE,MG,CARATINGA,POSTO DE COMBUSTIVEIS TEIXEIRA LTDA,11.533.358/0001-04,AVENIDA DARIO DE ANUNCIACAO GROSSI,139,,SALATIEL,35304-210,DIESEL,26/06/2023,5.09,,R$ / litro,ALESAT,2023-11-21
SE,SP,ITANHAEM,AUTO POSTO REOBOTE LTDA,11.145.534/0001-22,RUA EMIDIO DE SOUZA,820,,ESTANCIA BEIRA MAR,11740-000,DIESEL,29/06/2023,5.59,,R$ / litro,IPIRANGA,2023-11-21
S,RS,LAJEADO,COMERCIO DE COMBUSTIVEIS G.S. LTDA,07.878.095/0001-90,RUA JOAO FERNANDO SCHNEIDER,974,,JARDIM DO CEDRO,95901-486,DIESEL,27/06/2023,4.89,,R$ / litro,IPIRANGA,2023-11-21
S,RS,PORTO ALEGRE,SIM REDE DE POSTOS LTDA,07.473.735/0037-92,AVENIDA SAO PEDRO,55,,SAO GERALDO,90230-120,DIESEL,27/06/2023,5.19,,R$ / litro,VIBRA ENERGIA,2023-11-21
S,PR,FOZ DO IGUACU,AUTO POSTO FRONTEIRA LTDA.,11.404.603/0001-75,RUA PADRE BERNARDO PLATE,1750,,JARDIM POLO CENTRO,85863-719,DIESEL,27/06/2023,4.93,,R$ / litro,BRANCA,2023-11-21
S,RS,PASSO FUNDO,RICARDO BONAMIGO TONIAL - EIRELI,11.591.248/0001-90,AVENIDA BRASIL OESTE,2369,SALA  A,BOQUEIRAO,99025-004,DIESEL,28/06/2023,4.99,,R$ / litro,IPIRANGA,2023-11-21
SE,MG,JOAO PINHEIRO,BRANDAO DERIVADOS DE PETROLEO LTDA,07.375.638/0001-56,RUA OLIMPIO MARTINS DE ARAUJO,2356,,AEROPORTO,38770-000,DIESEL,26/06/2023,4.79,,R$ / litro,BRANCA,2023-11-21
SE,SP,AMERICANA,TREVO POSTO DE SERVICOS LTDA.,10.450.953/0001-05,AVENIDA HENRIQUE ROBERTO GUILHERME ALBERTO BRECHMACHER,1203,,JARDIM BRASIL,13474-140,DIESEL,28/06/2023,4.94,,R$ / litro,BRANCA,2023-11-21
SE,MG,ITAUNA,MARPETRO - COMERCIO E DISTRIBUICAO DE COMBUSTIVEIS LTDA,08.335.793/0001-01,RODOVIA MG-431,KM 40,552 METROS                POSTO DE GASOLINA,VILA TAVARES,35680-143,DIESEL,26/06/2023,4.69,,R$ / litro,ALESAT,2023-11-21
S,PR,MARECHAL CANDIDO RONDON,COOPERATIVA AGROINDUSTRIAL COPAGRIL,81.584.278/0046-57,AVENIDA MARIPA,2400,,CENTRO,85960-000,DIESEL,27/06/2023,4.94,,R$ / litro,VIBRA ENERGIA,2023-11-21
SE,SP,MOGI DAS CRUZES,AUTO POSTO THAI LTDA,11.307.867/0001-00,AVENIDA LAURINDO PEREIRA,145,,JUNDIAPEBA,08752-050,DIESEL,26/06/2023,4.67,,R$ / litro,RAIZEN,2023-11-21
N,RO,PORTO VELHO,RENASCER COMERCIO DE DERIVADOS DE PETROLEO LTDA. - EPP,11.255.697/0001-68,AVENIDA MAMORE,3993,,LAGOINHA,76829-628,DIESEL,27/06/2023,5.19,,R$ / litro,BRANCA,2023-11-21
SE,MG,ARAGUARI,POSTO NASCIMENTO LTDA,07.453.243/0002-05,PRAÇA JUVENIL ALVES DE MELO,131,,JARDIM REGINA,38440-140,DIESEL,27/06/2023,4.58,,R$ / litro,BRANCA,2023-11-21
SE,ES,ARACRUZ,AUTO POSTO BELA VISTA LTDA,11.446.647/0001-68,RUA FELISBERTO MODENESI,53,,BELA VISTA,29192-086,DIESEL,26/06/2023,4.89,,R$ / litro,BRANCA,2023-11-21
CO,GO,JATAI,ALVARO STERCHILE E CIA LTDA,11.468.773/0001-13,AVENIDA 31 DE MAIO,895,,EPAMINONDAS,75802-463,DIESEL,27/06/2023,4.98,,R$ / litro,RAIZEN,2023-11-21
SE,SP,COTIA,RECANTO DA GLORIA - COMERCIO VAREJISTA DE COMBUSTIVEIS LTDA,11.012.246/0001-08,AVENIDA JOAO PAULO ABLAS,1555,,JARDIM DA GLORIA,06711-250,DIESEL,29/06/2023,5.09,,R$ / litro,IPIRANGA,2023-11-21
SE,MG,UBERABA,MILANI GASPAROTO COMERCIO DE COMBUSTIVEIS E LOJA DE CONVENIENCIA LTDA.,11.718.183/0001-00,AVENIDA TONICO DOS SANTOS,738,,JARDIM INDUBERABA,38040-000,DIESEL,29/06/2023,4.74,,R$ / litro,BRANCA,2023-11-21
CO,GO,JATAI,AUTO POSTO ANHANGUERA EIRELI,11.598.080/0001-45,AVENIDA PROFESSOR EDVAN ASSIS MELO,1166,QUADRA0013                LOTE  0001,SETOR CENTRAL - PARTE BAIXA,75800-001,DIESEL,27/06/2023,4.74,,R$ / litro,BRANCA,2023-11-21
NE,BA,LIVRAMENTO DE NOSSA SENHORA,MACHADO & FILHOS LTDA,11.608.590/0001-56,AVENIDA LINDENBERG CARDOSO,171,CASA,TAQUARI,46140-000,DIESEL,27/06/2023,4.79,,R$ / litro,BRANCA,2023-11-21
N,AC,CRUZEIRO DO SUL,LUBRAS DISTRIBUIDORA LTDA,10.406.630/0001-14,AVENIDA CORONEL MANCIO LIMA,2800,,COPACABANA,69980-000,DIESEL,26/06/2023,6.73,,R$ / litro,IPIRANGA,2023-11-21
CO,MS,CAMPO GRANDE,ALLOY AUTO POSTO I LTDA,11.837.316/0001-59,AVENIDA FERNANDO CORREA DA COSTA,630,,CENTRO,79004-310,DIESEL,29/06/2023,4.9,,R$ / litro,BRANCA,2023-11-21
SE,SP,OURINHOS,POSTO CALIFORNIA DE OURINHOS LTDA,12.053.850/0001-37,RODOVIA BR-153,SN,,ZONA RURAL,19909-100,DIESEL,26/06/2023,5.53,,R$ / litro,VIBRA ENERGIA,2023-11-21
SE,MG,SABARA,POSTO AVIEN LTDA,08.799.288/0001-18,RODOVIA BR-381,S/N,KM    13,BORBA GATO,34730-010,DIESEL,26/06/2023,4.69,,R$ / litro,RAIZEN,2023-11-21
N,PA,ABAETETUBA,E M C COMERCIO DE REFINADOS DE PETROLEO LTDA,11.171.191/0002-51,RODOVIA DR JOAO MIRANDA KM 02,2940,,CRISTO REDENTOR,68440-000,DIESEL,28/06/2023,5.3,,R$ / litro,IPIRANGA,2023-11-21
N,AM,TEFE,A. M. DE FARIAS - EPP,84.455.633/0003-46,AVENIDA BRASIL,33,A,JURUA,69470-000,DIESEL,27/06/2023,6.57,,R$ / litro,ATEM' S,2023-11-21
S,PR,APUCARANA,CATUAI APUCARANA - COMERCIO DE COMBUSTIVEIS LTDA,11.313.479/0001-32,AVENIDA MINAS GERAIS,860,,JARDIM APUCARANA,86804-000,DIESEL,29/06/2023,5.13,,R$ / litro,BRANCA,2023-11-21
SE,SP,FRANCA,RFL FORMULA 1 AUTO POSTO LTDA,10.363.672/0001-15,AVENIDA HUGO BETARELLO,"5,071",,JARDIM CENTENARIO,14403-600,DIESEL,27/06/2023,4.69,,R$ / litro,RAIZEN,2023-11-21
SE,RJ,TERESOPOLIS,POSTO DE GASOLINA SAO JOSE DE TERESOPOLIS LTDA.,08.909.599/0001-92,RUA FILEUTERPE,389,,SAO PEDRO,25955-100,DIESEL,27/06/2023,4.86,,R$ / litro,BRANCA,2023-11-21
NE,BA,PORTO SEGURO,AUTO POSTO NAVEGANTES LTDA,07.200.913/0002-81,AVENIDA AYRTON SENA,23,,CAMBOLO,45810-000,DIESEL,26/06/2023,6.1,,R$ / litro,BRANCA,2023-11-21
S,RS,ALEGRETE,PRIMEIRO ALEGRETE COMERCIO DE COMBUSTIVEIS LTDA,11.711.842/0001-78,AVENIDA MARIZ E BARROS,830,,CENTRO,97542-450,DIESEL,27/06/2023,4.99,,R$ / litro,BRANCA,2023-11-21
SE,SP,HORTOLANDIA,JONELLUS AUTO SERVICO LTDA,04.238.666/0001-33,RUA NARA LEAO,381,,JARDIM SAO BENTO,13187-075,DIESEL,29/06/2023,4.69,,R$ / litro,BRANCA,2023-11-21
