NE,BA,FEIRA DE SANTANA,POSTOS RENASCER LTDA.,10.603.039/0002-38,AVENIDA EDUARDO FROES DA MOTA,18658,P. DE COMBUSTIVEIS,JARDIM CRUZEIRO,44024-066,DIESEL,22/06/2023,4.73,,R$ / litro,BRANCA,2023-11-21
S,SC,TUBARAO,REDE FURNAS COMERCIO DE COMBUSTIVEIS LTDA,01.387.686/0010-79,AVENIDA PATRICIO LIMA,90,,HUMAITA,88704-410,DIESEL,19/06/2023,5.39,,R$ / litro,IPIRANGA,2023-11-21
SE,SP,ITATIBA,CALOPSYTA COMERCIO DE COMBUSTIVEIS E DERIVADOS DE PETROLEO LTDA,10.785.683/0001-93,AVENIDA MARECHAL CASTELO BRANCO,760,,JARDIM DA LUZ,13255-350,DIESEL,21/06/2023,4.59,,R$ / litro,VIBRA ENERGIA,2023-11-21
NE,MA,SAO LUIS,DIMENSÃO DISTRIBUIDORA DE DERIVADOS DE PETROLEO LTDA,10.372.959/0001-01,RESIDENCIAL  ARARAS RUA 007 QUADRA I AREA REMANESCENTE,"0,041666667",,COHAMA,65062-708,DIESEL,20/06/2023,4.98,,R$ / litro,VIBRA ENERGIA,2023-11-21
S,PR,MARECHAL CANDIDO RONDON,",AUTO POSTO REGIÃO LTDA - ME.",07.463.700/0001-61,AVENIDA RIO GRANDE DO SUL,1049,,CENTRO,85960-000,DIESEL,22/06/2023,4.84,,R$ / litro,CIAPETRO,2023-11-21
SE,SP,FRANCA,POSTO ACESSO LIVRE LTDA - ME,10.555.147/0001-00,AV. DR. SEVERINO TOSTES MEIRELLES,2460,,DISTRITO INDUSTRIAL,14406-004,DIESEL,20/06/2023,4.63,,R$ / litro,BRANCA,2023-11-21
SE,MG,JUIZ DE FORA,AUTO POSTO PAPAGAIO LTDA,10.782.507/0001-06,AV. PRESIDENTE JUSCELINO KUBITSCHEK,5553,A,NOVA ERA,36087-000,DIESEL,20/06/2023,5.34,,R$ / litro,VIBRA ENERGIA,2023-11-21
SE,SP,RIBEIRAO PRETO,IGUATEMI AUTO SERVICE R2 LTDA,10.860.215/0001-36,RUA ARISTIDES BERNARDES BARRETO,410,,PARQUE RIBEIRAO PRETO,14031-120,DIESEL,19/06/2023,4.99,,R$ / litro,IPIRANGA,2023-11-21
NE,PI,PARNAIBA,BARBARA NUNES BARBOSA SANTOS LTDA,02.705.744/0002-18,RUA TABAJARA,551,,SAO FRANCISCO,64215-210,DIESEL,22/06/2023,5.25,,R$ / litro,ALESAT,2023-11-21
S,RS,PORTO ALEGRE,AUTO POSTO BOA VIAGEM LTDA,02.463.295/0003-20,AVENIDA A.J. RENNER,2255,,HUMAITA,90250-000,DIESEL,19/06/2023,5.65,,R$ / litro,IPIRANGA,2023-11-21
SE,RJ,VOLTA REDONDA,POSTO DE GASOLINA BARRETO E SILVA LTDA,08.962.639/0001-60,RODOVIA LUCIO MEIRA,299,299/001 E 299/002   KM    13                        BR 393,SAO LUIZ,27250-050,DIESEL,20/06/2023,4.89,,R$ / litro,BRANCA,2023-11-21
N,RO,ARIQUEMES,AUDI COMERCIO DE DERIVADOS DE PETROLEO LTDA EPP,10.320.118/0001-50,AVENIDA CANAÃ,4610,ESQ. C/ RUA CANARIO,SETOR 02,76873-294,DIESEL,19/06/2023,5.79,,R$ / litro,SABBÁ,2023-11-21
NE,SE,NOSSA SENHORA DO SOCORRO,PETROX COMERCIAL LTDA,05.297.480/0015-13,RODOVIA BR 101,S/N,KM 89,PARQUE DOS FAROIS,49160-000,DIESEL,22/06/2023,4.59,,R$ / litro,PETROX DISTRIBUIDORA,2023-11-21
N,AM,TEFE,G. A. L. AMORIM COMBUSTIVEL E NAVEGAÇÃO,10.627.465/0001-20,RUA DA PAZ,1289,,SÃO JOÃO,69470-000,DIESEL,20/06/2023,6.55,,R$ / litro,EQUADOR,2023-11-21
SE,SP,MIRASSOL,AUTO POSTO MIRAMAX LTDA,10.943.250/0001-19,RUA OSVALDO CRUZ,21-56,,CENTRO,15130-000,DIESEL,20/06/2023,4.99,,R$ / litro,BRANCA,2023-11-21
N,AM,MANAUS,IGAPÓ COMÉRCIO DE DERIVADOS DE PETRÓLEO LTDA.,10.897.820/0001-81,AVENIDA MARGARITA,1147,CONJUNTO HABITACIONAL NOVA CIDADE.,CIDADE NOVA,69094-770,DIESEL,20/06/2023,4.79,,R$ / litro,ATEM' S,2023-11-21
S,PR,UMUARAMA,AUTO POSTO 3 CAVALOS LTDA,10.798.580/0001-68,RUA MANOEL RAMIRES,5832,,RODOVIA,87507-011,DIESEL,21/06/2023,4.74,,R$ / litro,RAIZEN,2023-11-21
S,PR,APUCARANA,BRZ SUL COMERCIO DE COMBUSTIVEIS LTDA,10.601.388/0001-30,AVENIDA PARANA,196,,VILA CASSALA,86804-340,DIESEL,22/06/2023,5.14,,R$ / litro,IPIRANGA,2023-11-21
NE,RN,MOSSORO,MS COMERCIO DE DERIVADOS DE PETROLEO LTDA,10.797.331/0001-58,AVENIDA WILSON ROSADO,SN,,ABOLICAO,59612-625,DIESEL,21/06/2023,4.89,,R$ / litro,VIBRA ENERGIA,2023-11-21
S,PR,ASSIS CHATEAUBRIAND,LUCCA PETRO - COMBUSTÍVEIS LTDA.,10.883.397/0001-60,AVENIDA D. PEDRO II,500,,JARDIM EUROPA,85935-000,DIESEL,20/06/2023,4.64,,R$ / litro,BRANCA,2023-11-21
SE,SP,EMBU DAS ARTES,RODOANEL SUL - COMERCIO VAREJISTA DE COMBUSTIVEIS LTDA,10.978.180/0001-34,RODOVIA REGIS BITTENCOURT (BR-116),S/N,ALT. KM 280,CENTRO,06830-000,DIESEL,19/06/2023,4.99,,R$ / litro,VIBRA ENERGIA,2023-11-21
CO,GO,RIO VERDE,VIOLETA VI AUTO POSTO LTDA,05.836.486/0001-16,AVENIDA PRESIDENTE VARGAS,341,,JARDIM PRESIDENTE,75903-290,DIESEL,19/06/2023,5.04,,R$ / litro,RAIZEN,2023-11-21
SE,SP,RIBEIRAO PRETO,REDE MANAMBU DE POSTOS UNIDADE RIBEIRAO PRETO II LTDA,10.971.337/0001-08,AVENIDA PRESIDENTE VARGAS,"1,321",,AUTO DA BOA VISTA,14025-700,DIESEL,19/06/2023,4.99,,R$ / litro,VIBRA ENERGIA,2023-11-21
SE,SP,FRANCA,AUTO POSTO CITY PETROPOLIS LTDA,07.461.781/0001-60,AVENIDA RICARTE SOARES SILVA,"1,3",,JARDIM MARAMBAIA,14409-648,DIESEL,19/06/2023,4.89,,R$ / litro,VIBRA ENERGIA,2023-11-21
SE,SP,SAO VICENTE,AUTO POSTO NAUTICA FREI GASPAR LTDA,10.559.732/0001-70,RUA FREI GASPAR,3304,,CIDADE NAUTICA,11350-000,DIESEL,19/06/2023,4.92,,R$ / litro,BRANCA,2023-11-21
CO,GO,PORANGATU,J. M. DA SILVA & FILHOS LTDA,33.360.405/0002-70,AVENIDA BRASILIA,359,QUADRA1                   LOTE  0                   SALA  1,VILA CAVALCANTE,76550-000,DIESEL,19/06/2023,4.9,,R$ / litro,BRANCA,2023-11-21
SE,MG,DIVINOPOLIS,POSTO SOTERO OLIVEIRA LTDA,10.384.837/0001-35,RODOVIA MG-050,7700,,XAVANTE,35503-229,DIESEL,19/06/2023,4.59,,R$ / litro,BRANCA,2023-11-21
NE,AL,MACEIO,PINTO E SARMENTO LTDA,01.774.803/0001-66,AVENIDA MENINO MARCELO,SN,VIA EXPRESSA,SERRARIA,57046-000,DIESEL,20/06/2023,4.49,,R$ / litro,BRANCA,2023-11-21
SE,SP,VINHEDO,POSTO ICCAR LTDA,02.280.133/0037-03,AVENIDA INDEPENDÊNCIA,7700,,SANTA CLAUDINA,13280-000,DIESEL,19/06/2023,4.5,,R$ / litro,BRANCA,2023-11-21
CO,GO,LUZIANIA,AUTO POSTO DOM VITAL II LTDA,10.751.904/0001-02,RUA SAO PAULO,S/N,CHACARAS VERA CRUZ        FAZENDA QUINTA GLEBA,CIDADE OSFAYA,72855-621,DIESEL,20/06/2023,4.77,,R$ / litro,BRANCA,2023-11-21
N,TO,ARAGUAINA,MADRIGAL COMÉRCIO DE COMBUSTÍVEIS LTDA.,10.656.087/0001-03,RUA PREFEITO JOAO DE SOUZA LIMA,25,QD. 63 - LOTE 1-A,SAO JOAO,77807-160,DIESEL,21/06/2023,4.99,,R$ / litro,VIBRA ENERGIA,2023-11-21
SE,ES,LINHARES,POSTO TREVO DA PONTE LTDA,10.223.356/0001-48,AVENIDA GOVERNADOR JONES DOS SANTOS NEVES,160,,AVISO,29900-384,DIESEL,20/06/2023,4.79,,R$ / litro,IPIRANGA,2023-11-21
SE,MG,ARAXA,REDE DE POSTOS OLIVEIRA LTDA,11.165.625/0001-20,RUA UBERABA,990,,ALVORADA,38180-001,DIESEL,20/06/2023,4.99,,R$ / litro,TOTALENERGIES,2023-11-21
SE,MG,IPATINGA,COMERCIAL DE COMBUSTIVEIS BOM RETIRO LTDA,10.864.329/0001-54,RUA MARTIM AFONSO DE SOUZA,33,,BOM RETIRO,35160-235,DIESEL,19/06/2023,4.69,,R$ / litro,ALESAT,2023-11-21
N,AM,MANAUS,AMAZON COMBUSTIVEIS PARA VEICULOS E CONSTRUCOES LTDA,10.988.014/0003-80,AV. COSME FERREIRA,2719,,ALEIXO,69083-000,DIESEL,19/06/2023,4.79,,R$ / litro,ATEM' S,2023-11-21
SE,MG,IPATINGA,COMERCIAL DE COMBUSTIVEIS CARAVELAS LTDA,10.865.072/0001-55,RUA JUNDIAI,95,,CARAVELAS,35164-281,DIESEL,19/06/2023,4.69,,R$ / litro,ALESAT,2023-11-21
N,AM,MANAUS,AMAZON COMBUSTIVEIS PARA VEICULOS E CONSTRUCOES LTDA,10.988.014/0001-19,AVENIDA GRANDE OTELO,1902,CJ. CASTELO BRANCO,PARQUE 10,69055-021,DIESEL,19/06/2023,4.79,,R$ / litro,ATEM' S,2023-11-21
SE,ES,GUARAPARI,POSTO SOL COMERCIO DE COMBUSTIVEIS LTDA,10.405.989/0001-77,AVENIDA PADRE JOSE DE ANCHIETA,963,,PRAIA DO MORRO,29216-660,DIESEL,19/06/2023,6.19,,R$ / litro,RAIZEN,2023-11-21
SE,RJ,PETROPOLIS,POSTO SAO JUDAS TADEU DO RETIRO LTDA,10.770.531/0001-17,AVENIDA BARAO DO RIO BRANCO,2847,,CENTRO,25680-275,DIESEL,21/06/2023,4.79,,R$ / litro,ALESAT,2023-11-21
SE,SP,FRANCA,POSTO GÁVEA DERMÍNIO LTDA.,10.442.023/0001-00,AVENIDA NELSON NOGUEIRA,2181,,JARDIM DERMINIO,14406-730,DIESEL,20/06/2023,4.79,,R$ / litro,BRANCA,2023-11-21
S,RS,RIO GRANDE,ABASTECEDORA DE COMBUSTIVEIS LEAO S.A.,09.273.885/0004-10,RUA ROBERTO SOCOOWSKI,750,,VILA SAO JOAO,96213-000,DIESEL,20/06/2023,5.19,,R$ / litro,RODOIL,2023-11-21
SE,SP,SUMARE,AUTO POSTO SHANKAR LTDA,11.265.115/0001-24,AVENIDA DA AMIZADE,2635,,PQ DA AMIZADE,13175-375,DIESEL,21/06/2023,4.69,,R$ / litro,BRANCA,2023-11-21
SE,MG,JUIZ DE FORA,POSTO UNIVERSO LTDA,10.513.796/0001-30,RUA VITORINO BRAGA,700,,VITORINO BRAGA,36060-000,DIESEL,21/06/2023,5.45,,R$ / litro,VIBRA ENERGIA,2023-11-21
SE,SP,OURINHOS,AUTO POSTO MB-1 DE OURINHOS LTDA,11.338.293/0001-38,RUA DO EXPEDICIONARIO,2454,,VILA VILAR,19902-610,DIESEL,22/06/2023,4.79,,R$ / litro,BRANCA,2023-11-21
SE,MG,ITUIUTABA,POSTO EXPOPEC EIRELI,11.211.101/0001-28,AVENIDA NIVALDO INACIO MOREIRA,2500,,LAGOA AZUL I,38307-178,DIESEL,21/06/2023,4.89,,R$ / litro,BRANCA,2023-11-21
CO,GO,AGUAS LINDAS DE GOIAS,AUTO POSTO PONTEIO LTDA,11.030.816/0001-84,QUADRA 02,S/N,LOTE  01,VIVENDAS PARAISO,72925-109,DIESEL,19/06/2023,4.79,,R$ / litro,BRANCA,2023-11-21
CO,GO,FORMOSA,PARANA COMERCIO DE COMBUSTIVEIS E LUBRIFICANTES LTDA,11.216.796/0001-30,AVENIDA MAESTRO JOAO LUIZ DO ESPIRITO SANTO,1234,QUADRA01,PARQUE LAGUNA II,73814-005,DIESEL,21/06/2023,4.89,,R$ / litro,VIBRA ENERGIA,2023-11-21
CO,GO,GOIANIA,AUTO POSTO AGUIA DOURADA LTDA,07.098.743/0001-95,RUA SP 10,23,QD 02 LT 15/16,SETOR PERIM,74580-320,DIESEL,21/06/2023,4.64,,R$ / litro,BRANCA,2023-11-21
SE,ES,ARACRUZ,AUTO POSTO E SERVICOS ARACRUZ - COLINA DE BELA VISTA LTDA,10.813.831/0001-36,AVENIDA CASTELO BRANCO,14,QUADRARC 06 -                   LOTEAMENTO COLINA,BELA VISTA,29192-066,DIESEL,19/06/2023,4.99,,R$ / litro,RAIZEN,2023-11-21
N,AM,MANAUS,AMAZON COMBUSTIVEIS PARA VEICULOS E CONSTRUCOES LTDA,10.988.014/0004-61,AVENIDA ITAUBA,44,,JORGE TEIXEIRA,69088-240,DIESEL,20/06/2023,4.79,,R$ / litro,SABBÁ,2023-11-21
S,PR,UMUARAMA,AUTO POSTO BALANCAO LTDA,10.976.494/0001-06,RUA JAMIL HELU,4535,ROD.PR 323 - KM 306,ZONA SUBURBANA,87507-015,DIESEL,21/06/2023,4.62,,R$ / litro,BRANCA,2023-11-21
SE,SP,VOTUPORANGA,KONSTRU COMERCIO DE DERIVADOS DE PETROLEO LTDA,10.458.824/0001-63,AVENIDA DEPUTADO AUREO FERREIRA,849,,VILA RECANTO DAS AGUAS,15503-415,DIESEL,20/06/2023,4.95,,R$ / litro,VIBRA ENERGIA,2023-11-21
SE,SP,PINDAMONHANGABA,AUTO POSTO MARECHAL PINDA LTDA,10.765.882/0001-30,RUA DOUTOR FREDERICO MACHADO,27,,CENTRO,12410-040,DIESEL,22/06/2023,4.82,,R$ / litro,BRANCA,2023-11-21
S,RS,CAXIAS DO SUL,SIM REDE DE POSTOS LTDA,07.473.735/0007-77,RODOVIA RS 122 KM 66,S/N,SALA A,FORQUETA,95115-550,DIESEL,20/06/2023,4.94,,R$ / litro,VIBRA ENERGIA,2023-11-21
CO,GO,TRINDADE,AUTO POSTO LIDERANÇA LTDA.,11.411.546/0001-51,AVENIDA MARGINAL SUL,2798,"QD. A -  LTS 05,06",VILA EMANUEL,75380-000,DIESEL,20/06/2023,4.69,,R$ / litro,ALESAT,2023-11-21
SE,SP,DRACENA,POSTO NACIONAL DE DRACENA LTDA,10.799.031/0001-08,RODOVIA COMANDANTE JOAO RIBEIRO DE BARROS KM 646,S/N,,PALMEIRAS,17900-000,DIESEL,20/06/2023,4.72,,R$ / litro,BRANCA,2023-11-21
S,RS,ALEGRETE,DIAS & COSTA COMERCIAL DE COMBUSTIVEIS LTDA,11.418.781/0001-55,RUA VENANCIO AIRES,12,,CENTRO,97541-500,DIESEL,22/06/2023,5.79,,R$ / litro,IPIRANGA,2023-11-21
CO,GO,TRINDADE,BATISTA E ESTANISLAU LTDA - ME,05.242.009/0001-22,AVENIDA JUSCELINO KUBITSCHEK,960,QUADRA142                 LOTE  08/10,VILA PAI ETERNO,75380-000,DIESEL,20/06/2023,4.69,,R$ / litro,BRANCA,2023-11-21
SE,MG,CARATINGA,POSTO DE COMBUSTIVEIS TEIXEIRA LTDA,11.533.358/0001-04,AVENIDA DARIO DE ANUNCIACAO GROSSI,139,,SALATIEL,35304-210,DIESEL,19/06/2023,5.09,,R$ / litro,ALESAT,2023-11-21
SE,SP,ITANHAEM,AUTO POSTO REOBOTE LTDA,11.145.534/0001-22,RUA EMIDIO DE SOUZA,820,,ESTANCIA BEIRA MAR,11740-000,DIESEL,21/06/2023,5.59,,R$ / litro,IPIRANGA,2023-11-21
S,RS,PORTO ALEGRE,SIM REDE DE POSTOS LTDA,07.473.735/0037-92,AVENIDA SAO PEDRO,55,,SAO GERALDO,90230-120,DIESEL,19/06/2023,5.09,,R$ / litro,VIBRA ENERGIA,2023-11-21
S,PR,FOZ DO IGUACU,AUTO POSTO FRONTEIRA LTDA.,11.404.603/0001-75,RUA PADRE BERNARDO PLATE,1750,,JARDIM POLO CENTRO,85863-719,DIESEL,19/06/2023,5.05,,R$ / litro,BRANCA,2023-11-21
SE,MG,JOAO PINHEIRO,BRANDAO DERIVADOS DE PETROLEO LTDA,07.375.638/0001-56,RUA OLIMPIO MARTINS DE ARAUJO,2356,,AEROPORTO,38770-000,DIESEL,21/06/2023,4.79,,R$ / litro,BRANCA,2023-11-21
SE,MG,ITAUNA,MARPETRO - COMERCIO E DISTRIBUICAO DE COMBUSTIVEIS LTDA,08.335.793/0001-01,RODOVIA MG-431,KM 40,552 METROS                POSTO DE GASOLINA,VILA TAVARES,35680-143,DIESEL,19/06/2023,5.09,,R$ / litro,ALESAT,2023-11-21
S,PR,MARECHAL CANDIDO RONDON,COOPERATIVA AGROINDUSTRIAL COPAGRIL,81.584.278/0046-57,AVENIDA MARIPA,2400,,CENTRO,85960-000,DIESEL,20/06/2023,4.94,,R$ / litro,VIBRA ENERGIA,2023-11-21
S,PR,LONDRINA,D. Q. B. PETRÓLEO LTDA.,09.200.033/0001-50,RUA QUINTINO BOCAIUVA,686,,CENTRO,86020-150,DIESEL,19/06/2023,4.69,,R$ / litro,VIBRA ENERGIA,2023-11-21
SE,SP,MOGI DAS CRUZES,AUTO POSTO THAI LTDA,11.307.867/0001-00,AVENIDA LAURINDO PEREIRA,145,,JUNDIAPEBA,08752-050,DIESEL,19/06/2023,4.77,,R$ / litro,RAIZEN,2023-11-21
N,RO,PORTO VELHO,RENASCER COMERCIO DE DERIVADOS DE PETROLEO LTDA. - EPP,11.255.697/0001-68,AVENIDA MAMORE,3993,,LAGOINHA,76829-628,DIESEL,20/06/2023,5.19,,R$ / litro,BRANCA,2023-11-21
SE,MG,ARAGUARI,POSTO NASCIMENTO LTDA,07.453.243/0002-05,PRAÇA JUVENIL ALVES DE MELO,131,,JARDIM REGINA,38440-140,DIESEL,20/06/2023,4.58,,R$ / litro,BRANCA,2023-11-21
SE,ES,ARACRUZ,AUTO POSTO BELA VISTA LTDA,11.446.647/0001-68,RUA FELISBERTO MODENESI,53,,BELA VISTA,29192-086,DIESEL,19/06/2023,4.89,,R$ / litro,BRANCA,2023-11-21
CO,GO,JATAI,ALVARO STERCHILE E CIA LTDA,11.468.773/0001-13,AVENIDA 31 DE MAIO,895,,EPAMINONDAS,75802-463,DIESEL,20/06/2023,4.98,,R$ / litro,RAIZEN,2023-11-21
SE,SP,COTIA,RECANTO DA GLORIA - COMERCIO VAREJISTA DE COMBUSTIVEIS LTDA,11.012.246/0001-08,AVENIDA JOAO PAULO ABLAS,1555,,JARDIM DA GLORIA,06711-250,DIESEL,19/06/2023,5.09,,R$ / litro,IPIRANGA,2023-11-21
SE,MG,UBERABA,MILANI GASPAROTO COMERCIO DE COMBUSTIVEIS E LOJA DE CONVENIENCIA LTDA.,11.718.183/0001-00,AVENIDA TONICO DOS SANTOS,738,,JARDIM INDUBERABA,38040-000,DIESEL,20/06/2023,4.74,,R$ / litro,BRANCA,2023-11-21
CO,GO,JATAI,AUTO POSTO ANHANGUERA EIRELI,11.598.080/0001-45,AVENIDA PROFESSOR EDVAN ASSIS MELO,1166,QUADRA0013                LOTE  0001,SETOR CENTRAL - PARTE BAIXA,75800-001,DIESEL,20/06/2023,4.74,,R$ / litro,BRANCA,2023-11-21
NE,BA,LIVRAMENTO DE NOSSA SENHORA,MACHADO & FILHOS LTDA,11.608.590/0001-56,AVENIDA LINDENBERG CARDOSO,171,CASA,TAQUARI,46140-000,DIESEL,20/06/2023,4.79,,R$ / litro,BRANCA,2023-11-21
N,AC,CRUZEIRO DO SUL,LUBRAS DISTRIBUIDORA LTDA,10.406.630/0001-14,AVENIDA CORONEL MANCIO LIMA,2800,,COPACABANA,69980-000,DIESEL,20/06/2023,6.73,,R$ / litro,IPIRANGA,2023-11-21
N,PA,ABAETETUBA,E M C COMERCIO DE REFINADOS DE PETROLEO LTDA,11.171.191/0002-51,RODOVIA DR JOAO MIRANDA KM 02,2940,,CRISTO REDENTOR,68440-000,DIESEL,21/06/2023,5.3,,R$ / litro,IPIRANGA,2023-11-21
N,AM,TEFE,A. M. DE FARIAS - EPP,84.455.633/0003-46,AVENIDA BRASIL,33,A,JURUA,69470-000,DIESEL,20/06/2023,6.57,,R$ / litro,ATEM' S,2023-11-21
S,PR,APUCARANA,CATUAI APUCARANA - COMERCIO DE COMBUSTIVEIS LTDA,11.313.479/0001-32,AVENIDA MINAS GERAIS,860,,JARDIM APUCARANA,86804-000,DIESEL,22/06/2023,5.13,,R$ / litro,BRANCA,2023-11-21
SE,SP,FRANCA,RFL FORMULA 1 AUTO POSTO LTDA,10.363.672/0001-15,AVENIDA HUGO BETARELLO,"5,071",,JARDIM CENTENARIO,14403-600,DIESEL,20/06/2023,4.89,,R$ / litro,RAIZEN,2023-11-21
SE,RJ,TERESOPOLIS,POSTO DE GASOLINA SAO JOSE DE TERESOPOLIS LTDA.,08.909.599/0001-92,RUA FILEUTERPE,389,,SAO PEDRO,25955-100,DIESEL,20/06/2023,4.86,,R$ / litro,BRANCA,2023-11-21
NE,BA,PORTO SEGURO,AUTO POSTO NAVEGANTES LTDA,07.200.913/0002-81,AVENIDA AYRTON SENA,23,,CAMBOLO,45810-000,DIESEL,20/06/2023,6.1,,R$ / litro,BRANCA,2023-11-21
S,RS,ALEGRETE,PRIMEIRO ALEGRETE COMERCIO DE COMBUSTIVEIS LTDA,11.711.842/0001-78,AVENIDA MARIZ E BARROS,830,,CENTRO,97542-450,DIESEL,22/06/2023,4.99,,R$ / litro,BRANCA,2023-11-21
N,RO,JI-PARANA,AUTO POSTO SANTA FE LTDA,11.996.688/0001-28,AVENIDA MARECHAL RONDON,1238,SALA  01,CENTRO,76900-100,DIESEL,20/06/2023,5.85,,R$ / litro,SABBÁ,2023-11-21
SE,SP,SUZANO,AUTO POSTO FRANCISCO MARENGO LTDA,11.614.172/0001-71,AVENIDA FRANCISCO MARENGO,1852,,JARDIM DONA BENTA,08694-000,DIESEL,19/06/2023,5.17,,R$ / litro,IPIRANGA,2023-11-21
CO,GO,MORRINHOS,ROMANO & PERFEITO LTDA.,11.635.906/0001-07,RUA GOIAS,885,,CENTRO,75650-000,DIESEL,21/06/2023,4.74,,R$ / litro,BRANCA,2023-11-21
S,RS,CACHOEIRINHA,CONJUNTO COMERCIAL OREL LTDA,01.367.677/0005-59,AVENIDA FREDERICO AUGUSTO RITTER,705,CITY NOVA FASE,DISTRITO INDUSTRIAL,94930-000,DIESEL,20/06/2023,4.99,,R$ / litro,BRANCA,2023-11-21
N,RO,PORTO VELHO,AMAZON COMBUSTIVEIS PARA VEICULOS E CONSTRUCOES LTDA,10.988.014/0006-23,AVENIDA GOVERNADOR JORGE TEIXEIRA,3097,,LIBERDADE,76803-859,DIESEL,20/06/2023,5.49,,R$ / litro,ATEM' S,2023-11-21
SE,MG,UBERLANDIA,ALTO UMUARAMA COMBUSTIVEIS LTDA,04.748.235/0001-17,AVENIDA DOM PEDRO II,1670,,CUSTODIO PEREIRA,38405-280,DIESEL,20/06/2023,4.69,,R$ / litro,BRANCA,2023-11-21
S,SC,BALNEARIO CAMBORIU,REDE ECONOMIC COMERCIO DE COMBUSTIVEIS LTDA,08.940.015/0002-22,RODOVIA BR-101,KM 138,,NOVA ESPERANCA,88336-200,DIESEL,19/06/2023,4.89,,R$ / litro,AMERICANOIL,2023-11-21
S,PR,CIANORTE,AUTO POSTO MARANHAO EIRELI,11.852.329/0001-05,AVENIDA MARANHAO,2091,,ZONA 07,87208-150,DIESEL,21/06/2023,4.49,,R$ / litro,BRANCA,2023-11-21
NE,AL,DELMIRO GOUVEIA,LOURENCO ARAUJO FORTES E FILHOS LTDA  - ME,10.427.868/0001-26,AVENIDA CAXANGA,623,,PEDRA VELHA,57480-000,DIESEL,20/06/2023,5.75,,R$ / litro,BRANCA,2023-11-21
CO,MT,VARZEA GRANDE,POSTO PLANALTO IPIRANGA LTDA,11.200.027/0001-44,RUA PRESIDENTE EPITACIO PESSOA,567,,PLANALTO IPIRANGA II,78150-000,DIESEL,21/06/2023,4.85,,R$ / litro,BRANCA,2023-11-21
SE,MG,SAO SEBASTIAO DO PARAISO,FCQ AUTO POSTO LTDA,12.387.244/0001-58,AVENIDA OLIVEIRA RESENDE,691,LETRA: A;,JARDIM VITORIA I,37950-000,DIESEL,20/06/2023,4.99,,R$ / litro,VIBRA ENERGIA,2023-11-21
NE,BA,JEQUIE,COMERCIAL DE DERIVADOS DE PETROLEO UNIPETRO LTDA,05.512.621/0001-78,"AVENIDA LANDULFO CARIBE,  LOTES 08 E 09",S/N,LOT.CICERO BRITO,CENTRO,45200-160,DIESEL,20/06/2023,4.85,,R$ / litro,BRANCA,2023-11-21
NE,MA,PINHEIRO,D M DINIZ EIRELI,11.025.506/0001-71,AVENIDA PAULO RAMOS,645,,CENTRO,65200-000,DIESEL,19/06/2023,5.09,,R$ / litro,BRANCA,2023-11-21
SE,SP,ARARAS,PARAZZI COMBUSTIVEIS LTDA.,12.324.572/0001-05,AVENIDA DONA RENATA - SUL,4488,,JARDIM CAMBUI,13602-046,DIESEL,20/06/2023,4.95,,R$ / litro,RAIZEN,2023-11-21
SE,RJ,NOVA IGUACU,POSTO DE COMBUSTÍVEIS MAIOR DA POSSE LTDA.,05.791.833/0001-31,AVENIDA HENRIQUE DUQUE ESTRADA MEYER,1070,,POSSE,26030-380,DIESEL,20/06/2023,5.09,,R$ / litro,BRANCA,2023-11-21
S,RS,ALVORADA,HORN COMERCIO DE COMBUSTIVEIS LTDA,10.864.900/0001-30,AVENIDA PRESIDENTE VARGAS,2358,,BELA VISTA,94810-001,DIESEL,20/06/2023,5.35,,R$ / litro,VIBRA ENERGIA,2023-11-21
SE,MG,JUIZ DE FORA,POSTO CARRETAO LTDA,12.082.615/0001-93,RODOVIA BR-040,SN,: KM 783;,SANTA CRUZ,36088-410,DIESEL,20/06/2023,4.84,,R$ / litro,BRANCA,2023-11-21
NE,BA,FEIRA DE SANTANA,R. M. COMERCIAL DE COMBUSTÍVEIS LTDA.,12.392.654/0001-97,AVENIDA ANTONIO SERGIO CARNEIRO,1210,,SANTO ANTONIO DOS PRAZERES,44071-270,DIESEL,20/06/2023,4.56,,R$ / litro,BRANCA,2023-11-21
N,TO,GURUPI,POSTO FABRIL COM DE COMBUSTIVEIS E LUBRIFICANTES LTDA,11.759.922/0001-01,AVENIDA GOIAS,"1,92",QUADRA07                  LOTE  01,SETOR CENTRAL,77410-010,DIESEL,19/06/2023,5.09,,R$ / litro,ALESAT,2023-11-21
S,RS,VIAMAO,POSTO DE COMBUSTIVEL DA FIGUEIRA EIRELI,02.308.408/0002-31,AVENIDA SENADOR SALGADO FILHO,9565,,COHAB,94435-000,DIESEL,19/06/2023,4.66,,R$ / litro,RAIZEN,2023-11-21
N,AM,MANAUS,A. M. MOURA DOS SANTOS & CIA. LTDA.,11.519.227/0001-64,AVENIDA ARQ JOSE HENRIQUE B. RODRIGUES,15,,COLONIA TERRA NOVA,69030-000,DIESEL,20/06/2023,4.89,,R$ / litro,ATEM' S,2023-11-21
S,RS,PASSO FUNDO,JCA COMERCIO DE COMBUSTIVEIS LTDA,12.538.036/0001-02,RUA BENJAMIN CONSTANT,875,,CENTRO,99010-130,DIESEL,20/06/2023,4.59,,R$ / litro,VIBRA ENERGIA,2023-11-21
S,RS,CACHOEIRA DO SUL,POSTO DE COMBUSTIVEIS DAL RI LTDA.,08.824.904/0002-24,"RUA MARCELO GAMA, ESQUINA BENTO GONCALVES",625,,UNIVERSITARIO,96503-261,DIESEL,21/06/2023,4.84,,R$ / litro,RAIZEN,2023-11-21
S,RS,SAO LEOPOLDO,PETROSINOS COMERCIO DE COMBUSTIVEIS LTDA,11.272.674/0001-61,AVENIDA SENADOR SALGADO FILHO,1670,,SCHARLAU,93125-000,DIESEL,19/06/2023,4.6,,R$ / litro,BRANCA,2023-11-21
CO,DF,BRASILIA,PETRONORTE COMBUSTIVEIS LTDA,06.071.706/0003-92,"RODOVIA DF-290 KM 1,2 CHACARA",12,,NUCLEO RURAL HORTIGRANJEIRO DE SANTA MARIA,72578-000,DIESEL,20/06/2023,4.89,,R$ / litro,IPIRANGA,2023-11-21
SE,MG,SETE LAGOAS,POSTO VOLKSSETE LTDA,06.925.199/0001-45,AVENIDA PREFEITO ALBERTO MOURA,2000,,MATA GRANDE,35702-383,DIESEL,19/06/2023,4.68,,R$ / litro,VIBRA ENERGIA,2023-11-21
NE,BA,JACOBINA,TRANSVALE DERIVADOS DE PETROLEO LTDA,11.271.229/0002-68,RUA ORLANDO OLIVEIRA PIRES,1164,TERREO,CENTRO,44700-000,DIESEL,21/06/2023,5.54,,R$ / litro,IPIRANGA,2023-11-21
N,PA,CONCEICAO DO ARAGUAIA,PONTO CERTO COMERCIO VAREJISTA DE COMBUSTIVEL LTDA,10.750.422/0001-38,AVENIDA GOV. FERNANDO GUILHON,1300,,SAO LUIZ II,68540-000,DIESEL,20/06/2023,5.62,,R$ / litro,BRANCA,2023-11-21
SE,SP,JABOTICABAL,AUTO POSTO ELDORADO DE JABOTICABAL LTDA,12.799.622/0001-00,AVENIDA CARLOS BERCHIERI,2525,,CIDADE JARDIM,14890-400,DIESEL,19/06/2023,4.89,,R$ / litro,RAIZEN,2023-11-21
SE,RJ,DUQUE DE CAXIAS,AUTO POSTO ESTRELA DO GRAMACHO LTDA,12.117.688/0001-73,AVENIDA PRESIDENTE KENNEDY,4378,PARTE,VILA CENTENARIO,25030-002,DIESEL,21/06/2023,4.59,,R$ / litro,BRANCA,2023-11-21
SE,RJ,SAO GONCALO,GAZPARK PARTICIPACOES LTDA,04.830.682/0001-10,AVENIDA VISCONDE DE SANTAREM,651,"LOTE  01 , 02 , A , B",TRIBOBO,24753-560,DIESEL,19/06/2023,5.26,,R$ / litro,BRANCA,2023-11-21
S,SC,CACADOR,AUTO POSTO VERENKA LTDA.,07.602.682/0002-32,RODOVIA HONORINO MORO,755,,MARTELLO,89500-001,DIESEL,20/06/2023,5.05,,R$ / litro,BRANCA,2023-11-21
CO,GO,PORANGATU,AUTO POSTO K 59 EIRELI,12.760.317/0001-05,RODOVIA BR 153,SN,KM    82,ZONA RURAL,76550-000,DIESEL,20/06/2023,4.89,,R$ / litro,VIBRA ENERGIA,2023-11-21
NE,BA,GUANAMBI,POSTO GRUTA DA LAPA LTDA,02.268.356/0003-06,AVENIDA DEOLINDA MARTINS,561,,SANTO ANTONIO,46430-000,DIESEL,20/06/2023,5.05,,R$ / litro,VIBRA ENERGIA,2023-11-21
SE,SP,SUMARE,GOLDEN SUMARE AUTO POSTO LTDA,11.967.543/0001-07,AVENIDA UM,5985,,JARDIM NOVA TERRA (NOVA VENEZA),13179-060,DIESEL,21/06/2023,4.49,,R$ / litro,BRANCA,2023-11-21
CO,MT,SINOP,C MITIKO SACUNO,04.695.497/0001-60,AVENIDA BRUNO MARTINI,45,,LOTEAMENTO VILLAGE,78555-288,DIESEL,22/06/2023,5.79,,R$ / litro,VIBRA ENERGIA,2023-11-21
NE,BA,SALVADOR,POSTO TRANSICAO LTDA,12.149.827/0001-40,AVENIDA BARROS REIS,2930,,RETIRO,41204-025,DIESEL,20/06/2023,4.46,,R$ / litro,BRANCA,2023-11-21
S,PR,SAO JOSE DOS PINHAIS,VIA 277 AUTO POSTO LTDA,11.011.242/0001-05,AVENIDA RUI BARBOSA,2661,,JARDIM YPE,83055-320,DIESEL,20/06/2023,4.79,,R$ / litro,IPIRANGA,2023-11-21
NE,BA,TEIXEIRA DE FREITAS,AUTO POSTO TX BA LTDA,12.928.630/0001-00,RODOVIA BR101,SN,KM    884,NOVA JERUSALEM,45989-220,DIESEL,21/06/2023,4.58,,R$ / litro,VIBRA ENERGIA,2023-11-21
S,RS,LAJEADO,COMERCIO DE COMBUSTIVEIS FLORESTAL LTDA,02.558.109/0005-06,RODOVIA ERS-421,1721,,CONVENTOS,95906-380,DIESEL,20/06/2023,4.59,,R$ / litro,VIBRA ENERGIA,2023-11-21
S,RS,VACARIA,SIM REDE DE POSTOS LTDA,07.473.735/0043-30,ESTRADA BR 116 KM 37,9933,,MONTE CLARO,95204-102,DIESEL,19/06/2023,4.69,,R$ / litro,RAIZEN,2023-11-21
SE,SP,MATAO,AUTO POSTO WASHINGTON LUIZ KM 295 LTDA,12.889.661/0001-07,RODOVIA WASHINGTON LUIZ,S/N,KM 295 + 460M,BOA VISTA,15993-500,DIESEL,19/06/2023,4.59,,R$ / litro,VIBRA ENERGIA,2023-11-21
CO,DF,BRASILIA,PETRONORTE COMBUSTIVEIS LTDA,06.071.706/0004-73,QUADRA QI 616 CONJUNTO I LOTE,3,,SAMAMBAIA,72310-108,DIESEL,20/06/2023,4.82,,R$ / litro,IPIRANGA,2023-11-21
NE,RN,NATAL,CAVALCANTI & ROCHA LTDA,04.652.899/0003-40,AVENIDA DOUTOR JOÃO MEDEIROS FILHO,501,,IGAPO,59104-200,DIESEL,19/06/2023,4.99,,R$ / litro,ALESAT,2023-11-21
CO,GO,LUZIANIA,AUTO POSTO DOM VITAL III LTDA,12.095.566/0001-23,QUADRA 06 RUA,6,LOTE  19 A 23 E                 51 A 55,JARDIM ZULEIKA MARIA DE BRASILIA,72850-570,DIESEL,20/06/2023,4.79,,R$ / litro,BRANCA,2023-11-21
CO,GO,CALDAS NOVAS,SGM COMBUSTIVEIS LTDA,11.375.810/0001-49,AVENIDA GUARAPARI,SN,QUADRA05                  LOTE  15-A,CALDAS DO OESTE,75680-001,DIESEL,19/06/2023,4.87,,R$ / litro,BRANCA,2023-11-21
SE,SP,ITAPIRA,AUTO POSTO DESCANSENSE LTDA,12.404.915/0001-41,RODOVIA SP 352,S N,KM 177 MAIS 130 M,DISTRITO BARAO ATALIBA NOGUEIRA,13973-150,DIESEL,20/06/2023,4.74,,R$ / litro,IPIRANGA,2023-11-21
S,PR,CASCAVEL,PEGORARO E PEGORARO LTDA,12.838.425/0001-53,AVENIDA BRASIL,4487,,CENTRO,85812-002,DIESEL,22/06/2023,4.89,,R$ / litro,RAIZEN,2023-11-21
NE,BA,PORTO SEGURO,EDU COMERCIO DE COMBUSTÍVEIS LTDA.,13.037.906/0001-22,PRAÇA LAGOA DA GIA,410,,PR,45810-000,DIESEL,20/06/2023,5.84,,R$ / litro,BRANCA,2023-11-21
CO,GO,MINEIROS,POSTO COQUEIROS LTDA,12.295.090/0001-74,AVENIDA INO REZENDE,S/N,QUADRA04                  LOTE  01 A 08 E 19 E 20,COHACOL TRES,75830-002,DIESEL,20/06/2023,4.99,,R$ / litro,BRANCA,2023-11-21
S,PR,FOZ DO IGUACU,TEIXEIRA COMERCIO DE COMBUSTIVEIS LTDA,12.323.271/0001-67,RODOVIA BR-277,8870,,TRES LAGOAS,85862-409,DIESEL,20/06/2023,5.59,,R$ / litro,RAIZEN,2023-11-21
SE,SP,JALES,AUTO POSTO MALONI LTDA,11.690.729/0002-34,RUA AYRTON SENNA DA SILVA,360,,JARDIM ACLIMACAO,15700-000,DIESEL,22/06/2023,4.89,,R$ / litro,BRANCA,2023-11-21
S,RS,NOVO HAMBURGO,SIM REDE DE POSTOS LTDA,07.473.735/0045-00,RUA RINCAO,200,,RINCAO,93310-460,DIESEL,19/06/2023,4.84,,R$ / litro,VIBRA ENERGIA,2023-11-21
S,RS,NOVO HAMBURGO,SIM REDE DE POSTOS LTDA,07.473.735/0044-11,AVENIDA PEDRO ADAMS FILHO,3912,,PATRIA NOVA,93320-005,DIESEL,19/06/2023,4.84,,R$ / litro,VIBRA ENERGIA,2023-11-21
S,PR,GUARAPUAVA,ANTONIO STANG COMERCIO DE COMBUSTIVEIS LTDA  - ME,11.828.281/0001-91,RUA CAPITAO ROCHA,2770,,CENTRO,85010-270,DIESEL,19/06/2023,4.64,,R$ / litro,STANG,2023-11-21
S,PR,FOZ DO IGUACU,AUTO POSTO PRISMA LTDA,11.517.086/0001-40,AVENIDA JUSCELINO KUBITSCHECK,4437,,VILA PORTES,85865-000,DIESEL,19/06/2023,5.39,,R$ / litro,IPIRANGA,2023-11-21
NE,MA,CAXIAS,POSTO SANTA RITA COMERCIO DE COMBUSTIVEIS E LUBRIFICANTES LTDA,12.286.629/0001-29,RODOVIA BR-316,SN,"KM: 550,3;",VOLTA REDONDA,65606-525,DIESEL,21/06/2023,4.64,,R$ / litro,SABBÁ,2023-11-21
S,PR,MARINGA,DIGOS VILA NOVA COMERCIO DE COMBUSTIVEIS LTDA,12.277.832/0001-39,AVENIDA PIONEIRO HENRIQUE BULA,4100,,JARDIM INTERNORTE,87045-053,DIESEL,21/06/2023,4.99,,R$ / litro,VIBRA ENERGIA,2023-11-21
NE,SE,NOSSA SENHORA DO SOCORRO,A. C. DERIVADOS DE PETROLEO LTDA,11.439.151/0001-67,RODOVIA BR 101,S/N,KM    89,PALESTINA,49160-000,DIESEL,22/06/2023,4.65,,R$ / litro,BRANCA,2023-11-21
